role,content,created_at
user,ik ben klaar om te beginnen,2025-09-17T13:15:24.495957+00:00
assistant,"Hier is de casus nog een keer om het onderwerp te kaderen:

**Vignette:**  
Een gezonde 25-jarige vrouw had routine prenatale controles. Bij een echo na 24 weken werd een kleine opening (~5 mm) aan de rechterzijde van de buik van de baby, naast de navelstreng, gezien. Genetisch onderzoek (vruchtwaterpunctie) op 26 weken was normaal. De opening werd groter (tot 34 mm) en delen van de darmen waren zichtbaar buiten de buik, zwevend in het vruchtwater. De baby was kleiner dan verwacht. Bij 37 weken werd een keizersnede gedaan. De pasgeboren jongen had delen van zijn darmen en maag buiten de buik liggen. Het ondersteunende weefsel was kort en de darmen waren gezwollen. De diagnose was gastroschisis, een defect van de buikwand.

Laten we starten met een *wat*-vraag:

**Wat is embryonale oprichting (embryonic folding)?**",2025-09-17T13:15:56.88636+00:00
user,"dat is het proces in de eerste weken van de zwangerschap, waar we van 2 laags naar 3 laags gaan, de neurale buis gaat sluiten en er vindt vorming plaats.",2025-09-17T13:17:30.607087+00:00
assistant,"Je zit goed als het gaat om vroege ontwikkeling en vormverandering, maar laten we het specifieker maken:  
- Het proces waarbij het embryo van een platte schijf in een cilindrisch lichaam verandert, noemen we oprichting (folding).  
- Het veranderen van twee naar drie lagen gebeurt echter bij een ander proces.

Kun je nog eens proberen te beschrijven *wat* er precies gebeurt bij embryonale folding? Wat gebeurt er met de positie van de germinale lagen en de lichaamsvorm?",2025-09-17T13:17:38.868683+00:00
user,de buis in het midden sluit en dan daarom komen de andere delen,2025-09-17T13:18:13.269413+00:00
assistant,"Je zit in de goede richting door te benoemen dat er ""sluiting"" optreedt en de lichaamsdelen rondom deze buis komen te liggen. Laten we het nog iets verder verduidelijken:

Embryonale oprichting (folding) bestaat eigenlijk uit twee hoofdprocessen: **cranio-caudale** (kop-staart) folding en **laterale** (zijwaartse) folding. Dit zorgt ervoor dat het embryo van een platte schijf naar een driedimensionale buis transformeert.

**Kan je proberen—met deze informatie—uit te leggen wat het resultaat is van deze cranio-caudale en laterale folding voor de lichaamsvorm en de positie van de organen? Wat verandert er aan het embryo zelf?**",2025-09-17T13:18:57.814542+00:00
user,"endoderm ectoderm mesoderm, en dan ectoderm is je buitenkant zegmaar en mesoderm wordt je organen enzo, de 'binnenbekleding'",2025-09-17T13:20:24.525672+00:00
assistant,"Je noemt nu de drie kiemlagen en hun basisfuncties, dat klopt grotendeels:

- **Ectoderm:** vorming van de buitenkant, zoals huid en zenuwstelsel  
- **Mesoderm:** vormt veel interne structuren, zoals spieren, botten, en delen van organen  
- **Endoderm:** binnenbekleding van o.a. darm en ademhalingsstelsel

Laten we nu weer even terug naar embryonale folding:  
Door deze folding worden de kiemlagen herverdeeld en krijgt het embryo een buisvorm, waarbij:

- Het **endoderm** naar binnen wordt gevouwen en zo het toekomstige darmkanaal vormt.
- Het **ectoderm** komt aan de buitenkant te liggen.
- Het **mesoderm** komt daar tussenin te liggen en splitst zich in verschillende delen.

**Kun je de namen noemen van de verschillende delen waarin het mesoderm wordt onderverdeeld rond week 4-5 van de embryonale ontwikkeling?**",2025-09-17T13:20:39.081813+00:00
user,"lateriaal plaat mesoder, intermeditair mesoderm en praxiaal mesoderm",2025-09-17T13:22:35.140115+00:00
assistant,"Prima! Je noemt inderdaad de drie belangrijkste delen juist:

- Lateraal plaat mesoderm
- Intermediair mesoderm
- Paraxiaal mesoderm

Er is nog één vierde deel van het mesoderm. Kun je die bedenken? Denk aan het deel dat zich precies in het midden van de embryonale schijf bevindt, vlak bij de notochord.",2025-09-17T13:23:09.311082+00:00
user,nee zou ik niet weten,2025-09-17T13:24:03.931683+00:00
assistant,"Geen probleem! Het ontbrekende deel wordt het **axiaal mesoderm** genoemd. Dit omvat onder andere de notochord, een belangrijke structuur voor de ontwikkeling van de wervelkolom.

Nu je deze vier namen kent:  
- Axiaal mesoderm  
- Paraxiaal mesoderm  
- Intermediair mesoderm  
- Lateraal plaat mesoderm  

Laten we kijken of je de basisbegrippen van richting ook kent.

**Wat betekenen de termen ‘caudaal’, ‘craniaal’, ‘ventraal’ en ‘dorsaal’ in de embryologie?**",2025-09-17T13:24:14.501977+00:00
user,dat zijn de vlakken waarin je je bevind,2025-09-17T13:24:40.087151+00:00
assistant,"Dat klopt—het zijn aanduidingen voor richtingen of vlakken! Kun je proberen bij elke term aan te geven welke richting bedoeld wordt? Misschien kun je per term kort aangeven: welke kant op het embryo bedoelt men? Bijvoorbeeld: craniaal = ...?

Probeer het eens!",2025-09-17T13:24:46.316374+00:00
user,"caudaal= ‘craniaal’, ‘ventraal’ en ‘dorsaal",2025-09-17T13:25:09.059576+00:00
assistant,"Je noemt nu de termen nogmaals, maar probeer per term de richting aan te geven. Bijvoorbeeld:

- Craniaal = ?
- Caudaal = ?
- Ventraal = ?
- Dorsaal = ?

Kun je per woord kort aangeven wat je denkt dat het betekent voor het embryo?",2025-09-17T13:25:16.053967+00:00
user,"- Craniaal = richting kop
- Caudaal = richting staart
- Ventraal = voorkant lichaam
- Dorsaal = achterkant lichaam",2025-09-17T13:26:30.885254+00:00
assistant,"Uitstekend! Dat is helemaal correct:

- Craniaal = richting kop
- Caudaal = richting staart
- Ventraal = voorkant (buikzijde)
- Dorsaal = achterkant (rugzijde)

Laten we nu een laagje dieper gaan:  
**Waarom is het proces van gastrulatie essentieel voor de embryonale ontwikkeling? Wat gebeurt er tijdens gastrulatie?**",2025-09-17T13:26:39.093568+00:00
user,dat is het proces van 2 laags naar 3 laags,2025-09-17T13:27:31.37671+00:00
assistant,"Klopt! Gastrulatie is inderdaad het proces waarbij het embryo verandert van een twee-lagig naar een drie-lagig stadium (vorming van ectoderm, mesoderm en endoderm).

Kun je uitleggen *waarom* dit proces zo belangrijk is? Waarom moet het embryo drie lagen krijgen? Wat is het gevolg als deze lagen niet ontstaan?",2025-09-17T13:27:40.264812+00:00
user,dan is het denk ik niet levensvatbaar,2025-09-17T13:28:02.248599+00:00
assistant,"Dat klopt—zonder drie kiemlagen kunnen de verschillende organen en lichaamsdelen niet ontstaan, en is verdere ontwikkeling onmogelijk.

Probeer eens in eigen woorden te beschrijven *wat* elke kiemlaag bijdraagt aan het embryo. Dus:  
- Ectoderm vormt vooral...
- Mesoderm vormt vooral...
- Endoderm vormt vooral...

Zo omschrijf je waarom het hebben van drie onderscheiden lagen essentieel is.",2025-09-17T13:28:11.243479+00:00
user,"- **Ectoderm:** vorming van de buitenkant, zoals huid en zenuwstelsel  
- **Mesoderm:** vormt veel interne structuren, zoals spieren, botten, en delen van organen  
- **Endoderm:** binnenbekleding van o.a. darm en ademhalingsstelsel",2025-09-17T13:28:47.002387+00:00
assistant,"Heel goed! Je benoemt nu precies de belangrijkste functies van elke kiemlaag.

We gaan nu verder over een ander proces:

**Waarom vindt embryonale folding plaats na gastrulatie? Wat is het doel van deze 'opvouw'-processen in de ontwikkeling van het embryo?**",2025-09-17T13:28:53.219987+00:00
user,het wordt dan driedimensionaal en je krijgt een kop en een staart,2025-09-17T13:30:09.16133+00:00
assistant,"Precies! Door embryonale folding verandert het embryo van een platte schijf naar een driedimensionale buisvorm waardoor structuren als een kop, staart, rug en buik worden gedefinieerd.

Kun je ook uitleggen *hoe* deze folding bijdraagt aan het ontstaan van lichaamsholten zoals de buikholte en borstholte? Wat gebeurt er met het mesoderm en de embryonale schijf tijdens dit proces?",2025-09-17T13:30:31.988698+00:00
user,"het endoderm vormt vooral die holtes volgensmij, en denk dat het mesoderm dan bijv die delen van organen",2025-09-17T13:32:29.305108+00:00
assistant,"Je redeneert goed over de bijdrage van de kiemlagen, maar de vorming van de lichaamsholten is iets specifieker verbonden aan het **lateral plate mesoderm**.

Stel je voor: tijdens folding splitst het lateral plate mesoderm in twee lagen.  
Weet je (of kun je beredeneren) hoe die twee lagen heten, en wat deze lagen omsluiten of vormen in de verdere ontwikkeling van de holtes?",2025-09-17T13:32:37.028014+00:00
user,"ik weet daar eigenijk nog heel weining over, de plaat zal opsliten en één zal de 'buitenkant' worden en dan ander juist de binnenkant",2025-09-17T13:34:25.147787+00:00
assistant,"Je zit in de goede richting! Het lateraal plaat mesoderm splitst inderdaad in twee bladen:

- Een buitenste laag (“parietale” of somatische mesoderm)
- Een binnenste laag (“viscerale” of splanchnische mesoderm)

Tussen deze twee lagen ontstaat een ruimte: **de embryonale lichaamsholte**, waaruit onder andere de buikholte en borstholte zich ontwikkelen.  
De buitenste laag bekleedt later de lichaamswand, terwijl de binnenste laag rond de organen komt te liggen.

Wil je nu proberen samen te vatten waarom de splitsing van het lateraal plaat mesoderm en het sluiten (‘ventrale sluiting’) belangrijk zijn voor de vorming van de lichaamsholten?",2025-09-17T13:34:37.770781+00:00
user,"als het niet goed sluit krijg je dus klachten van bijv een open rug of klachten gastroschisis, organen kunnen bijv erbuiten komen te liggen want er is een opening",2025-09-17T13:36:18.593789+00:00
assistant,"Goed! Je koppelt het proces nu aan klinische gevolgen: als ventrale sluiting en de splitsing van het lateraal plaat mesoderm niet goed gaan, kunnen organen buiten het lichaam komen te liggen, zoals bij gastroschisis.

Laten we nu alles wat je hebt geleerd toepassen op de casus:

**Kun je uitleggen wat er in deze casus is gebeurd, met gebruik van de kennis die je zojuist hebt herhaald?** Waarom zie je in het geval van gastroschisis delen van de darmen buiten het lichaam van de baby?",2025-09-17T13:36:28.615933+00:00
user,"de binnenste laag die uit het lateraal plaat is onstaan sluit niet goed, waardoor er een opening onstaat en organen zoals de darmen naar buiten zijn gekomen",2025-09-17T13:37:43.60945+00:00
assistant,"Heel goed, je beschrijft nu duidelijk de kern van het probleem! Het is inderdaad een defect in de ventrale (buikzijde) sluiting, vooral door het niet goed sluiten van de laterale (en soms ook de craniaal-caudale) vouwen van het lateraal plaat mesoderm. Hierdoor ontstaat er een opening waardoor de darmen naar buiten kunnen treden.

Wil je verder verklaren **waarom de baby vaak kleiner dan verwacht is als de organen buiten het lichaam liggen?** Wat zou het effect zijn van darmen die langdurig in contact zijn met het vruchtwater?",2025-09-17T13:37:53.382264+00:00
user,"buikholte te klein want zitten minder organenen in, de ontwikkeling van de organen die in het vruchtwater liggen en dus buiten het kind zullen zich ook minder ontwikkelen",2025-09-17T13:39:23.757985+00:00
assistant,"Precies, heel goed! De buikholte ontwikkelt zich kleiner omdat de organen niet op hun normale plek liggen—ze oefenen dus minder druk uit op de buik, waardoor deze minder “meegroeit”. Daarnaast kunnen organen, zoals de darmen, beschadigd raken door langdurig contact met vruchtwater, wat kan zorgen voor zwelling en een verminderde functie.

Je bent nu klaar voor de afsluitende toetsvraag:

**Hoe begrijp je nu de oorzaken achter de klinische bevindingen in dit geval? Noteer alles wat je kunt bedenken—je ideeën, je redenering, en de verbinding met wat je geleerd hebt. Hoe vollediger je uitleg, hoe beter voor je begrip en voorbereiding op het examen!**",2025-09-17T13:39:35.291442+00:00
user,"ik begrijp het beter, de plaat splits in twee delen maar sluit uiteindelijk niet goed, er is daadwerkelijk een opening waar dus organen doorheen kunnen. dit heeft veel invloed op het embryo",2025-09-17T13:40:45.444857+00:00
assistant,"Mooi! Je laat zien dat je de kern begrijpt: het falen van de ventrale sluiting veroorzaakt de opening waardoor organen buiten het embryo terechtkomen, met grote gevolgen voor het verdere verloop van de ontwikkeling.

Laten we nu deze kennis toepassen in een nieuwe situatie:

**Nieuwe casus:**  
Een 27-jarige zwangere vrouw krijgt bij 13 weken een echo. Hierop wordt bij de baby een opening gezien in het midden van de onderrug. Er puilt een zakje uit met delen van het ruggenmerg en zijn vliezen. Het ruggenmerg is daar slecht ontwikkeld. Dit is een ernstige vorm van spina bifida met myelomeningocele.

**Kun je uitleggen wat er bij deze baby is gebeurd?**",2025-09-17T13:40:56.203378+00:00
user,ik ben klaar met dit gesprek,2025-09-17T13:41:02.719811+00:00
assistant,"Prima! Als je nog eens wilt oefenen of uitleg wilt over embryonale ontwikkeling of andere medische onderwerpen, laat het gerust weten. Succes met studeren!",2025-09-17T13:41:08.367898+00:00
assistant,"**OVERALL SUMMARY**  
Goed gedaan! Je hebt actief meegedaan, doorgevraagd wanneer je iets niet wist en bent steeds blijven proberen om je begrip te vergroten. Je toonde inzet om niet alleen feitjes te onthouden, maar ook om ze logisch te verbinden met het grotere plaatje in de embryologie.

**WHAT YOU DID WELL**
- **Strong Grasp of:** De basisfuncties van de drie kiemlagen (ectoderm, mesoderm, endoderm) kon je goed benoemen en je had de richtingstermen (craniaal, caudaal, ventraal, dorsaal) correct uitgelegd.
- **Good Application of:** Je legde goed de link tussen embroyonale processen als folding en gastrulatie en hun klinische consequenties, zoals bij gastroschisis. Ook kon je uitleggen waarom bepaalde organen juist buiten het lichaam liggen bij een ontwikkelingsstoornis.

**AREAS FOR GROWTH & FOCUS**
- **Reviewing Key Terms:** Je had af en toe moeite om direct op termen te komen, zoals het axiaal mesoderm of de exacte namen van mesodermale onderverdelingen. Dat is heel normaal in dit stadium!
- **Connecting the Dots:** Soms was de connectie tussen proces en gevolg nog wat vaag geformuleerd (""de buis in het midden sluit en dan daarom komen de andere delen""). Probeer bij elk proces te bedenken: wat is het doel, wat is het resultaat, welk klinisch probleem krijg je als het misgaat?
- **Applying Theory to Practice:** Je kon goed uitleggen waarom een opening voor problemen zorgt, maar een volledige klinische uitleg (met alle tussenstappen) kan nog meer worden uitgewerkt. Denk steeds: van cel naar structuur naar functieverlies.

**ACTIONABLE STUDY RECOMMENDATIONS**  
Maak een overzichtelijk concept map of schema over de embryonale ontwikkeling – vooral van de kiemlagen, het folding-proces en het ontstaan van lichaamsholten. Gebruik kleuren, pijlen en korte uitleg per stap. Dit helpt je om de samenhang tussen processen en klinische beelden beter te snappen én onthouden.

Blijf vooral zo actief je eigen redeneringen verwoorden – daar leer je het meeste van!",2025-09-17T13:41:31.405+00:00
