role,content,created_at
user,hey,2025-09-17T15:35:14.097565+00:00
assistant,"Hello! Let’s get started.

Here’s a clinical vignette to focus our session:

A healthy 25-year-old woman had routine prenatal care. At 24 weeks of pregnancy, an ultrasound revealed a small opening (~5 mm) on the right side of the baby’s belly, near the umbilical cord. Genetic tests (amniotic fluid analysis) at 26 weeks were normal. Over time, the opening enlarged (up to 34 mm), and parts of the baby’s intestines were seen floating in the amniotic fluid. The baby also measured smaller than expected. At 37 weeks, a caesarean section was performed. The newborn boy had parts of his small and large intestines, and stomach, located outside the abdomen. The supporting tissue was short, and the bowel appeared swollen. The diagnosis was gastroschisis, a defect in the abdominal wall.

Let’s start with some basic concepts from embryology:

What is gastrulation?",2025-09-17T15:35:32.302477+00:00
user,"is the third week of pregnancy, during which the three germ layers are formed.",2025-09-17T15:37:07.297939+00:00
assistant,"Great! You’ve described the timing and the key outcome of gastrulation—the formation of the three germ layers.

To build on that: Can you name the three germ layers that are formed during gastrulation?",2025-09-17T15:37:12.799503+00:00
user,"ectoderm, mesoderm, endotherm",2025-09-17T15:37:47.227842+00:00
assistant,"Nice! You got ectoderm and mesoderm correct. One of your terms needs a small adjustment: instead of ""endotherm,"" think of the term that begins with ""endo-"" and ends with ""-derm."" 

Can you try to correct that term? And, if you like, could you briefly mention what each of these three germ layers generally gives rise to in the developing embryo?",2025-09-17T15:37:55.306945+00:00
user,endoderm,2025-09-17T15:38:00.908395+00:00
assistant,"Exactly—endoderm! Well done.

Now, let’s go a little further:  
Can you briefly describe what structures or organs each of the three germ layers (ectoderm, mesoderm, endoderm) will form in the developing embryo?",2025-09-17T15:38:07.702984+00:00
user,endoderm- respiratory system and digestive tract,2025-09-17T15:39:41.673187+00:00
assistant,"Good start! The endoderm indeed forms the lining of the respiratory and digestive systems.

What about the other two germ layers—what major tissues or structures do the ectoderm and mesoderm form? Can you list a couple for each?",2025-09-17T15:39:47.499822+00:00
user,"ectoderm- skin cells of the epidermis, brain neurons and pigment cells.   mesoderm- heart muscle cells, skeletal muscle cells, red blood cells, renal tubule cells",2025-09-17T15:42:14.202013+00:00
user,"Paraxial mesoderm, intermediate mesoderm, lateral plate mesoderm",2025-09-17T15:45:44.440873+00:00
assistant,"Great! You named three key subdivisions: paraxial, intermediate, and lateral plate mesoderm.

There’s one more main subdivision that is often listed, located right along the midline of the embryo.  
Can you recall its name? And if you’d like, can you briefly say where it is positioned compared to the others?",2025-09-17T15:45:52.006249+00:00
user,i don't no,2025-09-17T15:46:07.517067+00:00
assistant,"No problem—it’s great that you recognized the other three.

The “axial mesoderm” is the term you’re missing. This subdivision runs exactly along the midline and includes important structures like the notochord.

Here’s a quick recap:
- Axial mesoderm: at the very center, forms the notochord.
- Paraxial mesoderm: just lateral to the axial mesoderm.
- Intermediate mesoderm: between paraxial and lateral plate.
- Lateral plate mesoderm: furthest out to the sides.

Ready to try another important term?

What is embryonic folding?",2025-09-17T15:46:17.845486+00:00
user,"the ectoderm folds, forming the notochord",2025-09-17T15:47:52.366259+00:00
assistant,"You're on the right track thinking about tissue movement and shape changes, but let’s refine the details:

- The notochord actually forms from the **axial mesoderm** and is involved in neural tube formation, not directly from folding of ectoderm.
- Embryonic folding is a process that occurs after the three germ layers are formed and affects the whole embryo—not just the ectoderm.
- It’s crucial for shaping the basic body plan, especially the closure of the ventral (front) body wall.

Can you try describing what happens to the shape of the whole embryo during embryonic folding? For example: What happens to the “flat” embryonic disc as folding occurs?",2025-09-17T15:48:03.286444+00:00
user,it becames more like a cylinder,2025-09-17T15:48:57.418816+00:00
assistant,"Exactly! During embryonic folding, the initially flat, trilaminar embryonic disc is transformed into a more cylindrical, tube-like structure. This process helps create the basic body plan of the embryo.

Let’s keep building on these terms:  
What do the terms “ventral” and “dorsal” mean in embryology? How do they relate to the orientation of the developing embryo?",2025-09-17T15:49:05.113006+00:00
user,ventral is the side of the embryo's belly and dorsal is the side of its back,2025-09-17T15:50:25.178318+00:00
assistant,"Perfect! That’s right—ventral refers to the belly/front side, and dorsal refers to the back side of the embryo.

One last set of terms:  
What do “cranial” and “caudal” mean, and what parts of the embryo do they refer to?",2025-09-17T15:50:30.944158+00:00
user,cranial is de side of the head and caudal is the side of the bottocks,2025-09-17T15:51:33.620171+00:00
assistant,"Exactly right!  
- Cranial is towards the head 
- Caudal is towards the tail or buttocks end of the embryo

Great work!  
Now let’s move to understanding **general processes**:

Why is the process of gastrulation important for embryonic development? What is its main result in terms of setting up the embryo for further development?",2025-09-17T15:51:41.182639+00:00
user,it is the beginning of the spine,2025-09-17T15:52:52.589925+00:00
assistant,"You’re partially right—gastrulation does begin the formation of the notochord, which later influences spine development.  

But gastrulation is even more fundamental: it creates the three germ layers (ectoderm, mesoderm, endoderm), which are the foundation for *all* tissues and organs in the body.

How does this set the stage for the rest of embryonic development? Can you describe why having these three layers is crucial for forming different organ systems?",2025-09-17T15:53:01.252187+00:00
user,can i get the case,2025-09-17T15:53:57.970105+00:00
assistant,"Of course! Here’s the clinical case again for context:

A healthy 25-year-old woman had routine prenatal care. At 24 weeks of pregnancy, an ultrasound revealed a small opening (~5 mm) on the right side of the baby’s belly, near the umbilical cord. Genetic tests (amniotic fluid analysis) at 26 weeks were normal. Over time, the opening enlarged (up to 34 mm), and parts of the baby’s intestines were seen floating in the amniotic fluid. The baby also measured smaller than expected. At 37 weeks, a caesarean section was performed. The newborn boy had parts of his small and large intestines, and stomach, located outside the abdomen. The supporting tissue was short, and the bowel appeared swollen. The diagnosis was gastroschisis, a defect in the abdominal wall.

Now, let’s return to the question:  
Why is forming the three germ layers during gastrulation important for all further embryonic development?",2025-09-17T15:54:13.78698+00:00
user,"durig gastrulation the first are take to make organes, if something goes wrong during that is disturbed the rest of the embryonic development. in the end you can have a defect in the abdominal waal like the case",2025-09-17T15:57:55.848314+00:00
assistant,"You’re thinking along the right lines: gastrulation is foundational, and problems here can have wide-reaching consequences.

Let’s clarify your answer:  
- Gastrulation sets up the **three germ layers**—each one will produce very specific tissues and organs.
- If one layer doesn’t develop properly, all structures from that layer can be affected.

Can you try to name a few examples of what might go wrong with organ or tissue formation if **one** of the germ layers is disturbed during gastrulation? For instance, what would happen if the mesoderm was not formed or differentiated correctly?",2025-09-17T15:58:05.150219+00:00
user,you can have a defect with the heart,2025-09-17T15:58:49.301813+00:00
assistant,"Good! Yes, the heart comes from the mesoderm. Problems in the mesoderm can indeed cause heart defects.

But the mesoderm also gives rise to other structures. Can you name one or two more organ systems or tissues that might be affected by abnormal mesoderm development? For example, think about what structures or systems—besides the heart—originate from the mesoderm layer.",2025-09-17T15:58:56.24586+00:00
user,digestive system and excretory system,2025-09-17T15:59:55.066687+00:00
assistant,"You're getting closer! Let's refine this a bit:

- The **digestive system's lining** mostly comes from the **endoderm** (not the mesoderm), though its muscle and connective tissue components are from mesoderm.
- The **excretory system** (like the kidneys and urinary tract) is largely from the **mesoderm**—specifically, the intermediate mesoderm.

Would you like to try naming another tissue or structure that forms from the mesoderm? (Hint: Think about muscles or the skeleton.)",2025-09-17T16:00:05.642496+00:00
assistant,"**OVERALL SUMMARY**  
Je hebt je goed ingezet en hebt telkens actief meegedacht met elke vraag. Je pakt nieuwe begrippen snel op en durft ook te benoemen als je iets niet zeker weet, wat erg waardevol is voor je leerproces!

**WHAT YOU DID WELL**  
- **Strong Grasp of:** Basisembryologie: je kent de drie kiemlagen en hun namen (ectoderm, mesoderm, endoderm) en weet daarbij ook voorbeelden te noemen van organen die hieruit ontstaan. De begrippen ‘ventraal/dorsaal’ en ‘craniaal/caudaal’ kun je goed uitleggen.
- **Good Application of:** Je kunt het begrip gastrulatie en embryonale vouwing helder toelichten. Je herkent het belang van gastrulatie voor de verdere orgaanontwikkeling en koppelt dit aan het klinische geval.

**AREAS FOR GROWTH & FOCUS**  
- **Reviewing Key Terms:** Bij specifieke termen zoals ‘axiale mesoderm’ of details van welke kiemlaag welke organen precies vormt, was je soms onzeker of verwarde je enkele onderdelen.  
- **Connecting the Dots:** Het uitleggen van processen (zoals het doorvertalen van een kiemlaagdefect naar concrete gevolgen voor meerdere orgaansystemen) kan je nog meer oefenen voor meer diepgang in je antwoorden.
- **Applying Theory to Practice:** Je koppelde de theorie aan het voorbeeld (de buikwanddefect), maar bij verdieping (zoals: welke weefsels vormt mesoderm nog meer?) kun je jezelf uitdagen om meer mogelijkheden te bedenken.

**ACTIONABLE STUDY RECOMMENDATIONS**  
Omdat het onderscheiden van de kiemlagen en hun afgeleiden soms lastig was, adviseer ik je:  
- **Maak een overzichtelijke conceptmap** van de drie kiemlagen met voor iedere laag een lijstje (en/of afbeeldingen) van alle belangrijke organen en weefsels die eruit ontstaan. Koppel dit meteen aan bekende defecten uit de kliniek (zoals hartafwijkingen bij mesodermdeterminatie, of buikwanddefecten).  
Visueel werken helpt je deze relaties beter te onthouden en sneller toe te passen bij klinische vragen!

Goed bezig – blijf actief verbanden leggen tussen theorie en praktijk!",2025-09-17T16:01:09.05+00:00
