role,content,created_at
user,Laten we beginnen,2025-09-17T13:48:01.226072+00:00
assistant,"Hier is een klinische context om het onderwerp te introduceren:

Een gezonde 25-jarige vrouw had routine prenatale zorg. Bij een echo op 24 weken werd een kleine opening (ongeveer 5 mm) aan de rechterzijde van de buik van de baby, dicht bij de navelstreng, gezien. In de loop van de zwangerschap werd de opening groter, tot 34 mm, en kwamen delen van de darm buiten de buik van de baby te liggen. Na de geboorte werden delen van dunne en dikke darm, en de maag, buiten het lichaam gezien. De diagnose is gastroschisis, een defect van de buikwand.

Mijn eerste vraag om van start te gaan:

Wat wordt bedoeld met “embryonale vouwing” (embryonic folding)?",2025-09-17T13:48:13.591104+00:00
user,met embryonale vouwing wordt het vouwen van de platte embryoschijf tot driedimensionale gewervelde vorm,2025-09-17T13:49:34.972978+00:00
assistant,"Goed uitgelegd! Embryonale vouwing is inderdaad het proces waarbij de platte embryonale schijf zich vouwt tot een buisvormige, driedimensionale structuur—de basis voor het latere lichaam.

Volgende vraag:

Kun je de drie kiemlagen van het embryo benoemen?",2025-09-17T13:49:41.17318+00:00
user,"ja het ecto-, meso- en endoderm",2025-09-17T13:50:09.957638+00:00
assistant,"Precies goed! De drie kiemlagen zijn het ectoderm, mesoderm en endoderm.

De volgende vraag:

Het mesoderm wordt verder onderverdeeld in verschillende delen. Kun je de vier belangrijkste subdivisies van het mesoderm noemen?",2025-09-17T13:50:19.904696+00:00
user,nee sorry,2025-09-17T13:50:24.790855+00:00
assistant,"Geen probleem! Veel studenten vinden deze onderverdeling lastig in het begin.

Misschien helpt het als ik je vertel dat deze vier subdivisies zich aan beide kanten van de chorda ontwikkelen, vanaf het midden richting de zijkant. Kun je je nu herinneren wat enkele van deze mesodermale subdivisies zijn, of weet je nog wat over de ligging ten opzichte van het midden van het embryo?",2025-09-17T13:50:32.462579+00:00
user,axiaal mesoderm?,2025-09-17T13:52:00.335696+00:00
user,paraaxiaal mesoderm?,2025-09-17T13:54:46.952415+00:00
assistant,"Heel goed! Dus nu hebben we het axiaal mesoderm en het paraxiaal mesoderm genoemd.

Er zijn er nog twee, die verder zijwaarts liggen. Eén daarvan staat bekend om zijn rol in de ontwikkeling van nieren en urinewegen. Weet je hoe deze subdivisie heet?",2025-09-17T13:54:54.188824+00:00
user,nefro en uro?,2025-09-17T13:55:20.164108+00:00
assistant,"Dat is een goede associatie! Je denkt inderdaad aan de organen die uit dat deel ontstaan. De subdivisie waaruit de nieren en geslachtsorganen ontstaan wordt het **intermediair mesoderm** genoemd.

De laatste subdivisie ligt nog verder naar buiten, aan de buitenrand. Het is betrokken bij de vorming van de lichaamswand en interne organen. Kun je herinneren welke naam hier bij hoort? Het woord heeft te maken met een plaat die aan de buitenzijde ligt.",2025-09-17T13:55:30.341041+00:00
user,distaal?,2025-09-17T13:55:45.395229+00:00
assistant,"Dat is een logische gok! “Distaal” betekent “verder van het midden”, maar het specifieke deel van het mesoderm dat je zoekt heet het **laterale plaatmesoderm** (lateral plate mesoderm).

Dus samenvattend hebben we:
- axiaal mesoderm
- paraxiaal mesoderm
- intermediair mesoderm
- lateraal plaatmesoderm

Wil je proberen te beschrijven wat wordt bedoeld met “ventrale sluiting” (ventral closure) tijdens de embryonale ontwikkeling?",2025-09-17T13:55:57.349666+00:00
user,"met ventrale sluiting wordt bedoeld dat zeg maar de ""ruggenwervel"" gesloten wordt, dus aan de achterkant sluit de neurale plaat",2025-09-17T13:56:53.925462+00:00
assistant,"Interessante poging! Je verwart “ventrale sluiting” met een proces dat aan de rugzijde (dorsaal) plaatsvindt: de sluiting van de neurale buis. “Ventrale sluiting” verwijst echter juist naar wat er aan de buikzijde (voorzijde) gebeurt.

Kun je nog eens proberen: wat gebeurt er met de lichaamswand aan de voorkant van het embryo tijdens ventrale sluiting? Wat gebeurt er met de buikwand als gevolg van het vouwen van het embryo?",2025-09-17T13:57:02.189257+00:00
user,de buikwand sluit volledig?,2025-09-17T13:57:33.730817+00:00
assistant,"Ja, dat is juist! Tijdens ventrale sluiting groeit en beweegt het embryonale weefsel van de zijkanten naar het midden van de buik, zodat de buikwand volledig sluit en de organen ingesloten worden in het lichaam.

Laatste begripsvraagje bij deze basiskennis:  
Wat zijn de termen voor “boven-/onderzijde” (richting het hoofd of juist richting de staart) en voor “rug-/buikzijde” in de embryonale anatomie? (Dus: bijvoorbeeld caudaal, craniaal, dorsaal, ventraal.) Kun je deze termen toelichten?",2025-09-17T13:57:43.99263+00:00
user,caudaal is naar beneden en craniaal naar boven,2025-09-17T13:58:18.301034+00:00
assistant,"Dat klopt: caudaal betekent richting het staartuiteinde (beneden), en craniaal betekent richting het hoofd (boven).

Weet je ook wat dorsaal en ventraal betekenen in dit verband?",2025-09-17T13:58:24.081349+00:00
user,dorsaal betekent achter en ventraal voor,2025-09-17T13:58:49.399233+00:00
assistant,"Precies! Dorsaal is de rugzijde (achterkant) en ventraal is de buikzijde (voorkant) van het embryo of lichaam.

Heel goed, je hebt nu de basisbegrippen onder de knie.  
Laten we verdergaan met waarom-vragen over de processen.

Kun je uitleggen waarom gastrulatie zo’n essentieel proces is tijdens de embryonale ontwikkeling? Wat gebeurt er tijdens gastrulatie dat zo belangrijk is voor het verdere verloop?",2025-09-17T13:59:00.073273+00:00
assistant,"**OVERALL SUMMARY**  
Goed gedaan! Je laat zien dat je gemotiveerd en actief meedoet, zelfs wanneer iets lastig is. Je maakt goede associaties en probeert logisch na te denken om tot antwoorden te komen. Dat is een sterke leerhouding!

**WHAT YOU DID WELL**
- **Strong Grasp of:** De drie kiemlagen, de begrippen caudaal/craniaal en dorsaal/ventraal, en het concept van embryonale vouwing had je goed onder woorden.
- **Good Application of:** Je wist correcte koppelingen te maken tussen termen en functies (zoals het linken van de mesodermale subdivisie aan nieren/uro). Je stelde vervolgvragen en was niet bang om te gokken of om verduidelijking te vragen.

**AREAS FOR GROWTH & FOCUS**
- **Reviewing Key Terms:** De subdivisies van het mesoderm kwamen wat moeizamer, net als het precieze onderscheid tussen ventrale en dorsale sluiting.
- **Connecting the Dots:** Je verwisselde ventrale/dorsale processen, wat laat zien dat de ruimtelijke processen tijdens embryonale ontwikkeling nog wat verwarring kunnen geven.
- **Applying Theory to Practice:** Je liet zien dat je feiten kent, nu is het belangrijk om ook het proces en de gevolgen (bijvoorbeeld bij een defect) steeds beter te kunnen uitleggen.

**ACTIONABLE STUDY RECOMMENDATIONS**  
Teken eens een overzichtelijk schema of concept map van het vroege embryo, met daarin:  
- de verschillende kiemlagen  
- hun subdivisies  
- de richtingstermen (craniaal, caudaal, dorsaal, ventraal)  
- een simpele animatie van hoe vouwing en sluiting verlopen  
Dit helpt enorm bij het ruimtelijk begrijpen én samenhangend onthouden van de processen!",2025-09-17T13:59:32.191+00:00
