role,content,created_at
user,laten we beginnen,2025-09-17T13:15:19.116957+00:00
assistant,"Prima, laten we beginnen!

Hier is de klinische casus waarmee we zullen werken:

Een gezonde 25-jarige vrouw had routine prenatale zorg. Bij een echo op 24 weken werd een kleine opening (~5 mm) aan de rechterkant van de buik van de baby gezien, vlak bij de navelstreng. Bij latere controles werd de opening groter (tot 34 mm) en waren delen van de darmen van de baby zichtbaar in het vruchtwater. Bij de geboorte bevonden delen van de darmen en maag zich buiten de buik. De diagnose was gastroschisis, een defect in de buikwand.

Mijn eerste vraag voor jou:

Wat zijn de drie kiemlagen die ontstaan tijdens de embryonale ontwikkeling?",2025-09-17T13:15:36.938802+00:00
user,"ectoderm, mesoderm en endoderm",2025-09-17T13:16:11.4899+00:00
assistant,"Dat klopt, goed gedaan!

De drie kiemlagen zijn ectoderm, mesoderm en endoderm.

Volgende vraag:
Wat bedoelen we met “embryonale plooing” (embryonic folding) tijdens de embryonale ontwikkeling?",2025-09-17T13:16:46.854416+00:00
user,"het proces waarin het embryo niet meer een biliminaire schijf is, maar het ectoderm om het endoderm heen vouwt",2025-09-17T13:17:20.910887+00:00
assistant,"Je zit op het goede spoor! Inderdaad verandert het embryo door embryonale plooing van een platte schijf naar een driedimensionale structuur. Kun je nog iets specifieker aangeven:

- In welke richtingen gebeurt deze plooiing?
- Wat is het resultaat van deze plooien voor de lichaamsvorm, bijvoorbeeld de positie van de dooierzak en de plaatsing van de buik (ventrale) wand?

Probeer dit verder uit te werken!",2025-09-17T13:17:29.914226+00:00
user,deze plooing gebeurt vgm in caudale richting en de dooierzak wordt omringt door het ectoderm,2025-09-17T13:18:22.109409+00:00
assistant,"Je noemt al de caudale richting, goed dat je die term gebruikt! Maar er zijn eigenlijk twee hoofdassen waarin de embryonale plooing plaatsvindt. Kun je eens nagaan welke twee belangrijke richtingen of assen dat zijn?

En wat gebeurt er precies met de dooierzak tijdens deze plooing, wordt deze helemaal omringd, of ontstaat er iets anders?

Denk na over:  
- Welke twee plooirichtingen zijn er?
- En omringt het ectoderm daadwerkelijk (de hele) dooierzak, of ontstaat er bijvoorbeeld een buis van een kiemlaag?

Probeer deze punten eens te beantwoorden!",2025-09-17T13:18:34.875698+00:00
user,"caudaal en lateraal, en er ontstaan idd een buis van het endoderm",2025-09-17T13:19:12.348146+00:00
assistant,"Heel goed! Je hebt nu beide richtingen genoemd: caudaal (staartzijde) en lateraal (zijkanten).  

En het klopt: tijdens de embryonale plooing vouwt het embryo zo dat het endoderm een “buis” vormt binnenin het embryo, wat later het spijsverteringskanaal wordt. De dooierzak wordt grotendeels buiten het embryo gehouden.

Volgende vraag:
Kun je benoemen wat de vier grote soorten mesoderm zijn die ontstaan tijdens de embryonale ontwikkeling?",2025-09-17T13:19:25.042971+00:00
user,"intermediar, paraxiaal en zijplaat mesoderm, de vierde weet ik niet",2025-09-17T13:20:01.370766+00:00
user,"intermediar, paraxiaal en zijplaat mesoderm, de vierde weet ik niet",2025-09-17T13:21:56.041592+00:00
assistant,"Je noemt weer intermediair, paraxiaal en zijplaat mesoderm, wat correct is! De vierde soort heet ""axiaal mesoderm"". Denk aan de allereerste centrale structuur die door het mesoderm gevormd wordt—deze loopt precies in het midden van het embryo.  

Kan je je herinneren welke structuur hieruit ontstaat, die heel belangrijk is als centrale as voor het ontwikkelen van de wervelkolom en ruggenmerg? Hint: het begint met een ""n"".",2025-09-17T13:22:04.871792+00:00
user,notochord,2025-09-17T13:22:15.45063+00:00
assistant,"Precies, de notochord! Heel goed.

Dus samenvattend zijn de vier soorten mesoderm: axiaal (notochord), paraxiaal, intermediair en zijplaat (lateraal) mesoderm.

Volgende vraag:
Wat betekenen de termen ventraal en dorsaal in de anatomie van het embryo?",2025-09-17T13:22:22.992879+00:00
user,ventraal is buikzijde en dorsaal is rugzijde,2025-09-17T13:22:36.13811+00:00
assistant,"Juist, helemaal correct!

Ventrale zijde = buikzijde  
Dorsale zijde = rugzijde

Laten we verder gaan:

Wat is gastrulatie in de embryonale ontwikkeling? Kun je kort omschrijven wat er tijdens deze fase gebeurt?",2025-09-17T13:22:42.865905+00:00
user,tijdens de gastrulatie sluit de neurale buis,2025-09-17T13:23:02.194497+00:00
assistant,"Bijna! Je noemt nu de neurale buis, maar dat gebeurt iets later (tijdens de neurulatie). Gastrulatie is een stap daarvoor.

Gastrulatie gaat vooral over het ontstaan van de drie kiemlagen. Kun je aangeven welke processen of bewegingen van cellen hierbij horen? Wat gebeurt er precies met de embryonale cellen tijdens gastrulatie?",2025-09-17T13:23:09.769759+00:00
user,epiblastcellen migreren via de primitieve strook en vervangen de hypo en epiblast,2025-09-17T13:24:23.902925+00:00
assistant,"Heel goed!  
Precies, epiblastcellen migreren via de primitiefstreep (primitieve strook) naar beneden, vervangen de hypoblast deels, en vormen zo de drie kiemlagen: ectoderm, mesoderm, endoderm.

Mijn volgende vraag om je kennis van basisbegrippen verder te toetsen:

Wat zijn de twee lagen van de laterale plaat mesoderm, en wat is hun positie ten opzichte van elkaar?",2025-09-17T13:24:32.237477+00:00
user,dat weet ik niet,2025-09-17T13:24:46.681309+00:00
assistant,"Geen probleem, goed dat je het aangeeft!  

De zijplaat (laterale plaat) mesoderm splitst in twee lagen. Denk bij de namen aan hun ligging ten opzichte van het embryo: eentje dicht bij het orgaan (viscera), de andere dichter bij de lichaamswand.  

Kun je op basis hiervan bedenken hoe ze genoemd zouden kunnen worden? Misschien kun je proberen de termen te raden of herkennen?",2025-09-17T13:25:15.486939+00:00
user,visceraal mesoderm?,2025-09-17T13:25:36.351225+00:00
assistant,"Ja, heel goed! Viscerale (of splanchnische) mesoderm is er één van, die dicht bij de organen ligt.

De andere laag ligt dichter bij de lichaamswand. Denk je dat je voor die laag ook de naam weet? (Tip: het klinkt als ""pariëtaal"" ...)",2025-09-17T13:26:03.91961+00:00
user,somatisch,2025-09-17T13:27:41.330764+00:00
assistant,"Helemaal goed! De tweede laag wordt inderdaad het somatisch (of pariëtaal) mesoderm genoemd.

Dus: de laterale plaat mesoderm splitst in het viscerale (splanchnisch) en het somatische (pariëtaal) mesoderm.

Laatste begripstoets voordat we naar meer procesvragen gaan:
Wat betekent de term “morfogenese” (morphogenesis) in de embryologie?",2025-09-17T13:27:51.23304+00:00
user,het vormen van organen,2025-09-17T13:28:17.731444+00:00
assistant,"Daar zit je dicht bij! Morfogenese gaat inderdaad over het vormen van structuren, maar het is nét iets breder dan alleen organen.  

Morfogenese betekent het proces waarbij een organisme zijn vorm en structuur krijgt. Dit omvat het ontstaan van weefsels, organen én het hele lichaam.

Wil je proberen deze brede definitie zelf te formuleren? Bijvoorbeeld: “Morfogenese is het proces waarbij...”",2025-09-17T13:28:25.305457+00:00
user,morfogenese is het proces waarbij een organisme zijn vorm en structuur krijgt,2025-09-17T13:28:44.340042+00:00
assistant,"Perfect, dat is helemaal juist!  

Morfogenese is inderdaad het proces waarbij een organisme zijn vorm en structuur krijgt tijdens de ontwikkeling.

Nu gaan we door naar de volgende stap, waarin je niet alleen feitjes noemt, maar ook uitlegt waarom bepaalde processen belangrijk zijn.

Mijn vraag aan jou:  
Waarom is de gastrulatie zo’n essentiële stap in de embryonale ontwikkeling? Wat maakt dit proces zo cruciaal voor alles wat daarna gebeurt?",2025-09-17T13:28:52.755801+00:00
user,omdat er anders geen organen zouden kunnen ontstaan,2025-09-17T13:29:22.105662+00:00
assistant,"Dat klopt in grote lijnen—zonder gastrulatie ontstaan er inderdaad geen organen. Kun je uitleggen waarom dat zo is? Wat gebeurt er tijdens gastrulatie dat nodig is voor organenvorming?  

Denk aan: welke basisstructuren of voorwaarden worden tijdens gastrulatie gelegd die noodzakelijk zijn voor het ontstaan van verschillende organen?  Kun je dat toelichten?",2025-09-17T13:29:29.753274+00:00
user,"gastrulatie geeft aanleiding voor de drie kiemlagen, waaruit later alle organen en structuren gevormd zullen worden",2025-09-17T13:30:17.782567+00:00
assistant,"Precies! Gastrulatie zorgt voor de vorming van de drie kiemlagen—ectoderm, mesoderm en endoderm—die elk weer verschillende organen en structuren zullen vormen. Zonder die kiemlagen kunnen er geen gespecialiseerde weefsels en organen ontstaan.

Volgende procesvraag:
Waarom is embryonale plooing (folding) belangrijk voor de uiteindelijke vorm van het embryo en de organisatie van de interne organen? Wat verandert er hierdoor ten opzichte van het vroege, vlakke stadium?",2025-09-17T13:30:27.767831+00:00
user,er onstaan meer ruimte voor de ontwikkeling van andere structuren,2025-09-17T13:30:51.931117+00:00
assistant,"Dat is een goed begin! Klopt, er ontstaat meer ruimte en een driedimensionale vorm.  

Kun je wat specifieker zijn over welke belangrijke veranderingen er ontstaan?  
Denk na over:
- Hoe verschuiven of veranderen de ligging van bepaalde structuren, zoals de dooierzak, darmbuis, en lichaamswand?
- Welke invloed heeft de plooing op het ontstaan van de buikwand en de interne lichaamsruimten?

Kun je deze punten verder toelichten?",2025-09-17T13:31:02.75509+00:00
user,de plooing zorgt voor het vormen van een gut tube en wat het doet met de lichaamswand weet ik niet,2025-09-17T13:31:43.343228+00:00
assistant,"Dat is al heel goed! De plooiing zorgt inderdaad voor het vormen van de darmbuis (gut tube) uit het endoderm.

Wat betreft de lichaamswand:  
Door de laterale en craniocaudale plooiing groeien de zijkanten van het embryo naar elkaar toe en sluiten aan de ventrale (buik)zijde. Dat proces vormt de buikwand en de voorwand van het lichaam.

Waarom is het sluiten van de ventrale (buik)wand belangrijk tijdens deze fase? Wat zou er gebeuren als die sluiting niet goed verloopt?",2025-09-17T13:31:54.813873+00:00
user,dan zou de baby met een open buik geboren worden,2025-09-17T13:32:38.786682+00:00
assistant,"Precies, dat klopt helemaal!  
Als de ventrale buikwand niet goed sluit, kunnen inwendige organen, zoals darmen, buiten de buikholte terechtkomen—zoals bij het klinische voorbeeld van gastroschisis.

Nu een vraag over het verband tussen kiemlagen en het ontstaan van verschillende weefsels:
Kun je uitleggen welke van de drie kiemlagen verantwoordelijk is voor het vormen van het spijsverteringskanaal, de spieren/botten, en de huid/zenuwstelsel? Probeer voor elk genoemd weefsel aan te geven uit welke laag het afkomstig is.",2025-09-17T13:33:06.281204+00:00
user,"spijsverteringskanaal is mesoderm, huid en zenuwstelsel is ectoderm en spier en botten is endoderm",2025-09-17T13:34:29.164617+00:00
assistant,"Je hebt alledrie ingevuld, maar verwisselt een paar lagen:

Denk na over het volgende:
- Welke laag vormt meestal de binnenbekleding van tractussen zoals het spijsverteringskanaal?
- Welke laag geeft aanleiding tot het zenuwstelsel én de opperhuid?
- Welke laag zorgt voor steunweefsel, zoals spieren en botten?

Wil je je antwoorden nogmaals proberen te formuleren met deze hints?",2025-09-17T13:34:38.326365+00:00
user,"spijsverteringskanaal is endoderm, huis en opperhuid is ectoderm en mesoderm zorgt voor steunweefsel",2025-09-17T13:35:07.151987+00:00
assistant,"Heel goed! Dat klopt precies:

- Spijsverteringskanaal: endoderm  
- Huid/oppherhuid & zenuwstelsel: ectoderm  
- Spieren en botten: mesoderm

Nu een vraag over lichaamsholten:
Waardoor ontstaat de lichaamsholte (intraembryonale coeloom) en welke mesodermale structuur speelt daarbij een centrale rol?",2025-09-17T13:35:15.382418+00:00
user,somietej,2025-09-17T13:35:46.802776+00:00
assistant,"Het lijkt erop dat je ""somieten"" bedoelt, wat een onderdeel is van het paraxiaal mesoderm. Maar bedenk: bij de vorming van de lichaamsholte (coeloom) speelt een andere structuur van de zijplaat (laterale plaat) mesoderm een hoofdrol.

De laterale plaat mesoderm splitst zich in twee lagen—visceraal en pariëtaal—en daartussen ontstaat een ruimte.  
Kun je daarmee verder redeneren?  
Welke ruimte ontstaan er tussen deze twee lagen, en wat wordt daarvan later de functie?",2025-09-17T13:35:57.657268+00:00
user,geen idee,2025-09-17T13:36:06.615389+00:00
assistant,"Geen probleem, dit kan lastig zijn!

Tussen het viscerale (splanchnisch) en pariëtale (somatisch) mesoderm van de laterale plaat ontstaat een ruimte—dit wordt het intraembryonale coeloom genoemd.  
Deze ruimte ontwikkelt zich uiteindelijk tot de lichaamsholten, zoals de buikholte (peritoneale holte), borstholte (pleuraholte) en hartzakje (pericardiale holte).

Waarom denk je dat het belangrijk is dat deze lichaamsholten ontstaan tijdens de embryonale ontwikkeling? Wat bieden ze aan de zich ontwikkelende organen?",2025-09-17T13:36:16.862644+00:00
user,ruimte om te groeien,2025-09-17T13:36:33.375627+00:00
assistant,"Precies! Die holten bieden organen de fysieke ruimte om te groeien, te bewegen en zich goed te ontwikkelen.  

Nu heb je de algemene processen goed doorgenomen.  
Laten we het geleerde toepassen op de casus (gastroschisis):

Kun je uitleggen wat er in deze casus gebeurd is met de kennis die je hierboven hebt geoefend?",2025-09-17T13:36:40.292981+00:00
user,de embryonale plooing is niet goed gegaan waardoor de buikwand niet goed is gesloten,2025-09-17T13:37:08.462913+00:00
assistant,"Precies, dat is de kern! Je hebt goed samengevat dat een gestoorde embryonale plooing (of ventrale sluiting) tot een niet volledig gesloten buikwand heeft geleid.

Kun je nu iets verder uitleggen:
- Welke kiemlagen en mesodermale structuren zijn betrokken bij het vormen van die buikwand?
- Waarom zouden delen van de darmen bij deze aandoening naar buiten kunnen uitstulpen?
- En waarom zou de baby hierdoor kleiner kunnen zijn dan verwacht?

Probeer eens per onderdeel hierboven je verklaring te geven!",2025-09-17T13:37:17.920093+00:00
user,"het ectoderm en het somatische mesoderm zijn betrokken, delen van de darmen kunnen uitstulpen omdat de buikwand niet goed gesloten is, en ik weet niet waarom de baby kleiner zou kunnen zijn.",2025-09-17T13:38:35.710383+00:00
assistant,"Heel goed!  
- Klopt, bij de aanleg van de buikwand zijn het ectoderm en het somatische (pariëtale) mesoderm betrokken.
- Ook juist: als de buikwand niet goed sluit, kunnen de darmen naar buiten puilen.

Over de groei van de baby:
Waarom denk je dat darmen die buiten het lichaam liggen in het vruchtwater, invloed kunnen hebben op de groei van de baby? Denk aan wat vruchtwater betekent voor weefsel, en hoe voeding of opname tijdens de zwangerschap kan veranderen. Wat is je idee hierover?",2025-09-17T13:38:45.629833+00:00
user,het vruchtwater is vervuild misschien,2025-09-17T13:39:11.480058+00:00
assistant,"Interessant idee, je denkt kritisch mee! Vruchtwater kan inderdaad schadelijk zijn voor organen die daar normaal niet in horen te liggen, zoals de darmen—ze raken geïrriteerd, kunnen ontsteken of minder goed functioneren.

Kun je nog verder doordenken:  
Als de darmen beschadigd raken door het contact met vruchtwater, of niet goed functioneren, hoe zou dat doorwerken op de opname van voedingsstoffen en dus de groei van het kind in de baarmoeder? Wat gebeurt er dan?",2025-09-17T13:39:21.343562+00:00
user,het kind krijgt niet genoeg voedingsstoffen binnen om voldoende te kunnen groeien,2025-09-17T13:39:49.189625+00:00
assistant,"Precies, dat is juist!  
Beschadigde of slecht functionerende darmen kunnen minder goed voedingsstoffen opnemen, zelfs vóór de geboorte, wat kan bijdragen aan een groeiachterstand van de baby.

Je hebt nu goed laten zien dat je de processen en afwijkingen begrijpt. Schrijf nu als eindopdracht een uitgebreid antwoord op deze vraag:

Hoe begrijp je nú de oorzaken achter de klinische bevindingen in deze casus? Zet zoveel mogelijk details, ideeën, redeneringen en verbanden neer tussen wat je geleerd hebt. Hoe vollediger je uitleg, hoe meer het je begrip versterkt!",2025-09-17T13:39:58.676384+00:00
user,ik ben klaar met het gesprek,2025-09-17T13:41:02.38993+00:00
assistant,"Prima, bedankt voor je inzet tijdens deze sessie! Als je op een later moment verder wilt oefenen of vragen hebt over embryologie of medische onderwerpen, weet je me te vinden. Veel succes met je studie!",2025-09-17T13:41:08.234426+00:00
assistant,"**OVERALL SUMMARY**  
Goed gedaan met deze oefencasus! Je hebt met doorzettingsvermogen en nieuwsgierigheid gewerkt aan best lastige embryologische concepten. Je was niet bang om het toe te geven als je iets niet wist, en hebt actief meegedacht toen je werd uitgedaagd om dieper na te denken. Dat is een sterke basis om verder te groeien!

**WHAT YOU DID WELL**  
- **Strong Grasp of:** Je kent de drie kiemlagen (ectoderm, mesoderm, endoderm) en hun rol goed. Je benoemde correct ventraal/dorsaal, het begrip morfogenese, en de basis van gastrulatie. Ook wist je na feedback de juiste kiemlagen te koppelen aan huid, zenuwstelsel, spieren, botten en het spijsverteringskanaal.
- **Good Application of:** Je kon uitleggen hoe een defect in embryonale plooing tot gastroschisis kan leiden, en bedacht zelf dat schade aan darmen door vruchtwater invloed heeft op ontwikkeling en groei.

**AREAS FOR GROWTH & FOCUS**  
- **Reviewing Key Terms:** Soms was het lastig om specifieke termen te herinneren (zoals axiaal mesoderm, pariëtaal/somatisch mesoderm).
- **Connecting the Dots:** Je basisprocesbegrip groeit, maar het koppelen van alle processen (zoals hoe lichaamsholten precies ontstaan en welke mesodermale structuren daarbij betrokken zijn) kan nog sterker.
- **Applying Theory to Practice:** Je begreep de essentie van de casus goed; bij het verklaren van groeiachterstand kon je met een beetje hulp tot het volledige antwoord komen. Met wat meer oefening zul je verbanden sneller zelfstandig zien!

**ACTIONABLE STUDY RECOMMENDATIONS**  
Je grootste winst zit in het duidelijker verbinden van processen en termen—dus bij het tweede punt: Connecting the Dots.  
- **Teken zelf schema’s of concept maps van de embryonale ontwikkeling**. Leg daarin vast: welke kiemlaag vormt wat, hoe splitst het mesoderm, wanneer en waar ontstaan de lichaamsholten, en hoe hangen deze processen samen. Door het visueel te maken, wordt het makkelijker om verbanden te leggen en vergeet je minder snel de namen en functies.

Blijf nieuwsgierig en ga zo door!",2025-09-17T13:41:31.4+00:00
assistant,"**OVERALL SUMMARY**  
Goed gedaan! Je hebt je actief ingezet tijdens het gesprek en bent niet bang geweest om door te vragen als je iets niet wist. Je laat zien dat je de kern van veel embryologische concepten begrijpt en hebt steeds geprobeerd om verbanden te leggen.

**WHAT YOU DID WELL**  
- **Strong Grasp of:** Je kent de drie kiemlagen goed, herkende de begrippen ventraal/dorsaal, en wist wat morfogenese en gastrulatie inhouden. Ook kon je na hints kiemlagen goed koppelen aan de vorming van verschillende weefsels en organen.
- **Good Application of:** Je legde de link tussen afwijkende embryonale plooing en gastroschisis en had door hoe beschadigde darmen door contact met vruchtwater de groei kunnen beïnvloeden.

**AREAS FOR GROWTH & FOCUS**  
- **Reviewing Key Terms:** Sommige termen, zoals “axiaal mesoderm”, “pariëtaal” en “somatisch”, kwamen minder vlot. Dit geldt ook voor details over de laterale plaat mesoderm.
- **Connecting the Dots:** Het specifieke proces van vorming van lichaamsholten en de mesodermale betrokkenheid kun je nog verder uitwerken. Er is winst te halen in het verbinden van losse feiten tot één samenhangend verhaal.

**ACTIONABLE STUDY RECOMMENDATIONS**  
Jouw grootste winst zit in het verder uitwerken van procesbegrip.  
- **Teken een concept map of overzichtelijk schema van de embryonale kiemlagen, de groepsindeling van het mesoderm, en schets hoe daaruit stap voor stap de belangrijkste structuren en holten ontstaan.** Oefen het in je eigen woorden/tekeningen: zo leg je makkelijker de verbanden en onthoud je ook de benamingen beter.

Ga zo door, je bent goed op weg!",2025-09-17T13:41:40.804+00:00
