role,content,created_at
user,Hoi,2025-09-17T15:29:07.37176+00:00
assistant,"Hoi! Laten we samen aan de slag gaan met embryonale ontwikkeling. Hier is de casus ter context:

**Vignette:**  
Een 25-jarige vrouw heeft een routine zwangerschap. Op een echo bij 24 weken is er een opening naast de navel van de baby zichtbaar, waardoor delen van de darmen buiten het buikje zweven. Bij de geboorte liggen delen van maag en darmen buiten het lichaam: gastroschisis.

Laten we bij het begin beginnen:

**Vraag:**  
Wat wordt bedoeld met ""embryonale folding""?",2025-09-17T15:29:17.76976+00:00
user,Ik wil beginnen met het gesprek,2025-09-17T15:29:26.074601+00:00
assistant,"Natuurlijk, laten we beginnen! Hier is nogmaals de casus voor de context:

Een 25-jarige zwangere vrouw wordt opgemerkt met een baby die een opening in de buikwand heeft, waarbij delen van de darm buiten het lijfje liggen: gastroschisis.

Hier komt de eerste vraag:

Wat is gastrulatie?",2025-09-17T15:29:40.169787+00:00
user,Begin,2025-09-17T15:29:59.297582+00:00
assistant,"Prima! Hier volgt de casus nog een keer:

Een zwangere vrouw krijgt bij 24 weken een echo. Daarop zie je een opening in de buikwand van de baby, vlakbij de navel, met darmlissen buiten het buikje. Uiteindelijk blijkt het om gastroschisis te gaan.

Mijn eerste vraag om te starten:  
Wat zijn de drie kiemlagen (germ layers) die in het embryo ontstaan tijdens de eerste weken van de ontwikkeling?",2025-09-17T15:30:07.62154+00:00
user,"Endoderm, mesoderm, ectoderm",2025-09-17T15:31:09.97562+00:00
assistant,"Helemaal goed! De drie kiemlagen zijn het endoderm, mesoderm en ectoderm.

Volgende vraag:  
Wat betekent ""paraxiaal mesoderm""? Waar in het embryo is dit mesoderm te vinden?",2025-09-17T15:31:16.640047+00:00
user,Het mesoderm wat organen enzo maakt,2025-09-17T15:31:29.264917+00:00
user,Hallo,2025-09-17T15:34:16.694697+00:00
assistant,"Hoi! Geen probleem, we pakken het weer op bij de vraag:

Kun je nog eens proberen te benoemen wat het *paraxiaal mesoderm* precies is? Denk aan waar je het vindt in het embryo, en welke lichaamsstructuren het uiteindelijk vormt. Wat weet je daarvan?",2025-09-17T15:34:23.226396+00:00
user,Het mesoderm wat organen enzo maakt,2025-09-17T15:34:38.005983+00:00
assistant,"Je geeft aan dat het paraxiaal mesoderm “organen enzo” maakt. Dat is deels waar, maar kun je specifieker zijn? 

Bij het mesoderm onderscheiden we meerdere delen—zoals paraxiaal, intermediair en lateraal plaat mesoderm—die elk verschillende delen van het lichaam vormen. Het paraxiaal mesoderm ligt direct naast de neurale buis in het embryo.  
Weet je misschien welke specifieke lichaamsstructuren of types weefsel (bijvoorbeeld spieren, botten, huid, etc.) uit het paraxiaal mesoderm ontstaan?",2025-09-17T15:34:48.666143+00:00
user,Nee,2025-09-17T15:35:02.979514+00:00
assistant,"Geen probleem! Het is niet erg om het niet meteen te weten.

Het paraxiaal mesoderm vormt somieten (segmenten die zich aan weerszijden van de neurale buis ontwikkelen). Uit somieten ontstaan onder andere de skeletspieren van de romp en ledematen, botten van de wervelkolom, en het onderhuidse bindweefsel (dermis) van de rug. 

Mag ik je vragen:  
Wat weet je van het verschil tussen het paraxiaal, intermediair en lateraal plaat mesoderm? Heb je daar eerder van gehoord?",2025-09-17T15:35:15.040682+00:00
