role,content,created_at
user,beginnen,2025-09-17T15:24:57.065668+00:00
assistant,"Hier is de klinische casus om de theorie in context te plaatsen:

Een gezonde 25-jarige vrouw was zwanger. Tijdens een echo op 24 weken zwangerschap werd een kleine opening (ongeveer 5 mm) rechts van de navel van de baby gezien. De opening werd geleidelijk groter, en delen van de darmen zwommen in het vruchtwater. Na de bevalling hadden delen van de darmen en de maag zich buiten de buikholte van de pasgeborene ontwikkeld. Dit heet gastroschisis.

Om te starten, een vraag om je basiskennis te toetsen:

Hoe heten de drie kiemlagen waaruit tijdens de embryonale ontwikkeling het embryo is opgebouwd?",2025-09-17T15:25:29.929099+00:00
user,mesoderm exoderm en endoderm,2025-09-17T15:25:42.841262+00:00
assistant,"Goed! Je hebt het bijna helemaal juist: de drie kiemlagen zijn endoderm, mesoderm en ectoderm. De term is **ectoderm** in plaats van exoderm.

Nu verder met een nieuwe vraag om het begrip van deze termen te versterken:

Wat wordt bedoeld met **gastrulatie** tijdens de embryonale ontwikkeling?",2025-09-17T15:25:50.143775+00:00
user,dat is het ontstaan van de 3 lagen,2025-09-17T15:26:46.803209+00:00
assistant,"Dat klopt, gastrulatie is het proces waarbij de drie kiemlagen ontstaan: ectoderm, mesoderm en endoderm.

Wil je hier nog iets aan toevoegen? Weet je in welke week van de embryonale ontwikkeling gastrulatie meestal plaatsvindt?",2025-09-17T15:26:53.488116+00:00
user,week 3 en 4,2025-09-17T15:27:03.707147+00:00
assistant,"Goed geprobeerd! Gastrulatie vindt met name plaats in **week 3** van de embryonale ontwikkeling.

Laten we nog een belangrijke term uit het leerdoel bespreken:

Kun je uitleggen wat wordt bedoeld met **embryonale plooing (embryonic folding)**?",2025-09-17T15:27:12.8164+00:00
user,dat is het vouwen van de kiemlagen,2025-09-17T15:27:38.372356+00:00
assistant,"Goede start! Het klopt dat het gaat om het vouwen, maar misschien kun je het wat verder toelichten: 

Wat gebeurt er precies met het embryo door deze plooiing? Denk aan de vorm en ligging van de kiemlagen en het toekomstige lichaam. Wat is het effect van die plooiing, bijvoorbeeld op de lichaamsvorm?",2025-09-17T15:27:45.149165+00:00
user,tijdens deze vouwing word de lichaamsvorm bepaalt en hoe de kiemlagen komen te liggen in de embryo,2025-09-17T15:28:40.87315+00:00
assistant,"Dat is juist! Embryonale plooing bepaalt inderdaad de uiteindelijke lichaamsvorm en de positie van de kiemlagen in het embryo.

Kan je benoemen welke twee hoofdassen betrokken zijn bij deze plooiing en hoe ze genoemd worden?",2025-09-17T15:28:46.981728+00:00
user,frontaal en,2025-09-17T15:29:01.785669+00:00
assistant,"Je noemt “frontaal” als een van de hoofdassen—je bent op de goede weg! Er zijn inderdaad twee belangrijke vouwassen bij embryonale plooing:

Kun je je nog herinneren welke andere as daarbij betrokken is, naast de frontale as? Misschien kun je denken aan de richting van het hoofd tot aan het uiteinde van het embryo. Wat zou die as kunnen zijn?",2025-09-17T15:29:12.117517+00:00
user,cardinaal,2025-09-17T15:29:22.68802+00:00
assistant,"Je zit in de goede richting — je bedoelt waarschijnlijk de **craniaal-caudale** (“van hoofd tot staart”-richting) as! Dus: 

- De **craniaal-caudale as** (van hoofd naar staart)
- De **laterale as** (van links naar rechts, oftewel transversaal, wat te maken heeft met de ‘frontale’ plooiing)

Wil je nog proberen dit samen in je eigen woorden te formuleren? Welke twee hoofdassen ondergaat het embryo tijdens embryonale plooing, en wat betekent dat voor de vorming van het embryo?",2025-09-17T15:29:34.550296+00:00
user,de embryo ondergaat vouwing vind plaats in de carniale as en de laterale as. dit bepaalt de vorm van de embryo tijdens de vouwing,2025-09-17T15:31:16.45472+00:00
assistant,"Heel goed uitgelegd! Tijdens de embryonale plooing vouwt het embryo zowel in de **craniaal-caudale as** als in de **laterale as**, en dit bepaalt inderdaad de uiteindelijke lichaamsvorm.

Laten we nog één begrip kort bespreken dat past bij het leerdoel, voordat we doorgaan naar verdieping:

Wat betekent **ventraal** en wat betekent **dorsaal** als je het over het embryo hebt?",2025-09-17T15:31:25.050692+00:00
user,de voor of achterkant,2025-09-17T15:31:47.556998+00:00
assistant,"Dat klopt! **Ventral** betekent de voorkant (buikzijde) en **dorsaal** betekent de achterkant (rugzijde) bij het embryo.

Goed gedaan! Je hebt de belangrijkste basisbegrippen herkend. 

Nu gaan we verdiepen:
Kun je uitleggen wat er precies gebeurt tijdens het proces van **gastrulatie**? Probeer in je uitleg te benoemen hoe de cellen migreren en hoe de drie kiemlagen zich vormen.",2025-09-17T15:31:59.662934+00:00
user,"tijdens gastrulatie worden de kiemlagen gevormd, de cellen vormen tijden dit proces 3 verschillende lagen",2025-09-17T15:33:37.832394+00:00
assistant,"Goed, je geeft aan dat er drie lagen gevormd worden tijdens gastrulatie. Kun je misschien iets meer vertellen over *hoe* de cellen zich precies bewegen of verplaatsen tijdens dit proces? 

Denk aan waar de cellen beginnen, via welke structuur ze migreren, en hoe ze uiteindelijk de endoderm, mesoderm, en ectoderm vormen. Wat weet je hierover?",2025-09-17T15:33:45.092742+00:00
user,geen idee,2025-09-17T15:33:56.330665+00:00
assistant,"Geen probleem, dat is een veel voorkomende struikelblok! Laten we het samen stap voor stap benaderen:

De cellen beginnen aan het oppervlak van het embryo, waar eerst één laag is (het epiblast). Tijdens gastrulatie vindt er migratie plaats door een opening/structuur in het midden, de **primitiefstreep**.

Kun je met deze aanwijzing bedenken wat er gebeurt als cellen van het epiblast via de primitiefstreep naar binnen bewegen? Wat wordt zo gevormd?",2025-09-17T15:34:05.267614+00:00
user,dan word het endoderm gevormd,2025-09-17T15:34:44.166343+00:00
assistant,"Juist! De eerste cellen die door de primitiefstreep naar binnen bewegen, vormen het **endoderm**. 

Vervolgens migreren er daarna nog meer cellen naar binnen. Kun je met deze informatie zeggen wat er gebeurt met de volgende laag die wordt gevormd, en wat er gebeurt met de cellen die bovenop blijven liggen? (Denk aan de volgorde van endoderm, mesoderm en ectoderm.)",2025-09-17T15:34:53.337997+00:00
user,"hierdoor krijg je 3 lagen, de buitenkant het ectoderm dan de tussenlaag het mesoderm en de binnenkant het endoderm",2025-09-17T15:35:45.569456+00:00
assistant,"Heel goed! Door de migratie via de primitiefstreep ontstaat:

- **Ectoderm:** Buitenste laag (wat overblijft van de epiblast na migratie)
- **Mesoderm:** Middelste laag (cellen die als tweede naar binnen migreren)
- **Endoderm:** Binnenste laag (cellen die als eerste migreren)

Nu een vervolgvraag:

Waarom is gastrulatie zo’n belangrijk proces voor de verdere ontwikkeling van het embryo? Wat maakt het vormen van deze drie kiemlagen essentieel?",2025-09-17T15:35:54.930421+00:00
user,dit is belangrijk omdat het embryo uit deze 3 lagen gevormd word,2025-09-17T15:36:50.39522+00:00
assistant,"Dat klopt! Het embryo wordt inderdaad uit deze drie kiemlagen gevormd.

Kun je misschien een voorbeeld geven van welke grote weefseltypen of organen er uit elk van deze drie kiemlagen ontstaan? Probeer van elke laag minstens één voorbeeld te noemen.",2025-09-17T15:36:58.572944+00:00
user,ectoderm: huid,2025-09-17T15:37:22.574864+00:00
assistant,"Goed! De huid (en ook het zenuwstelsel) ontstaan inderdaad uit het **ectoderm**.

Kun je nu een voorbeeld geven van een orgaan of weefsel dat ontstaat uit het **mesoderm** en één uit het **endoderm**?",2025-09-17T15:37:30.151008+00:00
user,mesoderm: spier,2025-09-17T15:37:41.901203+00:00
assistant,"Precies! Spieren (en ook onder andere botten en bloedvaten) ontstaan uit het **mesoderm**.

Kun je nu nog een voorbeeld noemen van een weefsel of orgaan dat ontstaat uit het **endoderm**? Denk aan structuren diep in het lichaam.",2025-09-17T15:37:48.859331+00:00
user,endoderm: darm,2025-09-17T15:38:00.050698+00:00
assistant,"Heel goed! De darm (en veel andere spijsverterings- en ademhalingsorganen) ontstaan uit het **endoderm**.

Nu nog een verdieping over het mesoderm, omdat dit belangrijk is voor je leerdoel. Het mesoderm splitst zich verder op in verschillende delen.

Kun je de vier belangrijkste onderdelen van het mesoderm noemen die ontstaan tijdens de embryonale ontwikkeling?",2025-09-17T15:38:07.800743+00:00
user,geen idee,2025-09-17T15:38:25.482344+00:00
assistant,"Geen probleem! Dit is best lastig om te onthouden. Vaak wordt het mesoderm bij de ontwikkeling onderverdeeld in vier regio's, elk met een eigen rol.

Als geheugensteun: denk aan de ligging van het mesoderm rond de lengteas van het embryo. De namen beginnen vaak met ""axiaal"" en gaan vervolgens naar buiten toe.

Kun je op basis hiervan misschien raden of er een mesoderm-onderdeel is dat dicht bij de as zit, of juist verder naar buiten? Wat betekent bijvoorbeeld **paraxiaal** of **lateraal** in deze context?",2025-09-17T15:38:34.881007+00:00
user,binnen naar buiten,2025-09-17T15:38:56.939373+00:00
assistant,"Precies, de verschillende typen mesoderm liggen van binnen naar buiten rond de as van het embryo!

Ze heten:

1. **Axiaal mesoderm** (helemaal in het midden, bij de lengteas)
2. **Paraxiaal mesoderm** (direct naast het axiaal mesoderm)
3. **Intermediair mesoderm** (daarnaast, iets verder naar buiten)
4. **Lateraal plaat mesoderm** (het verst naar buiten, tegen de zijkanten)

Wil je nu met deze woorden proberen te benoemen wat de volgorde is van binnen naar buiten in het embryo?",2025-09-17T15:39:06.52523+00:00
user,"axiaal, paraxiaal, intermediair, lateraal",2025-09-17T15:40:00.214323+00:00
assistant,"Heel goed! De volgorde is inderdaad: axiaal, paraxiaal, intermediair, lateraal plaat mesoderm — van binnen naar buiten.

Nu een volgende verdiepingsvraag:

Waarom is het ontstaan van deze verschillende mesodermale gebieden belangrijk voor de vorming van het lichaam? Wat zorgt ervoor dat ieder gebied een andere functie of bijdrage heeft aan het lichaam?",2025-09-17T15:40:09.474355+00:00
user,elke laag heeft een bijpassende stevigheid en functie en daarom heb je verschillende lagen,2025-09-17T15:44:47.285798+00:00
assistant,"Goed gezien! Elke laag heeft inderdaad een andere functie en draagt bij aan de ontwikkeling van specifieke structuren in het lichaam. Zo ontstaan uit de ene laag bijvoorbeeld de wervelkolom en spieren, uit een andere laag de nieren, en uit weer een andere laag het hart en de lichaamswand.

Nu een nieuwe stap:

Tijdens embryonale plooing wordt het embryo gesloten aan de voorkant (ventraal). Waarom is dit ventrale sluitingsproces belangrijk voor de vorming van de lichaamsholte (bijvoorbeeld de buikholte)?",2025-09-17T15:45:20.897842+00:00
user,omdat hier de stevigheid van de wervelkolom voor nodig is,2025-09-17T15:46:02.744178+00:00
assistant,"Interessante gedachte! De wervelkolom is inderdaad belangrijk voor de stevigheid van het lichaam, maar bij de ventrale sluiting gaat het met name over het sluiten van de buikwand en het vormen van de lichaamsholte (zoals de buikholte en borstholte).

Denk nog eens: wat gebeurt er als de ventrale sluiting *niet* volledig plaatsvindt? Kun je uitleggen waarom het sluiten van de buik belangrijk is voor het goed aanleggen van de inwendige organen?",2025-09-17T15:46:11.920045+00:00
user,geen idee,2025-09-17T15:46:42.688667+00:00
assistant,"Helemaal prima—dit is een lastig concept! Even samen nadenken:

Bij ventrale sluiting bewegen de zijkanten van het embryo naar het midden en sluiten ze om zo de lichaamswand te vormen. Dit zorgt ervoor dat de inwendige organen (zoals darmen) veilig binnen de buikholte komen te liggen.

Wat zou er kunnen gebeuren met de organen als de buikwand zich niet volledig sluit tijdens de ontwikkeling? Wil je het nog eens proberen te verwoorden?",2025-09-17T15:46:54.874629+00:00
user,dan kunnen de organen gaan verplaatsen,2025-09-17T15:47:52.545961+00:00
assistant,"Heel goed! Als de buik niet goed sluit, kunnen organen (zoals de darmen) buiten het lichaam terechtkomen of op de verkeerde plek terechtkomen.

Nu een laatste vraag om deze fase af te ronden:

Kun je uitleggen waarom juist de **laterale plaat mesoderm** belangrijk is voor het vormen van de buikwand en het peritoneum (buikvlies)? Wat gebeurt er met deze laag tijdens de ventrale sluiting?",2025-09-17T15:48:00.53518+00:00
user,omdat deze laag zorgt voor het ontstaan van het buikvlies tijdens de ventrale sluiting,2025-09-17T15:49:14.886537+00:00
assistant,"Precies! De laterale plaat mesoderm splitst zich tijdens de ventrale sluiting in twee lagen (de viscerale en pariëtale laag) en vormt daarmee onder andere het buikvlies (peritoneum) en de bekleding van de lichaamsholte.

Nu je de kernprocessen begrijpt, terug naar de context van de casus:

Kun je met de kennis die je net hebt opgedaan uitleggen wat er in deze casus gebeurd is? Wat ging er mis tijdens de embryonale ontwikkeling bij deze baby, en welke processen waren daarbij betrokken?",2025-09-17T15:49:24.739021+00:00
user,de laterale plaat mesoderm is niet gesloten en de opening werd gelijdelijk groter waardoor de ingewanden buiten het lichaam terecht kwamen,2025-09-17T15:51:23.005391+00:00
assistant,"Heel goed uitgelegd! Je geeft aan dat de laterale plaat mesoderm niet goed is gesloten, wat leidt tot een opening waardoor de ingewanden naar buiten zijn gekomen.

Waarom denk je dat de opening in deze casus **rechts van de navel** ontstond? En wat zegt dat over het proces van ventrale sluiting? Kun je proberen dit te verbinden met je kennis over de verdeling en richting van de embryonale plooing?",2025-09-17T15:51:33.969813+00:00
user,de ventrale sluiting is niet voltooit waardoor er een fout zit ten hoogte van de navel en er nus hier een opening ontstond,2025-09-17T15:52:40.017847+00:00
assistant,"Mooi verwoord! Je legt goed uit dat de ventrale sluiting niet volledig tot stand is gekomen, waardoor juist ter hoogte van de navel een opening kan blijven bestaan en zo een gastroschisis ontstaat.

Laatste reflectievraag voordat we verdergaan:
Waarom zou een kind met gastroschisis soms ook **kleiner zijn dan verwacht** bij de geboorte, zelfs als het belangrijkste probleem een buikwanddefect is? Wat zou er in de ontwikkeling of voedingstoestand van het embryo anders kunnen verlopen?",2025-09-17T15:52:52.59254+00:00
user,"omdat de baby veel energie kwijt is aan dit defect en dus minder kan infesteren in groei, ook liggen de ingewanden buiten het lichaam waardoor sommige processen ook minder goed kunne verlopen",2025-09-17T15:54:08.721804+00:00
assistant,"Uitstekend! Je brengt het mooi samen: het openliggen van de darmen maakt dat voedingsstoffen minder goed kunnen worden opgenomen, de organen zijn kwetsbaarder en het embryo moet meer energie steken in overleven dan in groeien.

Nu volgt de afsluitende toetsingsvraag:

Hoe begrijp je nu de oorzaken achter de klinische bevindingen in deze casus? Schrijf elk detail dat je kunt bedenken op—je ideeën, je redenering, en wat je hebt geleerd. Hoe meer compleet je uitleg, hoe meer je je kennis verdiept en voorbereid bent op je toekomstige praktijk!",2025-09-17T15:54:39.286121+00:00
user,doordat de sluiting vande laterale plaat mesoderm niet goed is verlopen heeft het kind medische complicaties zoals een gat bij de navel waardoor de ingewanden buiten het lichaam gaan.,2025-09-17T15:56:05.589103+00:00
assistant,"Bedankt voor je uitleg!

Nu volgt een nieuwe casus om te zien of je deze kennis kunt toepassen op een ander voorbeeld:

Een 27-jarige vrouw komt op 13 weken zwangerschap voor een echo. Er wordt een midlijn-opening in de onderrug van de baby gevonden met daarin een zakje gevuld met vocht, delen van het ruggenmerg en zijn vliezen. Het ruggenmerg in dat gebied is slecht ontwikkeld. De diagnose is spina bifida met myelomeningocele.

Kun je uitleggen wat er in deze casus is gebeurd?",2025-09-17T15:56:15.18882+00:00
assistant,"**OVERALL SUMMARY**  
Goed gedaan! Je hebt actief deelgenomen aan het gesprek, je best gedaan om lastige embryologische concepten te verwoorden en je kennis steeds verder uitgebreid naar aanleiding van de feedback en hints.

**WHAT YOU DID WELL**  
- **Strong Grasp of:** De drie kiemlagen (ectoderm, mesoderm, endoderm), de volgorde van mesodermale lagen (axiaal, paraxiaal, intermediair, lateraal), en het belang van deze structuren voor de orgaanontwikkeling. Je herkende het belang van ventrale sluiting en koppelde dit goed aan de casus gastroschisis.  
- **Good Application of:** Je kon kennis toepassen in de casus over gastroschisis: je verwoordde helder hoe het laterale plaat mesoderm bijdraagt aan de buikwand en wat er mis gaat bij incomplete sluiting, inclusief de klinische gevolgen.

**AREAS FOR GROWTH & FOCUS**  
- **Connecting the Dots:** Bij het uitleggen van processen (zoals gastrulatie/celmigratie en het precieze mechanisme van ventrale sluiting) had je soms nog moeite om onderliggende stappen of details te benoemen.  
- **Applying Theory to Practice:** Je eerste uitleg bij het toepassen op de casus begon wat basaal (bijvoorbeeld simpelweg ""buik sluit niet en darmen liggen buiten""), maar je werd steeds specifieker na verdiepende vragen—probeer dit voortaan gelijk wat uitgebreider te doen.

**ACTIONABLE STUDY RECOMMENDATIONS**  
Om het ‘connecting the dots’ verder te ontwikkelen (vooral procesbegrip zoals gastrulatie, celmigratie en embryonale vouwmechanismen), raad ik je aan om eens een conceptmap of stappenplan te tekenen waarin je het ontstaan van de kiemlagen, de migratie van cellen en het ontstaan van anatomische structuren visueel met elkaar verbindt. Dit helpt om relaties tussen processen beter te doorgronden en te onthouden.",2025-09-17T15:56:52.41+00:00
