role,content,created_at
user,start het gesprek,2025-09-17T13:42:38.178416+00:00
assistant,"We beginnen met een casus om het onderwerp te leren begrijpen:

Een gezonde 25-jarige vrouw kreeg routine prenatale controles. Bij 24 weken zwangerschap bleek op een echo een kleine opening (~5 mm) aan de rechterzijde van de buik van de baby, nabij de navelstreng. Genetische testen waren normaal. De opening werd later groter (tot 34 mm), en delen van de darmen zweefden in het vruchtwater. Bij geboorte lagen delen van de darmen en de maag buiten de buik.

Laten we starten met een basisvraag, passend bij het leerdoel:

Wat betekent het begrip “embryonale vouwing” (embryonic folding) in de embryonale ontwikkeling?",2025-09-17T13:42:48.510367+00:00
user,embryonale vouwing is het proces dat er mesoderm wordt gevormd en de archion om de vruchtzak heen gaaty,2025-09-17T13:44:12.366381+00:00
assistant,"Je hebt een begin gemaakt met je antwoord, maar het klopt nog niet helemaal. Denk eraan: embryonale vouwing is een specifiek proces dat plaatsvindt nadat de drie kiemlagen zijn gevormd. Het heeft niet direct met de vorming van mesoderm te maken, maar eerder met hoe het platte embryo verandert van vorm.

Kun je uitleggen wat er gebeurt met de vorm van het embryo tijdens de embryonale vouwing? Wat verandert er precies aan het embryo zelf?",2025-09-17T13:44:40.862517+00:00
user,het embryo vouwt om de notochord heen en daar ontstaat dan een gat wat later de spijsvertering en de darmen vormt. er is nu ook een voor en een achterkant van het embryo,2025-09-17T13:45:52.471575+00:00
assistant,"Goed — je benoemt dat het embryo zich om de chorda (notochord) heen vouwt en dat hierdoor de basis voor de spijsvertering ontstaat. Ook noem je het ontstaan van een voor- en achterkant. Dat zijn belangrijke punten.

Misschien kun je iets specifieker uitleggen in welke richtingen deze vouwing plaatsvindt? Denk aan termen als “craniaal-caudale” en “laterale” vouwing. Kun je beschrijven wat die betekenen bij embryonale vouwing?",2025-09-17T13:46:01.237826+00:00
user,"de vouwingen gaan naar de buik toe, dus lateraal. ook gaat het hoofdje naar de staart toe en dat heet volgensmij craniaal",2025-09-17T13:47:13.015921+00:00
user,"de staart Gaay richting het hoofd dus craniaal, het hoofd gaat ook richting de staart, dus caudaal en de vouwing beweegt zich naar de buik toe",2025-09-17T13:50:30.191877+00:00
assistant,"Je beschrijft goed dat zowel het hoofd als de staart dichter naar elkaar toe bewegen. Probeer het nog iets concreter te maken:

- De craniocaudale vouwing betekent dat het hoofd- en staartuiteinde zich naar... buigen, waardoor het embryo...  
- De laterale vouwing betekent dat de zijkanten van het embryo naar... toe bewegen, waardoor er een soort... ontstaat in het midden.

Kun je deze zinnen nu aanvullen? Zo wordt het verschil tussen craniocaudale en laterale vouwing nog duidelijker!",2025-09-17T13:51:18.28753+00:00
user,"zich naar binnen waardoor het embryo om de notochord heen vouwt. van het embryo naar de buik toe bewegen, waardoor er een soort holte ontstaat",2025-09-17T13:52:35.238765+00:00
assistant,"Heel goed! Dat is duidelijker:

- Craniocaudale vouwing: hoofd- en staartuiteinde buigen naar binnen toe, zodat het embryo meer “gebogen” wordt rond de as (de notochord).
- Laterale vouwing: de zijkanten bewegen naar de buikzijde en sluiten uiteindelijk de buikwand, waarbij binnenin een holte ontstaat (de toekomstige darm).

Nu een volgende basisvraag:

Welke drie kiemlagen vormen zich tijdens de embryonale ontwikkeling, en kun je ze bij naam noemen?",2025-09-17T13:52:43.783126+00:00
user,mesoderm endoderm en ectoderm,2025-09-17T13:52:57.060647+00:00
assistant,"Helemaal juist! De drie kiemlagen zijn:  
- Ectoderm  
- Mesoderm  
- Endoderm

Laten we verdergaan met een volgende vraag om de basis goed te leggen:

Het mesoderm wordt verder onderverdeeld in verschillende delen. Kun je twee van deze mesoderm-subdivisies bij naam noemen?",2025-09-17T13:53:04.352933+00:00
user,nee dat weet ik niey,2025-09-17T13:53:27.139475+00:00
assistant,"Geen probleem! Het is nieuw en mag lastig zijn.

Veel van deze subdivisies verwijzen naar de positie ten opzichte van de as van het embryo. Ze bevatten woorden als “axiaal” en “paraxiaal”. Herken je die begrippen ergens van, of kun je raden wat ze kunnen betekenen? Wat weet je al over deze termen?",2025-09-17T13:54:07.028282+00:00
user,meso axiaal en mesoparaxiaal,2025-09-17T13:54:25.756773+00:00
assistant,"Ja, je noemt al bijna de juiste termen! Ze lijken op wat jij schrijft, maar worden meestal als één woord geschreven zonder ""meso"" ervoor.

Zullen we samen kijken:  
- **Axiaal mesoderm** (ook wel chorda genoemd)
- **Paraxiaal mesoderm**

Daarnaast zijn er nog twee belangrijke subdivisies van het mesoderm. Hun namen beginnen met ""intermedi-"" en ""lateraal-"". Kun je raden hoe deze heten, of klinkt het bekend?",2025-09-17T13:54:34.591984+00:00
user,intermedi mesoderm lateraal mesoderm,2025-09-17T13:55:23.452033+00:00
assistant,"Precies! Dat klopt:

- Axiaal mesoderm
- Paraxiaal mesoderm
- Intermediair mesoderm
- Lateraal mesoderm

Heel goed! Nu een vervolgvraag om te controleren of de basis zit:

Wat betekenen de termen “ventraal” en “dorsaal” als je aan het embryo denkt?",2025-09-17T13:55:30.542832+00:00
user,ventraal is van voren en dorsaal is van achter,2025-09-17T13:55:45.441928+00:00
assistant,"Helemaal goed! Ventraal betekent aan de buikzijde (voorkant) en dorsaal betekent aan de rugzijde (achterkant).

Nu je deze basisbegrippen goed kent, gaan we een stapje dieper:

Waarom is het proces van gastrulatie belangrijk in de embryonale ontwikkeling? Wat gebeurt er tijdens gastrulatie?",2025-09-17T13:55:53.176333+00:00
user,tijdens de gastrelatie ontstaan de kiemlagen en worden de semieten gevormd die zorgen voor het ruggenmerg,2025-09-17T13:56:29.820662+00:00
assistant,"Je zegt dat tijdens gastrulatie de kiemlagen ontstaan — dat is juist! De somieten komen later, maar gastrulatie legt daarvoor de basis.

Laten we het stap voor stap bekijken:  
Gastrulatie zorgt ervoor dat een tweelaags embryo omgezet wordt naar een drielagensysteem. Kun je beschrijven vanuit welke structuur deze drie kiemlagen ontstaan? En kun je uitleggen wat gastrulatie fysiek met de cellen doet (denk aan migratie of beweging van cellen)?",2025-09-17T13:56:38.42633+00:00
user,nee heb. je een tip?,2025-09-17T13:57:39.895013+00:00
assistant,"Zeker! Tijdens gastrulatie gebeurt er iets belangrijks met de cellen van het embryo. Je kunt hierbij denken aan een soort “instulping” of migratie van cellen, waarbij cellen via een speciale groeve bewegen.

Die groeve heeft een naam die begint met “primitieve…”.  
Kun je nu uitleggen wat de primitieve groeve (primitive streak) te maken heeft met het ontstaan van de kiemlagen? Wat gebeurt er met de cellen rondom deze groeve?",2025-09-17T13:58:10.021399+00:00
assistant,"**OVERALL SUMMARY**  
Je hebt goed meegedaan aan het gesprek en je best gedaan om de basis van de embryonale ontwikkeling te begrijpen. Je toont inzet en denkt actief mee bij de vragen. Dat is een belangrijke vaardigheid in medische scholing!

**WHAT YOU DID WELL**
- **Strong Grasp of:** De namen van de drie kiemlagen (ectoderm, mesoderm, endoderm) en hun betekenis. Ook kon je termen als ventraal/dorsaal goed benoemen.
- **Good Application of:** Je probeerde verbanden te leggen tussen de vouwing van het embryo en de ligging van verschillende structuren. Ook was je niet bang om een gok te wagen bij subdivisies van het mesoderm en kon je deze na hints correct benoemen.

**AREAS FOR GROWTH & FOCUS**
- **Reviewing Key Terms:** Begrippen als “gastrulatie”, “primitieve groeve” en de subdivisies van het mesoderm mag je nog even herhalen. Je wist ze niet altijd direct te benoemen of correct te omschrijven.
- **Connecting the Dots:** Bij het uitleggen van processen (zoals gastrulatie of embryonale vouwing) kun je nog oefenen in het stap voor stap uitleggen wat er gebeurt en in welke richting de veranderingen plaatsvinden.
- **Applying Theory to Practice:** Je vond het soms lastig om processen om te zetten naar een beschrijving van wat er met de cellen of embryostructuren gebeurt.

**ACTIONABLE STUDY RECOMMENDATIONS**  
Teken voor jezelf een schema of concept map over de embryonale ontwikkeling, waarin je laat zien hoe gastrulatie verloopt, hoe de kiemlagen gevormd worden, hoe de vouwingen plaatsvinden én welke begrippen daarbij horen (zoals primitieve groeve, craniocaudaal, lateraal, enzovoorts). Door visueel te werken zie je beter hoe alles samenhangt en onthoud je de stappen in het proces gemakkelijker!",2025-09-17T13:58:42.018+00:00
