role,content,created_at
user,ik wil beginnen met het gesprek,2025-09-17T15:29:21.999715+00:00
assistant,"Hier is een korte samenvatting van de casus die we als uitgangspunt nemen:

Een gezonde zwangere vrouw had rond week 24 een echo die liet zien dat er een opening (5 mm) in de buikwand van de baby zat, rechts van de navel. Later werd de opening groter en zweefden delen van de darmen in het vruchtwater. De baby werd kleiner geschat dan verwacht. Na de geboorte bleek dat delen van de darm en maag buiten de buikholte lagen. Dit heet gastroschisis.

Laten we beginnen met een basisvraag over embryonale ontwikkeling die belangrijk is voor dit onderwerp:

Wat betekent het begrip **""gastrulatie""** in de embryonale ontwikkeling?",2025-09-17T15:29:33.169522+00:00
user,gastrulatie is waarin de kiembladen worden ontwikkeld,2025-09-17T15:30:15.637376+00:00
assistant,"Goed, je zegt dat gastrulatie het proces is waarin de kiembladen worden ontwikkeld. Dat is inderdaad een kernpunt!

Kun je nog wat specifieker zijn:  
- Uit hoeveel kiembladen bestaat het embryo na de gastrulatie, en
- Kun je ze bij naam noemen?",2025-09-17T15:30:24.544101+00:00
user,uit drie kiembladen:,2025-09-17T15:30:31.899628+00:00
assistant,"Dat klopt: na gastrulatie zijn er drie kiembladen.  

Kun je ze alle drie bij naam noemen?",2025-09-17T15:30:38.47429+00:00
user,"endoderm,mesoderm en ectoderm",2025-09-17T15:30:49.532755+00:00
assistant,"Precies! Dat zijn de drie kiembladen: endoderm, mesoderm en ectoderm.

Laten we nu inzoomen op een andere term uit de embryonale ontwikkeling, belangrijk voor het begrijpen van afwijkingen zoals gastroschisis:

Wat wordt bedoeld met **""embryonale plooivorming""** (embryonic folding)? Wat gebeurt er tijdens dit proces?",2025-09-17T15:30:57.499229+00:00
user,hierin wordt de neurale plaat gevormd toch,2025-09-17T15:31:30.630163+00:00
assistant,"De neurale plaat vormt zich inderdaad vroeg in de ontwikkeling, maar dit hoort vooral bij neurulatie, wat na gastrulatie plaatsvindt. Embryonale plooivorming (folding) is nét een andere stap.

Denk na over de globale vorm van het embryo voor en na het plooien:  
- Hoe verandert de vorm van het embryo tijdens de plooivorming?
- Wat “gaat naar binnen” en wat “komt aan de buitenkant”?

Wil je dit nog eens proberen te omschrijven? Wat gebeurt er precies bij embryonale plooivorming?",2025-09-17T15:31:40.54498+00:00
