role,content,created_at
user,begin,2025-09-17T15:27:33.743653+00:00
assistant,"Let's get started! Here's a clinical vignette to give context to your learning:

A healthy 25-year-old woman had routine prenatal care. At 24 weeks of pregnancy, an ultrasound revealed a small opening (~5 mm) on the right side of the baby’s belly, near the umbilical cord. Genetic tests (amniotic fluid analysis) at 26 weeks were normal. Over time, the opening enlarged (up to 34 mm), and parts of the baby’s intestines were seen floating in the amniotic fluid. The baby also measured smaller than expected. At 37 weeks, a caesarean section was performed. The newborn boy had parts of his small and large intestines, and stomach, located outside the abdomen. The supporting tissue was short, and the bowel appeared swollen. The diagnosis was gastroschisis, a defect in the abdominal wall.

Let's begin with a foundational question:

**What are the three primary germ layers formed during early embryonic development?**",2025-09-17T15:28:27.794237+00:00
user,"endoderm, ectoderm en mesoderm",2025-09-17T15:28:38.243056+00:00
assistant,"Correct! The three primary germ layers are endoderm, ectoderm, and mesoderm.

Let's try another basic question:

**Can you name and briefly describe the four main subdivisions of the mesoderm that appear during early embryonic development?**",2025-09-17T15:28:44.320915+00:00
user,"lateraal mesoderm, intermediair mesoderm",2025-09-17T15:29:25.156151+00:00
assistant,"Good start! You’ve named two of the four mesodermal subdivisions: lateral (lateral plate) mesoderm and intermediate mesoderm.

Can you think of the other two? One is found at the very middle axis of the embryo, and another is next to it (“beside” the axis). Do you recall their names?",2025-09-17T15:29:33.590229+00:00
user,axiaal en paraxiaal?,2025-09-17T15:30:00.434031+00:00
assistant,"Excellent! That’s correct. The four subdivisions of the mesoderm are:

- Axiaal (axial) mesoderm
- Paraxiaal (paraxial) mesoderm
- Intermediair (intermediate) mesoderm
- Lateraal (lateral plate) mesoderm

Well done identifying all four.

Next question:

**What is gastrulation, and why is it an essential process in early embryonic development?**",2025-09-17T15:30:08.758265+00:00
user,"gastrulatie is het proces waarbij de embryo van schijfvormig, naar cilindervormig gaat. hierna gaat de cilindervormige embryo zich vouwen",2025-09-17T15:31:01.604074+00:00
assistant,"**OVERALL SUMMARY**  
Goed gedaan! Je hebt actief deelgenomen aan het gesprek en toonde inzet om de basisconcepten van embryonale ontwikkeling te benoemen en te beschrijven.

**WHAT YOU DID WELL**
- **Sterke beheersing van:** De namen van de drie kiemlagen en de vier mesodermale subdivisies. Dit laat zien dat je de basiskennis hierover goed beheerst.
- **Goede toepassing van:** Je wist de gevraagde termen correct op te noemen, en je probeerde het begrip gastrulatie te beschrijven in je eigen woorden.

**AREAS FOR GROWTH & FOCUS**
- **Begrippen herzien:** Je uitleg van gastrulatie was nog wat summier en miste enkele belangrijke aspecten, zoals de vorming van de drie kiemlagen via migratie van cellen door de primitiefstreek.
- **Proces uitleggen:** Probeer bij het uitleggen van processen als gastrulatie specifiek te zijn: leg uit wát er gebeurt, hóe het gebeurt en waarom het belangrijk is binnen de embryonale ontwikkeling.

**ACTIONABLE STUDY RECOMMENDATIONS**  
Maak een schema of concept map van het proces van gastrulatie. Visualiseer de stappen (zoals de vorming van de primitiefstreep, celmigratie en het ontstaan van de drie kiemlagen) en zet erbij waarom deze stappen cruciaal zijn. Door dit te tekenen en stap voor stap te benoemen, wordt het makkelijker om complexere embryonale processen te begrijpen en toe te lichten.",2025-09-17T15:32:27.274+00:00
user,laten we beginnen,2025-09-17T15:32:40.886727+00:00
assistant,"Hier is de klinische casus waarmee we je kennis gaan koppelen aan de praktijk:

Een gezonde 25-jarige vrouw had routinematige prenatale zorg. Bij een echo op 24 weken zwangerschap werd een kleine opening (~5 mm) aan de rechterzijde van de buik van de baby naast de navel gezien. Genetisch onderzoek (vruchtwaterpunctie) op 26 weken was normaal. De opening vergrootte later tot 34 mm en delen van de darmen zweefden vrij in het vruchtwater. De baby groeide ook langzamer dan verwacht. Na 37 weken volgde een keizersnede: de pasgeboren jongen had delen van zijn dunne en dikke darm, en zijn maag buiten de buik. Het ondersteunende weefsel was kort en de darmen waren gezwollen. De diagnose was gastroschisis, een defect van de buikwand.

Mijn eerste vraag aan jou:

Wat wordt bedoeld met “embryonale plooing” (embryonic folding)?",2025-09-17T15:32:58.792213+00:00
user,embryonale plooiing is het proces waarbij de embryo zich vouwt in laterale richting en van craniaal naar caudaal,2025-09-17T15:33:51.402563+00:00
assistant,"Goed begin! Je benoemt dat de embryo zich zowel in laterale richting (van zijkant naar het midden) als van craniaal naar caudaal (van hoofd naar staartzijde) vouwt. 

Kun je uitleggen waarom deze plooiing belangrijk is voor de uiteindelijke lichaamsstructuur van het embryo? Wat verandert er door dit proces?",2025-09-17T15:33:59.152068+00:00
user,"de vorm van de embryo verandert van een rechte buis naar een meer menselijke vorm, daarnaast verandert de locatie van de organen. deze verplaatsen zich meer naar hun uiteindelijke plek.",2025-09-17T15:35:25.042988+00:00
assistant,"Prima! Je beschrijft correct dat de embryo door plooiing van een vlakke tot een buisvormige structuur evolueert en dat de organen zich tijdens dit proces naar hun uiteindelijke plek verplaatsen. Dat is essentieel voor het ontstaan van de juiste lichaamsvorm en -structuren.

Volgende vraag:  
Noem de drie kiemlagen (germ layers) die tijdens de embryonale ontwikkeling ontstaan. Wat zijn hun namen?",2025-09-17T15:35:32.963186+00:00
user,"endoderm, ectoderm en mesoderm",2025-09-17T15:35:40.060061+00:00
assistant,"Dat klopt! De drie kiemlagen zijn endoderm, ectoderm en mesoderm.

Kun je aangeven welke van deze drie kiemlagen de basis vormt voor het zenuwstelsel en de huid?",2025-09-17T15:35:45.945862+00:00
user,het ectoderm,2025-09-17T15:35:53.37208+00:00
assistant,"Helemaal juist! Het ectoderm vormt de basis voor het zenuwstelsel en de huid.

Nu een andere belangrijke term:  
Wat betekent “morfogenese” in de context van de embryonale ontwikkeling?",2025-09-17T15:36:01.524612+00:00
user,morfogenese heeft te maken met de veranderingen die een embryo doormaakt,2025-09-17T15:36:36.557854+00:00
assistant,"Goed! Je geeft aan dat morfogenese te maken heeft met veranderingen die de embryo doormaakt.

Kun je het iets concreter maken? Wat voor soort veranderingen zijn dit? Denk bijvoorbeeld aan vormen, structuren, of patronen.",2025-09-17T15:36:43.428209+00:00
user,"het embryo begint als platte schijf met drie lagen, daarna begint de gastrulatie waarbij er een meer cilindervormige structuur ontstaat. hierbij worden ook de primordiale organen gevormd",2025-09-17T15:37:42.612278+00:00
assistant,"Mooi! Je koppelt morfogenese aan het ontstaan van de vorm en structuren, en noemt dat het embryo van een platte schijf naar een meer cilindervormige vorm verandert. Je noemt ook de vorming van primordiale organen.

Om samen te vatten: morfogenese omvat dus de processen waarbij cellen en weefsels worden georganiseerd tot specifieke vormen, patronen en structuren—de architectuur van het lichaam ontstaat.

Nu een volgende vraag over het mesoderm:  
Noem de vier subdivisies van het mesoderm die ontstaan tijdens de embryonale ontwikkeling.",2025-09-17T15:37:53.539947+00:00
user,"axiaal, paraxiaal, intermediair en lateraal",2025-09-17T15:38:12.685517+00:00
assistant,"Precies! De vier mesodermale subdivisies zijn: axiaal, paraxiaal, intermediair en lateraal.

Kun je nog benoemen wat wordt bedoeld met ""craniaal"", ""caudaal"", ""ventraal"" en ""dorsaal"" als we spreken over richtingen in het embryo?",2025-09-17T15:38:21.622093+00:00
user,"craniaal is richting het hoofd, caudaal is van het hoofd af, ventraal is naar voren en dorsaal is naar achter",2025-09-17T15:38:56.993405+00:00
assistant,"Heel goed!  
- **Craniaal** is richting het hoofd,
- **Caudaal** is richting de staart/van het hoofd af,
- **Ventraal** is naar de buikzijde (voorzijde),
- **Dorsaal** is naar de rugzijde (achterzijde).

Nu je deze basisbegrippen beheerst, gaan we een slag dieper!  
Kun je uitleggen waarom gastrulatie een cruciaal proces is in de embryonale ontwikkeling? Wat gebeurt er tijdens gastrulatie met de cellen?",2025-09-17T15:39:06.329623+00:00
user,dat weet ik niet,2025-09-17T15:40:10.965042+00:00
assistant,"Geen probleem! Gastrulatie is inderdaad een proces waar veel studenten mee worstelen.

Kun je je herinneren wat er gebeurt met de kiemlagen tijdens gastrulatie? Of: als we beginnen met een “platte schijf” van cellen, wat ontstaat er dan na gastrulatie qua lagen of structuur? Wat weet je over dat aspect?",2025-09-17T15:40:17.962276+00:00
user,"bedoel je dat de platte schijf zich ontwikkelt tot cilinder, en daarna de embryonale vouwingen doorgaat?",2025-09-17T15:44:56.973473+00:00
assistant,"Dat is een goed begin van het redeneren!  

Gastrulatie komt vóór de embryonale plooiingen. Tijdens gastrulatie verandert de platte schijf van cellen in drie *verschillende* kiemlagen (ectoderm, mesoderm en endoderm). Dus het belangrijkste effect is dat die drie lagen gevormd worden uit de oorspronkelijke cellen.

Wil je proberen om in je eigen woorden uit te leggen wat gastrulatie precies doet met die cellen? Wat voor bewegingen of veranderingen vinden plaats?",2025-09-17T15:45:07.10507+00:00
user,craniaal-caudale vouwing en laterale vouwing,2025-09-17T15:46:01.088486+00:00
assistant,"Je beschrijft hier de embryonale plooiing (folding), maar gastrulatie is een *eerdere* stap. 

Tijdens gastrulatie vindt er een belangrijke celbeweging plaats, waarbij cellen van de buitenste laag (epiblast) zich verplaatsen om drie kiemlagen te vormen. Dit gebeurt via een structuur die de primitiefstreep heet.

Kun je nu kort samenvatten wat gastrulatie doet met de cellen, gebaseerd op deze uitleg?",2025-09-17T15:46:09.633989+00:00
user,het ectoderm vouwt naar boven en het endoderm vouwt naar beneden. het mesoderm splitst,2025-09-17T15:47:31.774457+00:00
assistant,"Je redenering komt in de buurt, maar het proces van gastrulatie draait meer om het *binnen migreren* van cellen in plaats van “vouwen.”  
Tijdens gastrulatie migreren cellen door de primitiefstreep en vormen zo de drie kiemlagen:  
- Sommige cellen blijven aan de oppervlakte en worden ectoderm,  
- Andere migreren naar binnen om endoderm te vormen,  
- Cellen die daar tussenin komen vormen het mesoderm.

Wil je dat met deze uitleg zelf proberen samen te vatten:  
Wat gebeurt er tijdens gastrulatie met de positie van de cellen en welke lagen ontstaan er?",2025-09-17T15:47:42.248873+00:00
user,"- Sommige cellen blijven aan de oppervlakte en worden ectoderm,  
- Andere migreren naar binnen om endoderm te vormen,  
- Cellen die daar tussenin komen vormen het mesoderm.",2025-09-17T15:49:06.796725+00:00
assistant,"Goed! Precies dat gebeurt er tijdens gastrulatie: de cellen migreren naar specifieke posities en vormen de drie kiemlagen van waaruit het hele embryo zich verder ontwikkelt.

Nu de volgende stap: Kun je uitleggen waarom embryonale plooing (folding) essentieel is voor het sluiten van de buik en voor het ontstaan van lichaamsvormen zoals we die bij mensen zien? Wat verandert er aan positie en relatie van de kiemlagen of organen door deze plooing?",2025-09-17T15:49:16.246287+00:00
user,door embryonale vouwing komen de primordiale organen op hun plek te liggen. het mesoderm vormt daarbij een laag om deze organen en het ectoderm vormt de huid waardoor alle organen intern liggen en beschermt worden voor externe factoren,2025-09-17T15:51:05.690879+00:00
assistant,"Mooie uitleg! Je benoemt correct dat embryonale vouwing essentieel is om de juiste ruimtelijke ordening van de organen te creëren, waarbij het ectoderm de buitenkant wordt (huid) en het mesoderm zich als beschermende laag rondom de organen vormt.

Laten we nu verder kijken naar het ontstaan van lichaamsholten, iets wat direct voortkomt uit die vouwing:  
Kun je uitleggen hoe de lichaamsholten (zoals de buikholte) ontstaan tijdens de embryonale ontwikkeling? Welke rol speelt het laterale plaatmesoderm hierin?",2025-09-17T15:51:15.372034+00:00
user,het laterale plaat mesoderm splitst en vouwt zowel naar boven als naar beneden. het mesoderm vormt onder andere het peritoneum dat om de organen in de buikholte ligt,2025-09-17T15:53:34.57322+00:00
assistant,"Goed uitgelegd! Het laterale plaatmesoderm splitst inderdaad in twee lagen en draagt zo bij aan het ontstaan van de peritoneale holte rondom de organen. Je noemt terecht het peritoneum (buikvlies) als onderdeel van deze structuur.

Kun je benoemen hoe die twee lagen van het laterale plaatmesoderm heten en wat hun relatie is tot de gevormde lichaamsholte?",2025-09-17T15:53:45.217338+00:00
user,nee,2025-09-17T15:53:53.223209+00:00
assistant,"Geen probleem! Het laterale plaatmesoderm splitst in twee lagen: een die dichter bij het ectoderm ligt en een die dichter bij het endoderm ligt.

Weet je nog hoe je deze lagen zou kunnen noemen op basis van hun ligging? Denk bijvoorbeeld aan termen als “visceraal” en “pariëtaal”—komt dat je bekend voor?",2025-09-17T15:54:12.978027+00:00
user,visceraal ligt direct om een orgaan en parietaal ligt op de buikwand. daartussen is een met vocht gevulde ruimte die de peritoneale holte heeft,2025-09-17T15:54:59.934199+00:00
assistant,"Precies!  
- De **viscerale** laag ligt direct om de organen,
- De **pariëtale** laag bekleedt de buikwand,
- Daartussen ontstaat de met vocht gevulde **peritoneale holte** (of: lichaamsholte).

Nu heb je de belangrijkste processen rond kiemlagen, plooing en holtevorming helder uitgelegd. 

Laten we teruggaan naar de casus:  
Kun je met de kennis die je net hebt herhaald uitleggen wat er in dit geval bij de baby is gebeurd?",2025-09-17T15:55:09.612945+00:00
user,"het parietale peritoneum is niet volledig gesloten, daarnaast is het ectoderm niet helemaal gesloten waardoor er een gat in de buikwand ontstaat waar de organen door naar buiten kunnen komen. dit is dus misgegaan tijdens de embryonale vouwingen",2025-09-17T15:56:12.279071+00:00
assistant,"Heel goed! Je koppelt wat je geleerd hebt met de casus: de buikwand is niet volledig gesloten, doordat de embryonale plooien en bijbehorende lagen (waaronder pariëtaal peritoneum en ectoderm) niet volledig zijn samengekomen. Hierdoor ontstaat er een opening, waardoor de darminhoud naar buiten kan treden—zoals bij gastroschisis.

Wil je proberen te benoemen *waardoor* deze incomplete sluiting extra gevolgen kan hebben voor het embryo? Wat zijn de risico's/complicaties voor de organen die nu buiten de buik liggen?",2025-09-17T15:56:24.518199+00:00
assistant,"**OVERALL SUMMARY**
Je hebt erg actief meegedaan en bent goed omgegaan met vragen die je lastig vond. Je probeert steeds logisch te redeneren en koppelt nieuwe uitleg direct aan de casus. Goed gedaan!

**WHAT YOU DID WELL**
- **Strong Grasp of:** Basisbegrippen zoals embryonale plooiing, de drie kiemlagen, basisrichtingen (craniaal, caudaal, ventraal, dorsaal) en het onderscheid tussen visceraal en pariëtaal peritoneum.
- **Good Application of:** Je linkt theorie sterk aan praktijk (casus), bijvoorbeeld door helder te beschrijven hoe een defect in embryonale vouwing kan leiden tot gastroschisis.

**AREAS FOR GROWTH & FOCUS**
- **Reviewing Key Terms:** Soms was het lastig om heel specifieke informatie te geven over processen (zoals gastrulatie of mesoderm-subdivisies), maar je kon met extra uitleg je antwoord verbeteren.
- **Connecting the Dots:** Het verschil tussen gastrulatie en embryonale plooiing was nog wat verwarrend; let erop om deze processtappen en overgangen scherp te houden.
- **Applying Theory to Practice:** Je past kennis goed toe, maar kunt nog sterker worden in het uitleggen van directe gevolgen van embryonale afwijkingen voor orgaanfunctie en gezondheid na de geboorte.

**ACTIONABLE STUDY RECOMMENDATIONS**
Teken schema’s of concept maps die het verloop van de embryonale ontwikkeling samenvatten (van gastrulatie tot plooiing en holtevorming). Het visueel maken van processtappen en lagen helpt om beter te onthouden welke veranderingen na elkaar plaatsvinden en hoe fouten in elk stadium kunnen leiden tot specifieke aandoeningen zoals gastroschisis.",2025-09-17T15:57:11.95+00:00
