role,content,created_at
user,hoi,2025-09-17T15:18:03.829566+00:00
assistant,"Hallo! Goed dat je begonnen bent. We gaan samen werken aan je kennis over embryonale ontwikkeling, met een focus op de eerste acht weken. Ik geef je steeds een casus en stel je daarna een vraag. We beginnen bij de basis.

### VIGNETTE ###
Een gezonde 25-jarige vrouw had routine prenatale controles. Bij een echo rond 24 weken werd er een kleine opening (ongeveer 5 mm) aan de rechterkant van de buik van de baby gezien, dicht bij de navel. Genetisch onderzoek was normaal. Later werd de opening groter, en delen van de darmen zweefden in het vruchtwater. Bij de geboorte staken delen van de darmen en maag uit de buik, met een kort steeltje. De diagnose: gastroschisis, een buikwanddefect.

Mijn eerste vraag om te starten:

Wat is gastrulatie?",2025-09-17T15:18:17.772863+00:00
user,"gastrulatie is het ontwikkelen van 3 kiemlagen bij een embryo. in eerste instantie bestaat een blastocyst uit een epiblast hypoblast en trophoblast. de trophoblast zorgt dat de blastocyst in door en in de baarmoederwand komt. en als de blastocyst zich dan verder ontwikkeld ontstaat er uit het epiblast en hypo blast, eerst epiderm en nog iets, en daar tussen onstaat mesoderm, uit het epiderm",2025-09-17T15:21:56.646621+00:00
assistant,"Je hebt al een goed begin gemaakt! Je noemt dat gastrulatie zorgt voor de vorming van drie kiemlagen (germ layers) bij het embryo, en dat klopt helemaal. Je beschrijft ook epiblast, hypoblast en de rol van de trophoblast.

Een paar punten om je uitleg te verfijnen:
- Kun je de namen van de drie kiemlagen noemen die ontstaan tijdens gastrulatie?
- En weet je nog wat het verschil is tussen epiblast en hypoblast?

Wil je proberen deze twee vragen te beantwoorden?",2025-09-17T15:22:05.39041+00:00
user,"ja epiderm meso derm, die andere weet ik niet meer. epiblast is lager hypoblast zit hoger tegen het trophoblast aan zeg maar.",2025-09-17T15:23:09.049362+00:00
assistant,"Je zit dicht in de buurt! Je noemt “epiderm” en “mesoderm” als kiemlagen, maar de eerste is nét iets anders genoemd bij embryologie. Denk aan het voorvoegsel “ecto-” in plaats van “epi-”. 

Kun je de drie kiemlagen nog eens proberen te benoemen, nu met deze hint?

En over de epiblast en hypoblast:
- Klopt het dat de epiblast lager zit? Probeer eens te bedenken in het vroege embryo (de bilaminaire schijf): ligt de epiblast boven of onder de hypoblast? 

Probeer het nog eens!",2025-09-17T15:23:20.076602+00:00
user,"ectoderm, epiderm en mesoderm.",2025-09-17T15:23:36.676883+00:00
assistant,"Dichtbij! Je bent goed op weg. De drie kiemlagen zijn allemaal met “-derm,” maar “epiderm” hoort hier niet tussen—epidermis is een afgeleide van één van de kiemlagen.

Kun je nagaan hoe het woord voor de derde kiemlaag klinkt? Het begint met “endo-”.

Wil je de drie kiemlagen nog één keer proberen te benoemen?

En daarnaast: uit welke laag ontstaat de epidermis precies, denk je?",2025-09-17T15:23:44.675003+00:00
user,endoderm mesoderm en ectoderm,2025-09-17T15:24:06.81664+00:00
assistant,"Geweldig! Precies goed: de drie kiemlagen zijn ectoderm, mesoderm en endoderm.

Nog even terugkomend op de vorige vraag:
- Uit welke van die drie kiemlagen ontstaat de epidermis uiteindelijk?

En een nieuwe vraag over de basisbegrippen:

Wat betekent “embryonale plooivorming” (embryonic folding)? Kun je kort uitleggen wat daarmee bedoeld wordt?",2025-09-17T15:24:15.709516+00:00
user,uit het ectoderm,2025-09-17T15:24:33.256596+00:00
assistant,"Precies, de epidermis ontstaat uit het ectoderm. Goed!

Nu terug naar mijn andere vraag:  

Wat betekent “embryonale plooivorming” (embryonic folding)? Kun je kort uitleggen wat daarmee bedoeld wordt? 

Als het lastig is, kun je proberen te beschrijven wat er tijdens deze plooivorming gebeurt met de vorm van het embryo.",2025-09-17T15:24:40.684572+00:00
user,"plooivorming is alles met huid bij een embryo, vaak worden bepaalde delen dan dikker omdat er dus ectoderm weefsel zich opstapelt",2025-09-17T15:25:10.275942+00:00
assistant,"Dat is een interessant begin! Je noemt dat plooivorming te maken heeft met de huid en dat bepaalde delen dikker worden door ophoping van ectoderm, maar embryonale plooivorming gaat over het hele embryo en betreft meer dan alleen ectoderm of huid.

Denk eraan: plooivorming gebeurt rond week 4 en 5 en verandert de vorm van het embryo als geheel. Hierdoor krijgt het embryo zijn driedimensionale (cilindervormige) bouw.

- Kun je proberen te beschrijven wat er met het embryo gebeurt tijdens de plooivorming? Denk aan de hoofd- en staartzijde, en aan de zijkanten.
- Wat gebeurt er met bijvoorbeeld de dooierzak en de positie van de lichaamslagen?

Probeer deze punten eens te benoemen!",2025-09-17T15:25:22.455549+00:00
user,"de embryo vormt naar elkaar toe, en er ontstaat een primitieve groeve, waar omheen word geslagen zeg maar",2025-09-17T15:26:42.155316+00:00
assistant,"Je hebt het over het naar elkaar toekomen van embryonale structuren – dat is een belangrijk aspect! De primitieve groeve hoort echter bij gastrulatie en niet direct bij plooivorming.

Laten we het zo bekijken:
Tijdens embryonale plooivorming (folding) buigt het embryo in meerdere richtingen. Denk aan de “hoofd-staart” (craniaal-caudale) en “zij-aan-zij” (laterale) richtingen.

- Wat gebeurt er met de dooierzak tijdens deze plooivorming?
- En waarom is het belangrijk dat de embryo in beide richtingen vouwt; wat is het gevolg daarvan voor de vorm van het embryo?

Probeer (kort) in je eigen woorden uit te leggen wat het eindresultaat is van die plooivorming!",2025-09-17T15:26:54.856171+00:00
user,"de doorzak die komt meer op afstand, de embryo vouwt in beide richtingen zodat het 1 geheel wordt om het toekomstige ruggenmerg heen",2025-09-17T15:28:02.710789+00:00
assistant,"Mooi, je zit op de goede weg! De embryo vouwt inderdaad in beide richtingen, wat ervoor zorgt dat de structuren meer naar binnen toe komen te liggen en het embryo een buisvormige structuur krijgt rondom het toekomstige ruggenmerg.

Nog iets meer specifiek: door deze vouwen wordt een deel van de dooierzak ingesloten in het embryo en vormt zo het begin van het spijsverteringskanaal (de primitieve darm). De rest van de dooierzak ligt buiten het embryo.

Om je kennis te verbreden:  
Kun je de vier hoofdsubgroepen van het mesoderm opnoemen, gebaseerd op hun ligging in het embryo?",2025-09-17T15:28:14.504324+00:00
user,nee,2025-09-17T15:29:04.086476+00:00
assistant,"Geen probleem, laten we het samen aanpakken! 

Het mesoderm – de middelste kiemlaag – wordt in het jonge embryo verdeeld in vier hoofdsubgroepen, elk met een specifiek patroon van ligging van het midden naar de zijkanten.

Kun je misschien proberen te bedenken of je woorden herkent als:
- **axiaal**
- **paraxiaal**
- **intermediair**
- **laterale plaat**

Herken je hier iets van? Wil je ze eens allemaal proberen op te noemen en aangeven wat je denkt dat de volgorde is van het midden (ruggengraat) naar de zijkant?",2025-09-17T15:29:14.761736+00:00
user,nee,2025-09-17T15:29:39.048634+00:00
assistant,"Dat is niet erg! Laten we het langzaam opbouwen.

Denk aan het embryo in een doorsnede: je ziet het centrale zenuwstelsel (de toekomstige wervelkolom/neural buis) helemaal in het midden liggen. Direct daar omheen bevinden zich verschillende stroken mesoderm.  

- Het stukje helemaal in het midden tegen die neurale buis aan noemen we het **axiale mesoderm**.  
- Direct dááromheen ligt het **paraxiale mesoderm** (denk: 'para' = naast).
- Verder naar buiten ligt het **intermediair mesoderm**.
- Het meest aan de zijkant (lateraal) vind je het **laterale plaat mesoderm**.

Kun je nu proberen deze vier mesoderm-subgroepen op te noemen in hun juiste volgorde van het midden van het embryo naar de zijkant?",2025-09-17T15:29:52.513188+00:00
user,"axiale mesoderm, paraxiale mesoderm, intermediar mesoderm en dan laterale plaat",2025-09-17T15:31:08.316133+00:00
assistant,"Heel goed! Dat is precies de juiste volgorde:  
1. Axiaal mesoderm  
2. Paraxiaal mesoderm  
3. Intermediair mesoderm  
4. Laterale plaat mesoderm

Super! Nog een laatste basisvraag om je kennis compleet te maken:

Wat betekenen de termen ‘craniaal’, ‘caudaal’, ‘ventraal’ en ‘dorsaal’ bij het beschrijven van het embryo? Geef bij elke term aan welke kant of richting bedoeld wordt.",2025-09-17T15:31:53.13524+00:00
user,"craniaal is hoofd-kant, causaal is staart-kant, ventraal naar de buik toe, dorsaal naar de rug toe",2025-09-17T15:32:25.618761+00:00
assistant,"Precies goed!  
- Craniaal = naar het hoofd  
- Caudaal = naar de staart  
- Ventraal = richting de buik  
- Dorsaal = richting de rug  

Heel mooi gedaan! Je beheerst de basisbegrippen.

Nu gaan we een stapje verder en focussen op de processen.  
Kun je uitleggen wat er gebeurt tijdens gastrulatie, en waarom dit proces belangrijk is voor de ontwikkeling van het embryo?",2025-09-17T15:32:34.195964+00:00
user,"blastocyst gaat zich innestelen in de baarmoederwand, en gaat zich ontwikkelen tot 3 kiemlagen, waaronder het mesoderm, dat voortkomt uit het ectoderm. vervolgens ontwikelt het zich verder tot een embryo omdat het zich gaat plooien doordat er om de neurale buis zich een axiale mesoderm, paraxiaal, intermediair Mesoderm en vervolgens het laterale plaat mesoderm.",2025-09-17T15:35:04.689905+00:00
assistant,"Je hebt een mooi overzicht gegeven van het begin van de ontwikkeling, inclusief innesteling, het ontstaan van de kiemlagen en plooivorming. Laten we het proces van gastrulatie zelf nog wat scherper krijgen.

Tijdens gastrulatie ontstaat inderdaad het mesoderm, maar komt dit mesoderm echt uit het ectoderm? Of is er een andere relatie tussen deze kiemlagen?  
En wat zijn de centrale gebeurtenissen tijdens gastrulatie—welke structuur speelt hierin een hoofdrol?

Probeer deze vragen te beantwoorden en licht vooral toe wat gastrulatie precies inhoudt!",2025-09-17T15:35:15.004872+00:00
user,"omdat er een afstand komt tussen het endoderm en ectoderm, komen er cellen uit het endoderm is die ruimte",2025-09-17T15:36:10.04577+00:00
assistant,"Je beschrijft goed dat er tijdens gastrulatie nieuwe lagen ontstaan tussen het endoderm en het ectoderm. Toch is het niet zo dat cellen uit het endoderm komen—ze komen uit de epiblast.

Laten we samen de stappen doornemen:

Tijdens gastrulatie migreren cellen vanuit de epiblast naar beneden door een structuur die de **primitieve groeve** heet. Daarbij vormen ze:
- Het eerste laagje dat cellen naar beneden duwen wordt het **endoderm**,
- De tweede golf cellen wordt het **mesoderm**,
- De overblijvende bovenste cellen worden het **ectoderm**.

Dus: alle drie de kiemlagen komen uit de **epiblast**, niet uit het endoderm of ectoderm zelf.

Kun je nu beknopt uitleggen wat gastrulatie is, en vanuit welk deel van het embryo elk van de drie kiemlagen ontstaat?",2025-09-17T15:36:24.57106+00:00
user,"ooh oke bedankt. uit het epiblast ontstaan eerst het endoderm, dan het mesoderm en vervolgens het ectoderm",2025-09-17T15:37:16.155585+00:00
assistant,"Heel goed! Dat klopt helemaal: alle drie de kiemlagen—endoderm, mesoderm én ectoderm—ontstaan door migratie van cellen uit de epiblast tijdens gastrulatie via de primitieve groeve.

Nu gaan we naar de volgende belangrijke stap in de ontwikkeling:

Waarom ondergaat het embryo embryonale plooivorming (embryonic folding)? Wat is het belang hiervan voor de vorming van de lichaamsstructuren?",2025-09-17T15:37:26.29035+00:00
assistant,"**OVERALL SUMMARY**  
Je hebt met veel inzet gewerkt aan de embryonale basisbegrippen, en je durft steeds opnieuw te proberen, zelfs als het lastig wordt. Je inzet om te blijven antwoorden en je eerlijkheid over wat je nog niet weet, zijn sterke punten! Dat is precies hoe je leert: proberen, fouten maken en verbeteren.

**WHAT YOU DID WELL**
- **Strong Grasp of:** Je kent de drie kiemlagen (ectoderm, mesoderm en endoderm) en kunt ze benoemen. Je weet ook dat de epidermis uit het ectoderm ontstaat. Basisbegrippen als craniaal, caudaal, ventraal en dorsaal gebruik je goed.
- **Good Application of:** Je kan de vier soorten mesoderm opnoemen en hun volgorde aangeven in het embryo. Wanneer je feedback krijgt, pas je je antwoorden vlot aan en pak je nieuwe informatie snel op.

**AREAS FOR GROWTH & FOCUS**
- **Reviewing Key Terms:** Je verwisselde soms termen zoals “epiderm” in plaats van “ectoderm.” Bij de subgroepen van het mesoderm had je wat hulp nodig, maar na uitleg kon je ze goed benoemen.
- **Connecting the Dots:** Het verwoorden van het precieze proces van gastrulatie en plooivorming bleef soms wat algemeen. Het was lastig om uit te leggen uit welke structuur (epiblast) de kiemlagen ontstaan en het exacte verloop van embryonale plooivorming.
- **Applying Theory to Practice:** Je begint steeds meer het grotere plaatje te zien, maar het toepassen en uitleggen van processen verloopt nog wat onwennig en globaal.

**ACTIONABLE STUDY RECOMMENDATION**  
Jouw grootste groeikans ligt bij **processen uitleggen en verbanden leggen**.  
- **Tip:** Maak eens een grote schets of conceptmap van alles wat je nu geleerd hebt (bijvoorbeeld: blastocyst → epiblast/hypoblast → gastrulatie/kiemlagen → plooivorming → mesoderm-subgroepen). Schrijf bij elke stap kort wat er gebeurt en hoe alles samenhangt.  
Zo dwing je jezelf het proces logisch te doorgronden, en wordt de samenhang vanzelf duidelijker. Succes, je bent goed bezig!",2025-09-17T15:38:12.053+00:00
