role,content,created_at
user,ik ben klaar om te beginnen,2025-09-17T16:11:12.34464+00:00
assistant,"Laten we beginnen! Hier is de casus (vignette) waarmee we gaan werken:  

Een gezonde 25-jarige vrouw had routine zwangerschapscontroles. Op een echo bij 24 weken zwangerschap werd een kleine opening (~5 mm) aan de rechterzijde van de buik van de baby, vlak bij de navelstreng, gezien. Genetische testen (vruchtwaterpunctie) bij 26 weken waren normaal. In de loop van de tijd werd de opening groter (tot 34 mm), en delen van de darmen van de baby dreven vrij in het vruchtwater. De baby groeide ook minder goed dan verwacht. Bij 37 weken werd een keizersnede uitgevoerd. De pasgeboren jongen had delen van zijn dunne en dikke darm, en maag, buiten de buikholte liggen. Het ondersteunende weefsel was kort en de darmen waren opgezwollen. De diagnose was gastroschisis — een defect in de buikwand.

Mijn eerste vraag om je kennis te testen:

Wat is gastrulatie?",2025-09-17T16:11:26.458421+00:00
user,"dat is wanneer de 2 lagen van de blastocyst verandert in 3 lagen, de endoderm, mesoderm en ectoderm",2025-09-17T16:14:30.103278+00:00
assistant,"Goed! Gastrulatie is inderdaad het proces waarbij het tweelagige embryo (epiblast en hypoblast) verandert in een drie-lagige kiemschijf bestaande uit ectoderm, mesoderm en endoderm.

Volgende vraag:  
Kun je de namen noemen van de drie kiemlagen (germ layers) en aangeven welke grote lichaamssystemen of orgaangroepen daaruit ontstaan?",2025-09-17T16:14:41.206684+00:00
user,"het ectoderm is de buitenkant en deze zorgt voor de huid en zenuwweefsel, het mesoderm is het middelste en zorgt voor bloed, skelet en spieren; het endoderm is de binnenste laag en zorgt voor spijsverteringsstelsel",2025-09-17T16:17:12.413987+00:00
assistant,"Heel goed! Je noemt de drie kiemlagen en linkt ze aan de juiste hoofdgroepen van organen en weefsels:

- Ectoderm: huid en zenuwstelsel  
- Mesoderm: spier, skelet, bloed, (en ook o.a. het urogenitaal stelsel)  
- Endoderm: spijsverteringsstelsel (en ook longen, lever)

Laten we verdergaan met de terminologie rond het mesoderm:

Noem de vier hoofddelen (subdivisies) van het mesoderm die zich ontwikkelen tijdens de embryonale periode rond week 4 en 5.",2025-09-17T16:17:23.656091+00:00
user,"axiaal, dorsaal",2025-09-17T16:18:29.772166+00:00
assistant,"Je noemt ""axiaal"" en ""dorsaal"", maar het mesoderm wordt in vier specifieke delen onderverdeeld. Je hebt “axiaal” goed — dat is er één! 

Heb je een idee wat de andere drie subdivisies zijn? Denk bijvoorbeeld aan de locatie ten opzichte van het axiale mesoderm en welke naam ze krijgen. Misschien herken je termen als “paraxiaal”, “intermediair”, en “laterale plaat”. Zegt een van deze termen je iets?",2025-09-17T16:18:39.278071+00:00
user,nee,2025-09-17T16:18:54.051479+00:00
assistant,"Geen probleem, het is een lastig onderdeel!  

Laten we het samen doornemen en kijken of er iets bekends klinkt:

- Het axiale mesoderm ligt in het midden (mediaan), bij de chorda dorsalis (notochord).
- Naast het axiale mesoderm ligt het **paraxiale mesoderm** (“para-” = naast), dat o.a. de somieten vormt (die weer aanleiding geven tot spieren en wervels).
- Nog wat verder naar buiten ligt het **intermediaire mesoderm**, dat bijdraagt aan de ontwikkeling van nieren en delen van het voortplantingsstelsel.
- Het meest naar buiten ligt het **laterale plaatmesoderm**, dat zich splitst in twee bladen en betrokken is bij de vorming van het hart, bloedvaten, en het buikvlies (peritoneum).

Kun je, op basis van deze uitleg, nu de vier mesodermale subdivisies in de juiste volgorde vanaf de mediaan naar lateraal noemen? Probeer ze nog eens op te sommen!",2025-09-17T16:19:09.265349+00:00
user,"axiale, paraxiale, intermediaire en laterale",2025-09-17T16:19:47.355963+00:00
assistant,"Precies! Dat is helemaal correct:

1. Axiale mesoderm  
2. Paraxiale mesoderm  
3. Intermediaire mesoderm  
4. Laterale plaatmesoderm

Laten we nog een andere term uit de vroege embryologie behandelen om het overzicht compleet te maken:

Wat betekent ""embryonale plooing"" (embryonic folding), en wat is het doel hiervan tijdens de vierde en vijfde week van de ontwikkeling?",2025-09-17T16:19:57.030658+00:00
user,de platte 3 lagen beginnen zich te vouwen zodat het een 3 dimensionaal wordt en dus ook een wat zichtbaardere craniale en caudale kant krijgt is de vorm van een staart en hoofdje,2025-09-17T16:22:18.488494+00:00
assistant,"Mooi uitgelegd! Je zegt dat de drie platte kiemlagen zich gaan vouwen, waardoor het embryo driedimensionaal wordt, met duidelijkere craniale (hoofd) en caudale (staart) uiteinden. Dat klopt inderdaad.

Wil je nog toevoegen wat het embryo hierdoor, naast een hoofd- en staartkant, verder krijgt qua lichaamsvormen of interne structuren? Bijvoorbeeld: wat gebeurt er met de dooierzak of lichaamsholtes tijdens deze plooing?",2025-09-17T16:22:28.179828+00:00
user,het krijgt ook de gut tube,2025-09-17T16:22:59.877017+00:00
assistant,"Helemaal goed! Door de embryonale plooing ontstaat onder andere de “gut tube” (oerdarm), die gevormd wordt uit het endoderm door het naar binnen vouwen van de drie kiemlagen.

We hebben nu een mooie basis gelegd over de terminologie en basisprocessen van de vroege embryonale ontwikkeling.

Mijn volgende vraag:  
Wat betekenen de termen **ventraal** en **dorsaal** in de context van embryonale ontwikkeling?",2025-09-17T16:23:09.794198+00:00
user,"In de arm worden de ventrale spieren de flexoren, adductoren en pronatoren en de dorsale spieren de extensoren, abductoren en supinatoren",2025-09-17T16:23:43.369009+00:00
assistant,"Interessante link met de spieren! Je hebt gelijk dat de termen “ventraal” en “dorsaal” in de anatomie vaak worden gebruikt om spiergroepen te beschrijven, zoals in de ledematen. Je laat daarmee zien dat je in ieder geval weet waar deze termen naar verwijzen.

Maar, kun je in de context van **embryonale ontwikkeling** uitleggen wat ventraal en dorsaal betekenen? Waar ligt het ventrale en waar het dorsale deel van het embryo? Wat bedoelen we precies met deze ruimtelijke termen in het vroege embryo?",2025-09-17T16:23:53.556234+00:00
user,nee,2025-09-17T16:23:58.421544+00:00
assistant,"Geen probleem, dit is een belangrijk concept!

Denk aan het embryo als een soort “cilinder” in wording.  
- De **ventrale** kant is de buikzijde (de kant waar straks de buik zich ontwikkelt).
- De **dorsale** kant is de rugzijde (waar de wervelkolom en rugspieren zich ontwikkelen).

In veel schema's is de dorsale kant bovenaan getekend en de ventrale kant onderaan, maar in het echte embryo ligt de ventrale kant aan de kant van de dooierzak en de dorsale kant aan de kant van de neurale buis.

Mijn vraag: Kun je nu uitleggen wat er bedoeld wordt met ""ventrale sluiting"" (ventral closure) van het embryo? Wat gebeurt daarbij?",2025-09-17T16:24:09.51165+00:00
assistant,"**OVERALL SUMMARY**  
Je hebt vandaag actief meegedaan met de embryologievragen, en het is duidelijk dat je moeite doet om de basis goed te begrijpen. Je toont doorzettingsvermogen, stelt vragen als je iets niet weet, en bouwt netjes voort op feedback. Dat is super waardevol voor je leerproces!

**WHAT YOU DID WELL**  
- **Strong Grasp of:** Je benoemt duidelijk de drie kiemlagen (ectoderm, mesoderm, endoderm) en hun functies. Je begrijpt het proces van gastrulatie goed, inclusief het doel ervan. Ook kon je het concept van embryonale plooing uitleggen en het ontstaan van de oerdarm benoemen.  
- **Good Application of:** Je kon na uitleg de vier mesodermale subdivisies korrekt opsommen, en je probeert anatomische termen functioneel te koppelen aan voorbeelden, zoals spiergroepen in de arm.

**AREAS FOR GROWTH & FOCUS**  
- **Reviewing Key Terms:** Je hebt moeite met het spontaan benoemen van specifieke subdivisies van het mesoderm en het correct gebruiken van termen als “ventraal” en “dorsaal” in de embryologie-context.  
- **Connecting the Dots:** Het overbrengen van kennis van algemene anatomische termen naar hun betekenis binnen embryologie verdient nog aandacht.  
- **Applying Theory to Practice:** Je antwoorden blijven soms wat algemeen of beschrijvend; probeer je in te leven in de 3D-structuur en de ontwikkeling in het embryo, en pas dat actief toe op vragen.

**ACTIONABLE STUDY RECOMMENDATIONS**  
Om sterker te worden in het leren en onthouden van belangrijke termen (zoals kiemlagen, subdivisies van het mesoderm, ruimtelijke aanduidingen in embryologie), raad ik je aan om **flashcards** te maken en die regelmatig te oefenen, zowel met namen als met korte uitleg van hun functie/locatie. Zo train je je actief herinneren en wordt het makkelijker om diepere vragen te beantwoorden!",2025-09-17T16:24:45.68+00:00
