role,content,created_at
user,laten we beginnen,2025-09-17T13:21:36.520349+00:00
assistant,"Hier is de casus die we gaan gebruiken om het onderwerp te verkennen:

**Vignette:**  
Een gezonde 25-jarige vrouw had routine prenatale zorg. Bij 24 weken zwangerschap liet een echo een kleine opening (~5 mm) zien aan de rechterkant van de buik van de baby, dichtbij de navelstreng. Genetisch onderzoek van het vruchtwater bij 26 weken was normaal. Uiteindelijk werd de opening groter (tot 34 mm), en delen van de darmen van de baby dreven in het vruchtwater. De baby was ook kleiner dan verwacht. Bij 37 weken werd een keizersnede uitgevoerd. De pasgeboren jongen had delen van zijn dunne en dikke darm, en de maag, buiten de buik liggen. Het ondersteunende weefsel was kort en de darmen zagen er gezwollen uit. De diagnose was gastroschisis, een defect in de buikwand.

**Eerste vraag:**  
Wat zijn de drie kiemlagen die tijdens de embryonale ontwikkeling ontstaan?",2025-09-17T13:21:51.867253+00:00
user,"Ectoderm, mesoderm, endoderm",2025-09-17T13:22:02.109043+00:00
assistant,"Goed! De drie kiemlagen zijn het ectoderm, mesoderm en endoderm.

Volgende vraag:
Wat is gastrulatie?",2025-09-17T13:22:07.261098+00:00
user,Ongeveer de derde week van de zwangerschap. Hier veranderd de bilaminaire schijf naar een trilaminaire schijf,2025-09-17T13:22:43.728961+00:00
assistant,"Dat klopt, je geeft al een goede omschrijving van het moment en het resultaat van gastrulatie! Je noemt dat de bilaminaire schijf (twee lagen) verandert in een trilaminaire (drie lagen) schijf. Kun je wat meer vertellen over *wat* er precies gebeurt tijdens gastrulatie? Bijvoorbeeld: welke bewegingen maken de cellen of wat wordt gevormd tijdens dit proces?",2025-09-17T13:22:55.21213+00:00
user,De cellen gaan door de primitieve groeve vanaf het epiblast tussen de twee lagen inzitten. Sommige cellen vermengen met de hypoblast wat uiteindelijk de endoderm word. Verder gaan er cellen vanaf de primitieve groeve en put naar de craniale zijde om de neurale buis te vormen\,2025-09-17T13:24:21.306361+00:00
assistant,"Je bent goed op weg! Je noemt de primitieve groeve, migratie van cellen vanuit het epiblast, en de vorming van het endoderm, heel juist. De beweging van cellen en differentiatie zijn belangrijke onderdelen!

Even een kleine aanvulling: je zegt dat cellen naar de craniale zijde gaan om de neurale buis te vormen. Heb je bedacht welke kiemlaag met name verantwoordelijk is voor de neurale buis? En wat gebeurt er met de cellen die tussen het epiblast en hypoblast blijven liggen, maar niet de hypoblast vervangen?

Kun je voor mij het verschil uitleggen tussen *de cellen die endoderm vormen* en *de cellen die mesoderm vormen* tijdens gastrulatie?",2025-09-17T13:24:32.834447+00:00
user,"Mesoderm is voornamelijk verantwoordelijk.
cellen die tussen epiblast en hypoblast blijven liggen gaan het mesoderm vormen.
Cellen in het mesoderm zijn gedifferentierdeer",2025-09-17T13:25:39.08435+00:00
assistant,"Heel goed! Je hebt juist aangegeven dat de cellen die tussen epiblast en hypoblast blijven liggen, het **mesoderm** vormen. Ook is het mesoderm inderdaad verantwoordelijk voor veel verdergaande differentiatie.

Nog een kleine precisie:  
- De eerste cellen die door de primitieve groeve migreren vervangen de hypoblast en worden endoderm.
- De volgende golf cellen die migreren, vormen het mesoderm en blijven tussen epiblast en endoderm liggen.
- De resterende epiblastcellen worden het ectoderm.

Laten we verder gaan naar het begrip embryonale vouwen (embryonic folding), want dat is belangrijk bij het begrijpen van het klinische geval.

Wat wordt bedoeld met **embryonale vouwen** (“embryonic folding”)?",2025-09-17T13:25:51.620325+00:00
user,Dit is hoe de trilaminaire laag gaat bewegen om uiteindelijk alles op de juiste plek te krijgen,2025-09-17T13:26:31.766709+00:00
assistant,"Dat is een goed begin van je uitleg! Inderdaad, embryonale vouwen zorgen ervoor dat de trilaminaire schijf zich omvormt tot een meer driedimensionale embryo. Kun je nog specifieker beschrijven: 

Welke richtingen van vouwen (denk aan craniaal, caudaal, lateraal) vinden er plaats tijdens embryonale vouwen? Wat is het gevolg van deze vouwen voor de positie van bijvoorbeeld de dooierzak en de ligging van de kiemlagen?",2025-09-17T13:26:40.480523+00:00
user,"een craniale vrouwing en een laterale vouwing.
De kiemlagen kunnen door de laterale vouwing aan elkaar vastsluiten waardoor er een soort rondje ontstaat",2025-09-17T13:27:24.91289+00:00
assistant,"Precies, goed uitgelegd! Tijdens de embryonale ontwikkeling zie je inderdaad een **craniale (kop-staart) vouwing** en een **laterale (zijwaartse) vouwing**.

Door de laterale vouwing sluiten de randen van de trilaminaire schijf naar elkaar toe aan de ventrale zijde, zodat een buisvormig embryo ontstaat. Hierdoor worden interne structuren gevormd en ontstaat de oervorm van de buikholte, en wordt een groot deel van de dooierzak ingesloten als het toekomstige darmkanaal.

Laten we even terug naar basisbegrippen rondom het mesoderm voor het vervolg.

Noem de vier belangrijkste subdivisies van het mesoderm (tip: denk aan de ligging ten opzichte van de middellijn).",2025-09-17T13:27:37.811607+00:00
user,"paroxiamale mesoderm, intermediare mesoderm, laterale mesoderm opgedeeld in splank nog iets (aan endoderme kant) en somatische mesoderm (aan ectoderm kant)",2025-09-17T13:29:01.179248+00:00
assistant,"Je zit heel goed! Je noemt de juiste subdivisies, alleen mag je de termen iets preciezer formuleren:

- Paraxiaal mesoderm  
- Intermediair mesoderm  
- Lateraal plaat mesoderm, onderverdeeld in:  
  - Splanchnisch (visceraal) mesoderm (grenzend aan endoderm)
  - Somatisch (parietaal) mesoderm (grenzend aan ectoderm)

Fijn, dit heb je nu duidelijk!

Graag nog één basisbegrip:  
Wat betekenen de termen **craniaal**, **caudaal**, **ventraal** en **dorsaal** in de embryologie?",2025-09-17T13:29:12.99646+00:00
user,"hoofdzijde, anuszijde, borstzijde, rugzijde",2025-09-17T13:29:32.123487+00:00
assistant,"Heel goed!  
- Craniaal = hoofdzijde  
- Caudaal = anuszijde (staartzijde)  
- Ventraal = borstzijde (buikzijde)  
- Dorsaal = rugzijde

Je beheerst de basisbegrippen nu goed. We gaan nu verder naar de achterliggende processen!

Kun je uitleggen **waarom gastrulatie zo’n cruciale stap is in de embryonale ontwikkeling**? Wat maakt het essentieel voor het verdere verloop van de embryogenese?",2025-09-17T13:29:42.37889+00:00
user,"De gastrulatie is belangrijk voor onder andere vorming van mesoderm en het vormen voor mond, hart en anus platen wat later zich verder ontwikkeld",2025-09-17T13:30:56.211284+00:00
assistant,"Dat is een goed begin! Je noemt de vorming van het mesoderm en de eerste stappen richting belangrijke structuren. Gastrulatie is inderdaad essentieel voor het vormen van de drie kiemlagen, en daarmee de verdere ontwikkeling van alle weefsels en organen.

Denk ook even aan het belang qua specialisatie en organisatie: Waarom zou het ontbreken van gastrulatie betekenen dat een complex organisme zich niet goed kan ontwikkelen? Kun je uitleggen wat er zou gebeuren als dit proces niet optreedt?",2025-09-17T13:31:05.76362+00:00
user,"Als er geen gastrulatie zou plaatsinden zou er dus geen meso, endo en ectoderm gevormd worden. Dit zou ervoor zorgen dat er geen goede aanleg voor organen is, dus zou er een niet levendvatbaar embryo ontstaan",2025-09-17T13:32:12.827681+00:00
assistant,"Precies! Zonder gastrulatie zouden de drie kiemlagen niet ontstaan, en daarmee zouden alle gespecialiseerde weefsels en organen ontbreken. Dit zou leiden tot een niet-levensvatbaar embryo.

Laten we verdergaan met het proces van **embryonale vouwen**.

Kun je uitleggen **waarom embryonale vouwen noodzakelijk zijn voor de vorming van het toekomstige lichaam**? Wat zou er gebeuren als deze vouwprocessen niet of onvolledig plaatsvinden?",2025-09-17T13:32:22.878468+00:00
user,"Als er geen vouwing zou zijn zou bijvoorbeeld het hart boven de mond zitten, de liggen van organen en bindweefsel zou dan ook niet juist zijn",2025-09-17T13:33:14.486127+00:00
assistant,"Goed: als de vouwprocessen uitblijven, liggen organen op de verkeerde plek. Het lichaam van het embryo wordt dankzij de vouwen driedimensionaal en interne structuren—zoals het darmkanaal—krijgen de juiste positie.

Wil je nog toevoegen waarom de sluiting aan de ventrale zijde (ventrale sluiting/ventral closure) zo belangrijk is tijdens de embryonale vouwing? Wat gebeurt er op die plek precies?",2025-09-17T13:33:22.576757+00:00
user,"anders sluiten de lagen, met name het ectoderm niet goed. dan ontstaan er gaten",2025-09-17T13:35:16.654864+00:00
assistant,"Heel goed! Als de ventrale sluiting niet goed plaatsvindt, blijven er openingen bestaan in de buikwand. Hierdoor kunnen inwendige organen buiten het lichaam terechtkomen, zoals we in de casus zagen.

Nu een volgende stap: kun je uitleggen **hoe de verschillende kiemlagen bijdragen aan de vorming van organen en weefsels**? Waarom is het belangrijk te weten uit welke kiemlaag een structuur ontstaat?",2025-09-17T13:35:26.03861+00:00
user,"ectoderm vormt de huid, delen van centrale zenuwstelsel en retina, mesoderm vormt de meeste organen., endoderm vormt bindweefsels en botten",2025-09-17T13:36:53.932065+00:00
assistant,"Je hebt het grotendeels goed, maar kijk nog eens naar de verdeling:

- **Ectoderm**: vormt o.a. de huid (epidermis), het centrale en perifere zenuwstelsel, en de retina van het oog.
- **Mesoderm**: vormt o.a. spieren, botten, bindweefsel, het hart, bloedvaten, nieren, en voortplantingsstructuren.
- **Endoderm**: vormt het epitheel van het spijsverteringskanaal, luchtwegen, lever en pancreas.

Waarom is het nu belangrijk te weten uit welke kiemlaag een orgaan of weefsel ontstaat, denk je? Wat heb je daar in de praktijk aan?",2025-09-17T13:37:07.382603+00:00
user,Als een embryo bepaalde fouten heeft in een bepaalde laag weet je wat de gevolgen heirvan ongeveer zouden kunnen zijn,2025-09-17T13:37:27.818258+00:00
