role,content,created_at
user,laten we beginnen,2025-09-17T13:15:58.306942+00:00
assistant,"Hier volgt de klinische casus om het onderwerp te verduidelijken:

Een gezonde 25-jarige vrouw had routine prenatale zorg. Bij een echo op 24 weken zwangerschap werd een kleine opening (~5 mm) aan de rechterkant van de buik van de baby, vlakbij de navelstreng, gezien. Genetisch onderzoek (vruchtwaterpunctie) op 26 weken was normaal. De opening werd na verloop van tijd groter (tot 34 mm) en delen van de darmen van de baby dreven in het vruchtwater. De baby bleek bovendien kleiner dan verwacht. Op 37 weken werd een keizersnede verricht. De pasgeboren jongen had delen van de dunne en dikke darm, en maag, buiten de buik. Het steunweefsel was kort en de darm was gezwollen. De diagnose was gastroschisis, een defect in de buikwand.

Om te beginnen:  
Wat is embryonale vouwing?",2025-09-17T13:16:12.541669+00:00
user,embryonale vouwing is het proces waarbij de eerste primitieve structuren gevouwen worden (transversaal en kop-staart) om zo op de juiste plek verder te ontwikkelen,2025-09-17T13:18:27.224941+00:00
assistant,"Dat is een goed begin! Embryonale vouwing verwijst inderdaad naar het proces waarbij het embryo zichzelf opvouwt, zowel in transversale richting (zijwaarts) als in de kop-staart richting. Zo komen verschillende weefsels en organen op hun plek te liggen.

Mag ik je vragen:  
Wat zijn de namen van de drie kiemlagen waaruit het embryo na gastrulatie is opgebouwd?",2025-09-17T13:18:36.588149+00:00
user,"mesoderm, ectoderm en endoderm",2025-09-17T13:18:50.663928+00:00
assistant,"Dat klopt helemaal! De drie kiemlagen zijn mesoderm, ectoderm en endoderm. Elk van deze lagen geeft later aanleiding tot verschillende structuren en organen in het lichaam.

Nu een volgende:  
Wat is gastrulatie?",2025-09-17T13:19:21.52965+00:00
user,gastrulatie is het proces waarbij de drie verschillende lagen zich vormen en verder differentiëren. Deze lagen zullen allemaal een eigen deel en rol hebben in het lichaam. Ectoderm = opperhuid. mesoderm= bindweefsel epitheel. endoderm= bekleding darmen etc.,2025-09-17T13:21:30.599071+00:00
assistant,"Dat is correct: gastrulatie is inderdaad het proces waarbij de drie kiemlagen (ectoderm, mesoderm, endoderm) gevormd worden en elk hun eigen rol krijgen in het embryo! Je geeft ook enkele voorbeelden van wat ze vormen.

Een klein duwtje: Het mesoderm vormt meer dan alleen bindweefsel en epitheel; dit kun je later verder uitwerken.

Volgende basisvraag om het begrippenkader af te maken:  
Het mesoderm wordt in vier delen onderverdeeld—kun je ze bij naam noemen?",2025-09-17T13:21:40.879322+00:00
user,"spiervezel, bindweefsel bloedvaten zoiets ik weet het niet precies",2025-09-17T13:22:32.183508+00:00
assistant,"Je bent op het goede spoor! Je noemt al enkele soorten weefsel die uit het mesoderm ontstaan, maar de vraag was gericht op de indeling van het mesoderm in vier anatomische ""subdivisies."" 

Weet je nog hoe deze vier gebieden heten? Ze hebben namen als ""axiaal,"" ""paraxiaal,"" enzovoorts. 

Misschien helpt het als je bedenkt: wat zijn de belangrijkste lokalisaties van het mesoderm in het embryo van binnen naar buiten? Kun je ze opnoemen of herkennen?",2025-09-17T13:22:44.249714+00:00
user,ventraal dorsaal coudaal en crainaal. gok ik,2025-09-17T13:24:05.459439+00:00
assistant,"Goede poging! Je noemt nu vier richtingen of oriëntaties in het embryo — ventraal (buikzijde), dorsaal (rugzijde), caudaal (staartzijde), craniaal (hoofdzijde). Maar de subdivisies van het mesoderm hebben andere namen, gericht op hun positie rond de embryonale as.

Probeer het nog eens:  
Kun je de indeling noemen waarbij het gaat over **axiaal mesoderm**, **paraxiaal mesoderm**, **intermediair mesoderm** en **lateraal plaatmesoderm**?  
Wat weet je van deze termen, of klinken ze bekend?",2025-09-17T13:24:16.00824+00:00
user,nee sorry niet bekend mee,2025-09-17T13:24:37.64422+00:00
assistant,"Geen probleem! Je hoeft het niet meteen te weten — dit is precies waarom oefenen helpt.

Denk je dat je, als je deze vier namen ziet, ze misschien kunt koppelen aan de locatie of functie? Axiaal mesoderm, paraxiaal mesoderm, intermediair mesoderm en lateraal plaatmesoderm:  
- Waar denk je dat **axiaal** in het embryo te vinden is?
- En waar zou **lateraal plaatmesoderm** liggen, denk je?

Probeer te bedenken wat de woorden *axiaal* (as) en *lateraal* (zijkant) betekenen. Heb je een idee op basis van deze namen?",2025-09-17T13:24:51.076487+00:00
