role,content,created_at
user,Hoi,2025-09-17T13:20:37.166051+00:00
assistant,"Hoi! Laten we beginnen met de vignette om het onderwerp te kaderen.

###VIGNETTE###
Een gezonde 25-jarige vrouw had routine prenatale zorg. Bij een echo op 24 weken zwangerschap werd een kleine opening (~5 mm) aan de rechterkant van de buik van de baby gezien, vlakbij de navelstreng. Genetisch onderzoek was normaal. De opening werd groter (tot 34 mm) en delen van de darmen zweefden vrij in het vruchtwater. Bij de geboorte lagen delen van de darmen en de maag buiten de buik, zonder beschermend vlies. De diagnose was gastroschisis, een buikwanddefect.

We beginnen met een basisvraag:

Wat is gastrulatie?",2025-09-17T13:20:47.880314+00:00
user,"de drie kiemlagen ontstaan, endoderm mesoderm en ectoderm?",2025-09-17T13:26:41.940107+00:00
assistant,"Goed geantwoord! Gastrulatie is inderdaad het proces waarbij de drie kiemlagen—endoderm, mesoderm en ectoderm—ontstaan uit het embryonale epiblast.

Laten we verdergaan met een volgende basisvraag:

Wat is embryonale plooiing (embryonic folding)?",2025-09-17T13:26:48.840338+00:00
user,"een fase in de ontwikkeling van het embryo waarin de 3 kiemlagen ontstaan , endoderm mesoderm en ectroderm",2025-09-17T13:28:08.563829+00:00
assistant,"Dat is een goede poging, maar dat beschrijft meer het proces van gastrulatie. Embryonale plooiing is iets anders en komt na gastrulatie. 

Denk aan het woord ""plooiing"": wat gebeurt er letterlijk met het embryo tijdens dit proces? Welke veranderingen ondergaat het embryo qua vorm?

Kun je nogmaals proberen uit te leggen wat embryonale plooiing inhoudt, vooral gericht op de vorm en positie van het embryo?",2025-09-17T13:28:16.864661+00:00
user,"een fase in de embryonale ontwikkeling waarin de 3 kiemlagen onstaan, ectoderm endoderm en mesoderm",2025-09-17T13:29:33.820832+00:00
assistant,"Je herhaalt nu de definitie van gastrulatie, terwijl ik je vraag naar embryonale plooiing (embryonic folding). Het gaat echt om een ander proces dat volgt op gastrulatie.

Denk aan:  
- Hoe verandert de vorm van het embryo bij de plooiing?  
- Wat gebeurt er met de positie van de kiemlagen en de embryonale structuren?  
- Waarvoor is de plooiing belangrijk aan het begin van de embryonale ontwikkeling?

Wat weet je over de manier waarop het eerder platte embryonale schijfje verandert tijdens de plooiing? Wat gebeurt er met het lichaam van het embryo in deze fase?",2025-09-17T13:29:46.19943+00:00
user,"Oh sorry,het liep vast bij mij waardoor mijn antwoorden weggingen ne ik jouw antwooroden niet kon zien..",2025-09-17T13:30:15.980512+00:00
assistant,"Geen probleem! Dat kan gebeuren. We pakken het gewoon weer rustig op vanaf de vorige vraag.

Wat is embryonale plooiing (embryonic folding)?  
Denk hierbij aan: wat gebeurt er met de vorm van het embryo en waarom is dit proces belangrijk?  

Probeer het nog eens in je eigen woorden uit te leggen!",2025-09-17T13:30:22.765858+00:00
user,het embry9o verandert,2025-09-17T13:34:12.312086+00:00
assistant,"Dat klopt, het embryo verandert tijdens embryonale plooiing! Kun je iets specifieker zijn over *hoe* het verandert? Denk aan:

- Wat gebeurt er met de vorm van het embryo?  
- Blijft het plat, of krijgt het een andere vorm?
- Welke kant(en) buigt of vouwt het embryo op?

Kun je daar iets over zeggen?",2025-09-17T13:34:21.095859+00:00
user,"ja, het verandert van een platte kiemschijf naar een 3d structuur",2025-09-17T13:34:47.893627+00:00
assistant,"Precies, heel goed! Tijdens embryonale plooiing verandert het embryo van een platte kiemschijf naar een driedimensionale structuur, waardoor het cilindervormig wordt en meer op een “mini-mensje” gaat lijken.

Volgende vraag om de basis verder uit te diepen:

Noem de drie kiemlagen die ontstaan tijdens de embryonale ontwikkeling, en geef bij elke laag één structuur of orgaan dat hieruit ontstaat.",2025-09-17T13:34:55.869992+00:00
user,endoderm: darmen. mesoderm: spieren. ectoderm: huid,2025-09-17T13:37:23.295905+00:00
assistant,"Prima gedaan!  
- Endoderm: darmen  
- Mesoderm: spieren  
- Ectoderm: huid  

Dat zijn goede voorbeelden van structuren die uit elke kiemlaag ontstaan.

Laten we doorbouwen op de basiskennis:

Kun je de vier hoofdonderdelen van het mesoderm benoemen, bijvoorbeeld: welke termen horen bij de verdeling van het mesoderm langs de lichaamsas?",2025-09-17T13:37:30.855015+00:00
user,uh ik heb echt geen idee,2025-09-17T13:37:53.411316+00:00
assistant,"Geen probleem, dit is een lastigere vraag! Misschien helpt het als ik een denkrichting geef.

Het mesoderm wordt ingedeeld in vier hoofdonderdelen, van het midden naar de zijkant van het embryo. Heb je weleens gehoord van termen als “axiaal”, “paraxiaal”, “intermediair”, of “laterale plaat”?  

Kun je proberen te raden wat bijvoorbeeld “paraxiaal mesoderm” betekent als je naar het woord kijkt? Wat zou “para-” in deze context kunnen aangeven?",2025-09-17T13:38:02.585451+00:00
user,euh iets met door de as?,2025-09-17T13:38:47.899838+00:00
assistant,"Goed geredeneerd! “Para-” betekent inderdaad “langs” of “naast”. Dus paraxiaal mesoderm is het mesoderm dat *naast* de as (de centrale lijn van het embryo) ligt.

Probeer nu eens de vier hoofdonderdelen van het mesoderm te benoemen, van het midden naar de zijkant van het embryo. Welke termen passen hierbij? (Tip: Denk aan axiaal, paraxiaal, ...)",2025-09-17T13:38:58.595514+00:00
user,kan je een plaatje maken om het te verduidelijken?,2025-09-17T13:40:31.476205+00:00
assistant,"Ik kan zelf geen plaatjes genereren, maar ik kan je wel helpen het visueel voor te stellen met woorden en aanwijzingen!

Stel je een dwarsdoorsnede (doorsnede van boven naar beneden) van een vroeg embryo voor. In het midden heb je de as van het embryo (de chorda). Daaromheen de verschillende zones van het mesoderm, naar buiten toe. Het ziet eruit als concentrische lagen (van binnen naar buiten):

1. **Axiaal mesoderm**: Helemaal in het midden, dit vormt de chorda dorsalis (notochord).
2. **Paraxiaal mesoderm**: Direct naast het axiaal mesoderm, vormt later de somieten (waaruit oa wervels en spieren ontstaan).
3. **Intermediair mesoderm**: Nog iets verder naar buiten, vormt onder andere de nieren en geslachtsorganen.
4. **Lateraal plaat mesoderm**: Het meest naar buiten, splitst zich later verder in het somatisch (parietaal) en splanchnisch (visceraal) blad en vormt onder meer de lichaamswand en het hartvlies.

Wil je een suggestie om snel een plaatje hiervan te vinden, of kun je het je nu zo voorstellen?",2025-09-17T13:40:48.148317+00:00
user,ik vind het wel moeilijke taal en terminologie dit,2025-09-17T13:42:38.764711+00:00
assistant,"Dat is heel begrijpelijk! Deze termen zijn best lastig als je ze voor het eerst hoort. Veel geneeskundestudenten vinden dit in het begin verwarrend.

Zullen we het stap voor stap doornemen?  
Misschien helpt het als je elke term apart bekijkt en benoemt wat je al weet of voelt bij het woord.

Laten we beginnen met **axiaal mesoderm**.  
– Wat denk je dat “axiaal” betekent?  
– Waar in het lichaam zou de “as” of “axiaal” zich bevinden denk je?

Samen kunnen we per onderdeel ontdekken wat het is en waar het ligt! Wat denk je?",2025-09-17T13:42:49.267174+00:00
user,ruggenmerg?,2025-09-17T13:43:44.452831+00:00
assistant,"Dat is een hele logische gedachte! De “as” (axiaal) ligt inderdaad centraal, en het ruggenmerg loopt ook langs die centrale as van het lichaam. Maar het “axiaal mesoderm” zelf vormt niet het ruggenmerg. 

Het axiaal mesoderm vormt de **chorda dorsalis** (notochord).  
- De chorda dorsalis is een soort centrale “staaf” in het midden van het embryo.  
- Deze chorda is heel belangrijk voor de ontwikkeling en het sturen van andere structuren, zoals het ruggenmerg en de wervelkolom.

Wil je proberen te verwoorden wat het paraxiaal mesoderm dan betekent, nu je weet waar “axiaal” naar verwijst? Waar zou “paraxiaal” liggen?",2025-09-17T13:43:57.486265+00:00
assistant,"**OVERALL SUMMARY**  
Goed gedaan! Je bleef gemotiveerd, stelde aanvullende vragen, en liet zien dat je openstaat om te leren, ook als het even lastig werd. Het is duidelijk dat je de basis van embryonale ontwikkeling probeert te begrijpen en actief meedoet aan het leerproces.

**WHAT YOU DID WELL**
- **Strong Grasp of:** Je kon de drie kiemlagen benoemen en koppelen aan bijpassende organen of structuren – prima basiskennis!
- **Good Application of:** Je had goed door dat tijdens embryonale plooiing de platte kiemschijf overgaat naar een 3D-structuur. Je durfde ook verbanden te leggen en logisch te redeneren over termen als “paraxiaal”.

**AREAS FOR GROWTH & FOCUS**
- **Reviewing Key Terms:** Je vond de terminologie rondom het mesoderm lastig en de indeling daarvan verwarrend, wat heel begrijpelijk is bij dit onderwerp.
- **Connecting the Dots:** Soms haalde je gastrulatie en embryonale plooiing door elkaar. Probeer de processen en hun volgorde nog eens rustig op een rijtje te zetten.
- **Applying Theory to Practice:** Je hebt vooral aan de basis gewerkt. De toepassing op een casus (zoals gastroschisis) volgt vaak pas als je de fundamenten zeker weet, dus prima dat je daar nu nog niet aan toe kwam.

**ACTIONABLE STUDY RECOMMENDATION**
Omdat je vooral worstelt met lastige termen en hun betekenis:
- **Maak zelf een conceptmap of schemaatje van de embryonale kiemlagen en de indeling van het mesoderm**. Gebruik kleuren, tekeningen of ezelsbruggetjes, en zet bij elke term kort wat eruit ontstaat. Dit helpt om processen, termen en hun onderlinge verbanden visueel (en dus beter!) te onthouden.

Blijf vragen stellen zoals je nu doet – zo komt de kennis uiteindelijk écht binnen!",2025-09-17T13:44:24.171+00:00
