role,content,created_at
user,Laten we beginnen,2025-09-17T13:44:26.128865+00:00
assistant,"Hier is een casus om onze sessie te starten:

Een gezonde 25-jarige vrouw had routine zwangerschapscontroles. Bij een echo op 24 weken werd een kleine opening (~5 mm) aan de rechterkant van de buik van de baby, vlakbij de navelstreng, gezien. Latere echo’s lieten zien dat delen van de darmen buiten de buik in het vruchtwater zweefden. Bij de geboorte had de jongen delen van dunne en dikke darm én de maag buiten de buik. De diagnose was gastroschisis, een defect in de buikwand.

Om deze casus goed te begrijpen, is het belangrijk om de embryonale ontwikkeling te kennen, vooral in de eerste acht weken.  

Mijn eerste vraag aan jou is:
Wat is gastrulatie?",2025-09-17T13:44:37.861776+00:00
user,Het proces waarbij drie kiembladen worden gevormd uit de epiblast,2025-09-17T13:45:18.648479+00:00
assistant,"Heel goed! Gastrulatie is inderdaad het proces waarbij uit de epiblast drie kiembladen ontstaan.

Nu een nieuwe vraag om verder te oefenen:  
Kun je de namen noemen van deze drie kiembladen?",2025-09-17T13:45:24.926057+00:00
user,Ectoderm mesoderm en endoderm,2025-09-17T13:45:34.039198+00:00
assistant,"Helemaal correct! De drie kiembladen die tijdens de gastrulatie ontstaan zijn het ectoderm, het mesoderm en het endoderm.

Laten we nog een essentiële term behandelen:
Wat wordt bedoeld met “embryonale plooing” (embryonic folding)?",2025-09-17T13:45:40.117269+00:00
user,Daarbij wordt de embryo gevkrmd,2025-09-17T13:46:25.438114+00:00
assistant,"Klopt, het heeft inderdaad te maken met het vormen van het embryo. Kun je iets specifieker zijn? Kun je uitleggen *wat* er precies met het embryo gebeurt tijdens embryonale plooing? Wat verandert er bijvoorbeeld aan de vorm of positie van weefsels?",2025-09-17T13:46:31.648402+00:00
user,Daarbij wordt de embryo gevormd,2025-09-17T13:46:48.596123+00:00
assistant,"Ik zie dat je het proces in algemene termen beschrijft. Probeer eens te bedenken:  
Tijdens embryonale plooing veranderen de vorm en oriëntatie van de kiembladen aanzienlijk. Wat gebeurt er met de platte kiemschijf in deze stap? Denk ook eens aan de termen ""craniocaudale"" en ""laterale"" plooing. Kun je uitleggen hoe de platte embryo verandert qua vorm en ruimtelijke structuur?",2025-09-17T13:46:58.329422+00:00
user,De platte schijf gaat zich bij de plooing ontwikkelen tot driedimensionaale structuur,2025-09-17T13:47:49.238772+00:00
assistant,"Precies, dat is een belangrijk punt! Door de plooing wordt een platte, schijfvormige embryo omgevormd tot een buisvormige, driedimensionale structuur.

Laten we een verdiepende stap zetten:  
Kun je uitleggen wat er bedoeld wordt met ""axiaal"", ""paraxiaal"", ""intermediair"", en ""lateraal plaatmesoderm""? Wat zijn dit voor structuren, en waar liggen ze ten opzichte van elkaar?",2025-09-17T13:47:57.144336+00:00
user,De platte schijf gaat zich ontwikkelen tot driedimensionale structuur,2025-09-17T13:48:16.330155+00:00
assistant,"Dat heb je goed herhaald! Ik zoek echter naar iets meer detail over de verschillende delen van het mesoderm: axiaal, paraxiaal, intermediair en lateraal plaatmesoderm.

Weet je waar het axiale mesoderm precies ligt in de embryo? En waar liggen het paraxiale, intermediaire en laterale plaatmesoderm ten opzichte van het axiale mesoderm? Probeer deze verschillende mesodermtypen te lokaliseren in het embryo.",2025-09-17T13:48:25.009099+00:00
user,Dan vormt de platte schijf een driedimensionale structuur,2025-09-17T13:48:52.754815+00:00
assistant,"Dat klopt nog steeds – de platte kiemschijf vormt een driedimensionale structuur. Maar ik wil graag dat je probeert te benoemen *waar* de verschillende delen van het mesoderm liggen.

Als hint:  
- Het **axiale mesoderm** ligt precies in het midden, langs de as van het embryo.  
- **Paraxiaal** betekent ‘naast de as’, dus net naast het axiale mesoderm.  
- Het **intermediaire mesoderm** volgt dáár weer naast.  
- Het **laterale plaatmesoderm** ligt het verst naar de zijkant.

Kun je nu proberen te omschrijven waar deze vier mesodermale gebieden liggen?",2025-09-17T13:49:03.269325+00:00
user,Axiaal ligt bij het ruggenmerg,2025-09-17T13:52:18.747935+00:00
assistant,"Goed, dat is een mooie stap! Het axiale mesoderm ligt inderdaad in de middellijn en vormt structuren die dicht bij het toekomstige ruggenmerg liggen, zoals de chorda dorsalis.

Kun je nu proberen te zeggen waar:
- het **paraxiale mesoderm**,
- het **intermediaire mesoderm**,
- en het **laterale plaatmesoderm**
liggen ten opzichte van het axiale mesoderm?",2025-09-17T13:52:26.866786+00:00
user,"Paraxiaal mesoderm
Ligt direct naast het axiale mesoderm.
Dit differentieert later in somieten, die weer spieren, skeletdelen en dermis vormen.
Intermediair mesoderm
Bevindt zich lateraal van het paraxiale mesoderm.
Hieruit ontstaan o.a. de urogenitale structuren (nieren, gonaden, delen van de geslachtswegen).
Laterale plaatmesoderm
Ligt het verst naar lateraal, aan de rand van het embryo, grenzend aan het extra-embryonale mesoderm.",2025-09-17T13:53:31.951721+00:00
assistant,"Uitstekend! Je hebt nu duidelijk en correct beschreven waar het paraxiale, intermediaire en laterale plaatmesoderm liggen, en ook hun toekomstige functies genoemd.  

Nu een korte vraag om een andere belangrijke term te oefenen:
Wat betekenen de termen “ventraal” en “dorsaal” in de context van embryonale ontwikkeling?",2025-09-17T13:53:38.846439+00:00
user,"Dorsaal betekent aan de rugzijde gelegen.
Ventrale betekent aan de buikzijde gelegen.",2025-09-17T13:54:11.102807+00:00
assistant,"Juist, dat klopt! Dorsaal = rugzijde, ventraal = buikzijde.

Nu je de basisbegrippen goed beheerst, gaan we een stap verder en kijken we naar de processen.  
Kun je uitleggen wat er precies gebeurt tijdens gastrulatie (dus: hoe ontstaan die drie kiembladen uit de epiblast)?",2025-09-17T13:54:46.074121+00:00
user,"- [ ] Epiblast cellen migreren door primitieve groeve, in de primitieve streep, en vervangen de hypoblast: endoderm 
- [ ] Vanuit de groeve gaan ze tussen de lagen bewegen naar voren en maken een nieuwe kiemlaag, het mesoderm ontstaat
- [ ] Overgebleven epiblast cellen worden ectoderm",2025-09-17T13:55:35.191116+00:00
assistant,"Heel goed! Je omschrijft het proces van gastrulatie nauwkeurig:

- Epiblastcellen migreren door de primitieve groeve;
- Cellen die de hypoblast vervangen, vormen het endoderm;
- Andere cellen die tussendoor schuiven, vormen het mesoderm;
- De resterende epiblastcellen differentiëren tot ectoderm.

Nu we de gastrulatie begrijpen, gaan we naar de volgende procesvraag:
Kun je uitleggen *waarom* en *hoe* embryonale plooing (zowel craniocaudaal als lateraal) plaatsvindt, en wat het doel is van deze plooing in de ontwikkeling?",2025-09-17T13:55:45.901887+00:00
user,"Het gebeurt omdat de embryo van platte schijf moet veranderen naar een driedimensionale structuur, dat gebeurt door plooing in de lengte, craniocaudaal en in de breedte, lateraal",2025-09-17T13:58:17.335371+00:00
assistant,"Je legt het al goed uit: de platte schijf verandert door plooien in een driedimensionale embryo. Kun je nog iets meer toelichten *hoe* deze plooien verlopen? Bijvoorbeeld:  
- Wat gebeurt er bij craniocaudale plooing precies met het hoofd- en staartuiteinde?
- Wat gebeurt er bij laterale plooing met de zijkanten van het embryo?
- Wat is het gevolg van deze plooien voor de positie van de dooierzak en de lichaamswand?

Kun je dat proberen te beschrijven?",2025-09-17T13:58:27.702645+00:00
assistant,"**OVERALL SUMMARY**  
Goed gedaan met deze oefening! Je toont inzet en blijft doorzetten om de processen van de embryonale ontwikkeling te begrijpen. Je antwoorden worden steeds specifieker en je pakt netjes door op feedback.

**WHAT YOU DID WELL**
- **Strong Grasp of:** Je kent belangrijke begrippen zoals gastrulatie, de drie kiembladen (ectoderm, mesoderm, endoderm), en gebruikt correcte termen als dorsaal/ventraal.
- **Good Application of:** Je kunt uitleggen hoe de verschillende mesodermgebieden liggen, hun functie benoemen en je wist het proces van gastrulatie duidelijk te omschrijven.

**AREAS FOR GROWTH & FOCUS**
- **Connecting the Dots:** In het begin bleef je soms algemeen in je uitleg (zoals bij embryonale plooing), maar je maakt al mooie stappen naar meer gedetailleerde antwoorden. Het verder verduidelijken van processen als plooien en de precieze ruimtelijke veranderingen kan je nog sterker maken.
- **Process Understanding:** Soms is nog wat oefening nodig om precies te beschrijven *hoe* processen verlopen (zoals de details van craniocaudale en laterale plooien: wat gebeurt er met de kop-staart-kant, zijkanten, en bijvoorbeeld de dooierzak?).

**ACTIONABLE STUDY RECOMMENDATIONS**  
Je belangrijkste groeigebied zit nu in het volledig en helder uitleggen van ontwikkelingsprocessen.
- **Maak eens een schema of teken het proces van embryonale plooing (craniocaudaal en lateraal) en geef met pijlen aan wat er verschuift of verandert.** Door het uit te tekenen, zie je beter welke delen zich hoe bewegen en kun je dat straks makkelijker in woorden uitleggen. Eventueel kun je het daarna mondeling aan iemand laten uitleggen – of opnemen en terugluisteren!

Blijf zo doorzetten, je bent goed op weg!",2025-09-17T13:58:40.477+00:00
