role,content,created_at
user,hallo start de chat,2025-09-17T13:33:43.596818+00:00
assistant,"Welkom! Laten we samen oefenen met embryonale ontwikkeling aan de hand van een praktijkvoorbeeld.

### Casus (Vignette)
Een gezonde 25-jarige vrouw heeft routine prenatale zorg. Bij een echo op 24 weken wordt een kleine opening (ongeveer 5 mm) aan de rechterzijde van de buik van de baby gezien, vlakbij de navelstreng. Genetisch onderzoek was normaal. De opening werd groter (tot 34 mm) en delen van de darmen zweefden in het vruchtwater. Uiteindelijk, na een keizersnede bij 37 weken, had de pasgeboren jongen delen van zijn darmen en maag buiten de buikholte. Dit heet gastroschisis, een buikwanddefect.

Mijn vraag om te starten:  
Wat is gastrulatie?",2025-09-17T13:33:56.096283+00:00
user,de regulatie van de darmen,2025-09-17T13:35:06.274756+00:00
assistant,"Dat is nog niet helemaal correct. Gastrulatie draait niet om de regulatie van de darmen. 

Kun je nadenken of gastrulatie misschien te maken heeft met een vroege fase van embryonale ontwikkeling? Weet je wat er in deze fase met cellen gebeurt?",2025-09-17T13:35:14.638546+00:00
user,is het de aanmaak en de ontwikkeling van de darmen?,2025-09-17T13:35:37.564215+00:00
assistant,"Je zit in de goede richting door te denken aan ontwikkeling! Maar gastrulatie is niet specifiek de ontwikkeling van de darmen.

Laat me het anders vragen: gastrulatie is een proces waarbij uit één laag cellen verschillende lagen ontstaan.  
Kun je je herinneren hoeveel kiemlagen (germ layers) er gevormd worden tijdens gastrulatie, en hoe heten die?",2025-09-17T13:35:44.4031+00:00
user,"3, ectoderm, endoderm en mesoderm",2025-09-17T13:36:02.713323+00:00
assistant,"Helemaal goed! Tijdens gastrulatie ontstaan er drie kiemlagen: ectoderm, mesoderm, en endoderm.

Volgende vraag:  
Wat is embryonale vouwing (embryonic folding)?",2025-09-17T13:36:08.974582+00:00
user,een plat embryo wordt dat driedemensoinaal,2025-09-17T13:37:34.614253+00:00
assistant,"Ja, dat is juist! Embryonale vouwing zorgt ervoor dat het aanvankelijk platte embryo een driedimensionale, buisvormige structuur wordt.

Kun je nog specifieker uitleggen wat er gebeurt tijdens deze vouwing? Bijvoorbeeld: welke richtingen vouwt het embryo (denk aan hoofd, staart, zijkanten)?",2025-09-17T13:37:44.046832+00:00
user,Ik weet het zo niet,2025-09-17T13:38:20.418154+00:00
assistant,"Geen probleem, het is een lastig onderwerp!

Hier een denkhulp: Het embryo vouwt in twee hoofdassen.  
1. De ene as loopt van hoofd naar staart (cranio-caudale richting).
2. De andere as is overdwars, van links naar rechts (laterale richting).

Kun je hiermee beschrijven wat er gebeurt met het embryo door deze vouwbewegingen? Wat gebeurt er met de uiteinden (hoofd en staart) en de zijkanten?",2025-09-17T13:38:33.59426+00:00
user,die vouwen naar elkaar toe?,2025-09-17T13:38:52.749431+00:00
assistant,"Precies! Door de vouwing bewegen de hoofd- en staartuiteinden naar elkaar toe (cranio-caudale vouwing), en de zijkanten (laterale vouwing) bewegen ook naar elkaar toe zodat het embryo meer buisvormig wordt.

Volgende vraag:  
Kun je de drie kiemlagen (ectoderm, mesoderm en endoderm) koppelen aan wat voor soort structuren/organen ze later vormen in het lichaam? Noem bij elke laag een voorbeeld.",2025-09-17T13:39:00.996485+00:00
user,weet ik niet,2025-09-17T13:40:57.668252+00:00
assistant,"Geeft niet, dit is iets wat je vaak moet oefenen.

Laten we per laag één voorzet geven, en kun jij aanvullen of raden waar ze bij horen?

- Ectoderm vormt o.a. de buitenkant van het lichaam. Kun je bedenken wat voor orgaan helemaal aan de buitenkant zit?
- Mesoderm vormt vaak 'tussenstructuren', zoals spieren en ... ?
- Endoderm vormt de bekleding van inwendige ... ?

Kun je zo iets invullen of aanvullen?",2025-09-17T13:41:07.1816+00:00
user,"ectoderm vormt de huid, mesoderm vormt de organen en de endoderm de darmen",2025-09-17T13:41:30.033932+00:00
assistant,"Heel goed! Je koppelt de lagen mooi aan delen van het lichaam:

- Ectoderm: huid (en ook het zenuwstelsel)
- Mesoderm: inderdaad veel organen, vooral spieren, botten, nieren, hart, bloedvaten
- Endoderm: het spijsverteringskanaal (darmen, maag) en de binnenbekleding van ademhalingsorganen

Laten we verdergaan:  
Het mesoderm wordt tijdens de embryonale ontwikkeling onderverdeeld in vier delen. Kun je één of meer van deze mesodermale subdivisies noemen? (Tip: denk aan assen zoals 'axiaal', 'paraxiaal', ...?)",2025-09-17T13:41:41.089541+00:00
user,"axiaal, paraxiaal",2025-09-17T13:46:02.882568+00:00
assistant,"Goed! Dat zijn er al twee: axiaal mesoderm en paraxiaal mesoderm.

Weet je ook hoe de andere subdivisies van het mesoderm heten? Misschien kun je ze raden als je denkt aan de ligging (midden, naast het midden, verder naar buiten…).",2025-09-17T13:46:09.344605+00:00
user,centriaal,2025-09-17T13:46:16.650366+00:00
assistant,"Dat is een logische gok, maar ""centriaal"" is niet één van de gebruikte termen. Denk aan woorden die ""tussenin"" of ""aan de zijkant"" aanduiden. 

Weet je wat ""intermediair"" in het lichaam kan betekenen?  
Kun je, naast axiaal en paraxiaal, de termen ""intermediair mesoderm"" en ""laterale plaat mesoderm"" plaatsen? Wat denk je dat ze betekenen qua ligging?",2025-09-17T13:46:27.261101+00:00
user,"is het dat axiaal, paraxiaal, intermediair en lateraal?",2025-09-17T13:47:32.096525+00:00
assistant,"Ja, precies! De vier subdivisies van het mesoderm zijn:

- Axiaal mesoderm
- Paraxiaal mesoderm
- Intermediair mesoderm
- Laterale plaat mesoderm

Goed gedaan!

Nog een begrippenvraag om af te sluiten:  
Wat betekenen de begrippen ""caudaal"", ""craniaal"", ""ventraal"" en ""dorsaal"" als het gaat om richtingen in het embryo? Kun je er een paar uitleggen?",2025-09-17T13:47:42.097188+00:00
user,"van de kop naar de staart, van de ene zijkant naar de andere zijkant",2025-09-17T13:48:07.545993+00:00
assistant,"Je bent goed op weg met ""van de kop naar de staart""! Dat hoort bij ""craniaal"" (kopzijde) en ""caudaal"" (staartzijde).

Zou je kunnen proberen ""ventraal"" en ""dorsaal"" te omschrijven? Wat betekent bijvoorbeeld ""ventraal"" in vergelijking met ""dorsaal""?",2025-09-17T13:48:15.865835+00:00
user,kan je het niet even voor mij opschrijven en samenvatten onder elkaar,2025-09-17T13:48:33.771121+00:00
assistant,"Ik begrijp dat je het overzichtelijk wilt! Maar het is belangrijk dat je eerst zelf probeert te omschrijven wat je van de termen weet.  
Kun je proberen te beschrijven wat ""ventraal"" en ""dorsaal"" betekenen in het embryo? Vaak helpt het om aan een dier of je eigen lichaam te denken – waar zou de rug en waar zou de buik zitten?",2025-09-17T13:48:42.079836+00:00
user,dorsaal de buik,2025-09-17T13:48:55.602504+00:00
assistant,"Nog bijna goed! Denk eens aan “dorsaal” versus “ventraal”: Dorsaal is het tegenovergestelde van ventraal.

Als je denkt aan een dier op vier poten: aan welke kant zit de rug, en aan welke kant de buik? Kun je daarmee je beschrijving aanpassen?",2025-09-17T13:49:04.063481+00:00
user,ene de bovenkant en de onderkant,2025-09-17T13:49:16.162249+00:00
assistant,"Dat klopt grotendeels! Dorsaal verwijst meestal naar de rugzijde (bovenkant bij viervoeters), en ventraal naar de buikzijde (onderkant).

Laatste check:  
Kun je nu in het kort “craniaal”, “caudaal”, “dorsaal” en “ventraal” elk in één zin omschrijven? Probeer het eens!",2025-09-17T13:49:23.540762+00:00
user,"craniaal: kopzijde, caudaal: staartzijde, dorsaal rugzijde en ventraal buikzijde",2025-09-17T13:50:12.115949+00:00
assistant,"Perfect! Je hebt ze allemaal juist benoemd:

- Craniaal: kopzijde
- Caudaal: staartzijde
- Dorsaal: rugzijde
- Ventraal: buikzijde

Goed gedaan!  
Nu kunnen we naar de volgende stap: meer over de processen achter deze begrippen.

Waarom is gastrulatie zo belangrijk voor de latere ontwikkeling van het embryo? Wat gebeurt er door gastrulatie wat cruciaal is voor de vorming van het lichaam?",2025-09-17T13:50:20.702365+00:00
user,de kiemlagen moeten goed worden opgebouwd zodat er niks mis gaat en er ook geen afwijkingen zoals spina bifida ontstaan,2025-09-17T13:51:08.746597+00:00
assistant,"Goed begin! Je noemt terecht dat de kiemlagen goed moeten worden opgebouwd en dat afwijkingen, zoals spina bifida, kunnen ontstaan als dat niet goed gebeurt.

Kun je uitleggen hoe het ontstaan van deze kiemlagen (ectoderm, mesoderm, endoderm) bijdraagt aan de vorming van verschillende organen of structuren in het lichaam? Waarom moet gastrulatie dus zo nauwkeurig verlopen?",2025-09-17T13:51:17.320583+00:00
user,uit de kiemlagen ontstaan de organen,2025-09-17T13:52:21.458595+00:00
assistant,"Dat klopt! Uit de kiemlagen ontstaan alle organen en weefsels van het lichaam.

Wil je dat verder toelichten? Denk bijvoorbeeld:  
- Wat zou er gebeuren als cellen niet op de juiste plek belanden tijdens gastrulatie?  
- Wat is het gevolg voor de vorming van het lichaam als dit proces fout loopt?  

Kun je daar iets over zeggen?",2025-09-17T13:52:29.785607+00:00
assistant,"**OVERALL SUMMARY**  
Je hebt enthousiast en doorzettend meegedaan met de vragen en oefencasus rondom embryonale ontwikkeling. Je toont inzet om begrippen te begrijpen en staat open voor feedback, wat belangrijk is bij het leren van complexe stof.

**WHAT YOU DID WELL**
- **Strong Grasp of:** Je weet goed dat er drie kiemlagen zijn (ectoderm, mesoderm, endoderm) en je koppelde deze correct aan de juiste lichaamsstructuren. Ook kon je de begrippen craniaal, caudaal, dorsaal en ventraal uiteindelijk helder benoemen.
- **Good Application of:** Je wist bij herhaling antwoorden te verbeteren op basis van hints. Ook probeerde je actief verbanden te leggen tussen bouwfouten in het embryo en problemen in de latere ontwikkeling (zoals spina bifida).

**AREAS FOR GROWTH & FOCUS**
- **Reviewing Key Terms:** In het begin was het lastig om sommige begrippen exact te omschrijven (zoals gastrulatie, en de subdivisies van het mesoderm). Dit is logisch bij ingewikkelde embryologie, maar het blijft belangrijk om deze begrippen paraat te hebben.
- **Connecting the Dots:** Je kunt profiteren van nog wat meer oefenen met uitleggen HOE processen samenhangen, bijvoorbeeld door niet alleen te noemen dat kiemlagen organen vormen, maar ook hoe het misgaan van zo’n proces tot specifieke afwijkingen leidt.

**ACTIONABLE STUDY RECOMMENDATIONS**
Je grootste leerpunt ligt bij het proces-denken – het uitleggen hoe stappen in de ontwikkeling met elkaar samenhangen en hoe fouten daarin tot afwijkingen leiden, dus:

**Teken zelf schema’s of conceptmaps van de verschillende ontwikkelingsfasen (zoals gastrulatie en embryonale vouwing) en noteer erbij welke structuren uit welke kiemlaag voortkomen. Door het tekenen en benoemen zie je sneller hoe alles samenhangt !**",2025-09-17T13:54:56.817+00:00
