role,content,created_at
user,Begin,2025-09-17T15:42:26.266143+00:00
assistant,"Here is a clinical scenario to help contextualize our learning:

A healthy 25-year-old woman had routine prenatal care. At 24 weeks of pregnancy, an ultrasound revealed a small opening (~5 mm) on the right side of the baby’s belly, near the umbilical cord. Genetic tests (amniotic fluid analysis) at 26 weeks were normal. Over time, the opening enlarged (up to 34 mm), and parts of the baby’s intestines were seen floating in the amniotic fluid. The baby also measured smaller than expected. At 37 weeks, a caesarean section was performed. The newborn boy had parts of his small and large intestines, and stomach, located outside the abdomen. The supporting tissue was short, and the bowel appeared swollen. The diagnosis was gastroschisis, a defect in the abdominal wall.

Let’s start by building some foundational knowledge.

**Question:**  
What are the three primary germ layers that form during early embryonic development?",2025-09-17T15:42:40.55416+00:00
user,Zeg het Nederlands a.u.b.,2025-09-17T15:42:49.102785+00:00
assistant,"Natuurlijk! Hier is de casus om ons onderwerp te plaatsen:

Een gezonde vrouw van 25 jaar had routine zwangerschapszorg. Bij een echo op 24 weken zwangerschap werd een kleine opening (~5 mm) aan de rechterkant van de buik van de baby gezien, dicht bij de navelstreng. Genetisch onderzoek (via vruchtwaterpunctie) op 26 weken was normaal. In de loop van de zwangerschap werd de opening groter (tot 34 mm) en was te zien dat delen van de darmen van de baby in het vruchtwater zweefden. De baby groeide ook minder snel dan verwacht. Bij 37 weken werd middels een keizersnede een jongetje geboren met een deel van zijn dunne en dikke darm, en ook de maag, buiten de buik. Het ondersteunend weefsel was kort en de darmen zagen er opgezwollen uit. De diagnose was gastroschisis, een buikwanddefect.

Laten we beginnen met wat basiskennis:

**Vraag:**  
Wat zijn de drie kiemlagen die zich vormen tijdens de vroege embryonale ontwikkeling?",2025-09-17T15:43:04.733401+00:00
user,"Ectoderm, mesoderm en endoderm",2025-09-17T15:44:36.101558+00:00
assistant,"Helemaal correct! De drie kiemlagen zijn het ectoderm, mesoderm en endoderm.

Laten we verdergaan:

**Vraag:**  
Kun je uitleggen wat gastrulatie is? Wat gebeurt er tijdens dit proces?",2025-09-17T15:44:43.423268+00:00
user,Volgensmij wordt er een gastrula gevormd,2025-09-17T15:46:15.346817+00:00
assistant,"Dat klopt, gastrulatie leidt tot de vorming van een gastrula. Kun je iets meer beschrijven wat er tijdens gastrulatie gebeurt? Bijvoorbeeld: wat verandert er in het embryo en wat is het belang van deze stap?",2025-09-17T15:46:21.03497+00:00
user,De kiemlagen ontstaan dan ?,2025-09-17T15:46:58.758577+00:00
assistant,"Precies, tijdens de gastrulatie ontstaan de drie kiemlagen! Goed opgemerkt.

**Vervolgvraag:**  
Wat is embryonale vouwing (embryonic folding), en waarom is deze stap zo belangrijk tijdens de ontwikkeling in week 4 en 5? Wat gebeurt er met het embryo tijdens deze vouwing?",2025-09-17T15:47:06.395272+00:00
user,Ik denk dat dan de organen worden gevormd,2025-09-17T15:47:38.588861+00:00
assistant,Je denkt in de goede richting: tijdens en na de embryonale vouwing begint inderdaad de vorming van organen (organogenese). Maar kun je iets specifieker beschrijven wat er fysiek gebeurt met het embryo tijdens deze vouwing? Bijvoorbeeld: verandert de vorm van het embryo? Wat gebeurt er met de ligging van de kiemlagen en de dooierzak?,2025-09-17T15:47:45.767809+00:00
user,Kan jij het uitleggen,2025-09-17T15:48:10.104282+00:00
assistant,"Dat kan ik zeker, maar ik wil graag dat je eerst zelf nog even nadenkt! Je zat al dicht bij het goede antwoord.

Denk bijvoorbeeld aan hoe een plat embryo verandert tijdens de vouwing. Wordt het embryo rond, krijgt het een buis, of blijft het plat?  
Wat gebeurt er met de buikwand en de positie van de organen ten opzichte van de buitenkant van het embryo?

Kun je dit proberen te beschrijven?",2025-09-17T15:48:19.474348+00:00
user,De embryo wordt rond,2025-09-17T15:48:38.8746+00:00
assistant,"Goed! Inderdaad, door de embryonale vouwing verandert het embryo van een platte schijf naar een meer ronde, buisvormige structuur. 

Kun je nu nog iets toevoegen over wat er gebeurt met de voorkant (ventrale zijde) van het embryo tijdens deze vouwing? Denk bijvoorbeeld aan de vorming van de buikwand en het sluiten ervan. Wat gebeurt er met de dooierzak?",2025-09-17T15:48:46.684375+00:00
user,Ik weet het niet,2025-09-17T15:49:23.450694+00:00
user,Ga verder,2025-09-17T15:50:56.804703+00:00
assistant,"Zeker, ik zal je helpen het verder in te vullen, stap voor stap.

Tijdens de embryonale vouwing vouwt het embryo in twee richtingen:  
1. **Craniocaudaal** (van hoofd naar staart)
2. **Lateraal** (van zijkant naar zijkant)

Hierdoor:
- Worden de zijkanten van het embryo naar beneden en naar voren toe getrokken, zodat de buikwand dichtgaat.
- De dooierzak wordt deels opgenomen in het embryo en vormt de primitieve darm.
- Het embryo krijgt een buisvorm met een omhulde buikholte.

Nu een volgende basisvraag:
Hoe heet het deel van de mesoderm dat direct naast de middenlijn van het embryo ligt en een belangrijke rol speelt in de vorming van wervels en spieren?",2025-09-17T15:51:11.155895+00:00
user,Ruggenmerg,2025-09-17T15:51:45.128389+00:00
assistant,"Je zit in de buurt, want het ruggenmerg ontstaat inderdaad ook vroeg in de ontwikkeling, maar ik bedoelde specifiek een deel van het mesoderm — één van de drie kiemlagen.

Even een hint: Van het mesoderm zijn er vier hoofdonderdelen: het axiaal mesoderm, paraxiaal mesoderm, intermediair mesoderm en laterale plaat mesoderm. Het deel **naast** de middenlijn heet het … mesoderm.

Weet je welke van die vier direct naast de middenlijn ligt en belangrijk is voor wervels en spieren?",2025-09-17T15:51:55.137413+00:00
user,Intermediar,2025-09-17T15:52:11.976299+00:00
assistant,"Dat is een logische gok, maar nog nét niet juist! Het **intermediair mesoderm** ligt iets verder naar buiten toe.

Denk aan het woord ‘para’, wat ‘naast’ betekent.  
Welke van de vier mesoderm-subtypes lijkt daar het meest op, als je denkt aan positie ‘naast’ de as/middenlijn?",2025-09-17T15:52:19.880385+00:00
user,Paraxiaal mesoderm,2025-09-17T15:52:33.301008+00:00
assistant,"Helemaal goed! Het **paraxiale mesoderm** ligt direct naast de middenlijn (notocord) en is inderdaad belangrijk voor de vorming van wervels en spieren.

Laten we nog één begrip behandelen:

Hoe noem je de twee lagen die ontstaan uit het laterale plaat mesoderm, en welke structuren vormen ze uiteindelijk?",2025-09-17T15:52:43.00623+00:00
user,Weet ik niet,2025-09-17T15:53:05.495108+00:00
user,Weet ik niet,2025-09-17T15:54:07.588408+00:00
assistant,"Dat is helemaal niet erg! De termen zijn inderdaad lastig.

De twee lagen die ontstaan uit het laterale plaat mesoderm heten:
- **Pariëtaal mesoderm** (ook wel somatisch genoemd): vormt de bekleding tegen de lichaamswand.
- **Visceraal mesoderm** (ook wel splanchnisch genoemd): vormt de bekleding tegen de organen.

Wil je dat ik een duidelijk overzichtje geef van wat elk van deze lagen vormt? Of zullen we verder gaan met een nieuwe vraag?",2025-09-17T15:54:24.115785+00:00
user,Ja,2025-09-17T15:54:28.270174+00:00
assistant,"Hier is een kort overzicht:

**Pariëtaal (somatisch) mesoderm:**  
- Ligt tegen de buitenkant van de embryonale lichaamsholte (coeloom).  
- Vormt samen met ectoderm het lichaamswandweefsel (bijvoorbeeld de buikwand).

**Visceraal (splanchnisch) mesoderm:**  
- Ligt tegen de binnenkant van de embryonale lichaamsholte, direct rondom de organen.  
- Vormt het bindweefsel en de spieren rond het maag-darmkanaal en andere organen.

Laten we doorgaan met een nieuwe vraag:

Tijdens de embryonale vouwing hoor je termen als **craniaal** en **caudaal**.  
Wat betekent “craniaal” en wat betekent “caudaal” bij het beschrijven van het embryo?",2025-09-17T15:54:50.955984+00:00
user,Craniaal is richting het hoofd en caudaal is richting de staart,2025-09-17T15:55:45.975616+00:00
assistant,"Precies goed! Craniaal betekent richting het hoofd, en caudaal betekent richting de staart of het einde van het embryo.

Nu een laatste begrippenvraag voordat we verder gaan:

Wat betekenen de termen **ventraal** en **dorsaal** bij het beschrijven van het embryo?",2025-09-17T15:55:52.698452+00:00
user,Ventraal is verticaal gesneden en dorsaal is in het midden gesneden,2025-09-17T15:56:13.67159+00:00
assistant,"Je verwart de termen een beetje met doorsneden (zoals sagittaal of transversaal). Ventraal en dorsaal geven eigenlijk richtingen aan!

Hint:  
- Ventraal betekent aan de buikzijde (de voorkant).
- Dorsaal betekent aan de rugzijde (de achterkant).

Kun je met deze uitleg nog eens proberen de termen ventraal en dorsaal te beschrijven voor het embryo?",2025-09-17T15:56:21.180769+00:00
user,Ventraal is de voorkant en dorsaal is de achterkant,2025-09-17T15:56:36.239071+00:00
assistant,"Helemaal juist! Ventraal is de voorkant (buikzijde) en dorsaal is de achterkant (rugzijde) van het embryo.

Nu je deze basisbegrippen onder de knie hebt, gaan we een stapje verder en kijken we naar de processen:

**Kun je uitleggen wat er gebeurt tijdens gastrulatie, stap voor stap? Waarom is dit proces zo belangrijk voor de latere ontwikkeling van het embryo?**",2025-09-17T15:56:49.233109+00:00
user,Het proces is belangrijk omdat er tijdens de gastrulatie belangrijke organen worden gevormd en een blastocyt veranderd denk ik in een granulocyt,2025-09-17T15:57:52.13414+00:00
assistant,"Je zit in de goede richting: gastrulatie is inderdaad erg belangrijk voor het ontstaan van organen, en het embryo verandert van vorm. Wat terminologie verdient wat aandacht: een **blastocyt** is een heel vroeg stadium, en een **granulocyt** is een type witte bloedcel — dat hoort hier niet bij.

Als hulp:
Tijdens gastrulatie ontstaat uit de twee- of driedelige kiemlaag het volledige lichaamsplan:  
- Uit één laag ontstaan drie kiemlagen.
- Die kiemlagen zijn de basis voor alle organen en weefsels.
- Dit proces bepaalt hoe de rest van het embryo zich organiseert.

Kun je nu stapsgewijs proberen te omschrijven wat er gebeurt tijdens gastrulatie, met name wat er met die kiemlagen gebeurt?",2025-09-17T15:58:37.348599+00:00
user,Dus uit een laag instant 3 kiemlagen wat helpt met het vormen van weefsel en organen en de embryo vouwt zich hij wordt rond en er is een buis,2025-09-17T15:59:20.128682+00:00
assistant,"Heel goed! Je beschrijft het al sterk. Tijdens gastrulatie ontstaat uit één laag (epiblast) inderdaad drie kiemlagen (ectoderm, mesoderm, endoderm). Dat vormt de basis voor alle weefsels en organen.

Nog iets specifieker:  
- **Eerst migreren cellen naar binnen via de primitieve streep.**
- **Daaruit ontstaan de drie kiemlagen.**

Wil je dat ik deze stap voor stap uitschrijf, of zullen we doorgaan naar de volgende procesvraag?",2025-09-17T15:59:31.148331+00:00
user,Ja,2025-09-17T15:59:34.576316+00:00
assistant,"Hier zijn de stappen van gastrulatie stap voor stap:

1. **Vorming van de primitieve streep:** Op het oppervlak van het embryo ontstaat een verdikte streep (de primitieve streep) aan de achterzijde.
2. **Cellen migreren naar binnen:** Cellen van het epiblast bewegen naar de primitieve streep toe en duiken naar binnen (invaginatie).
3. **Vorming van de kiemlagen:**  
   - Sommige cellen vervangen de hypoblast en vormen zo het **endoderm** (binnenlaag).
   - Een andere groep cellen gaat tussen epiblast en endoderm liggen en wordt het **mesoderm** (middelste laag).
   - De overblijvende cellen van het epiblast vormen het **ectoderm** (buitenlaag).
4. **Leggen van lichaamsplan:** Deze drie kiemlagen vormen de basisindeling waaruit organen en weefsels ontwikkeld worden.

Laten we nu even verder kijken naar het tweede proces in het vroege embryo:

**Kun je uitleggen wat embryonale vouwing precies inhoudt, en waarom dit proces kritisch is voor de uiteindelijke vorm en functie van het lichaam?**",2025-09-17T16:00:07.46716+00:00
user,Weet ik niet,2025-09-17T16:01:56.320926+00:00
assistant,"Helemaal goed dat je dat aangeeft! Een tip: embryonale vouwing gebeurt direct na de gastrulatie en zorgt ervoor dat het embryo van een platte schijf naar een 3D lichaam verandert.

Denk eens na over deze vragen om je op weg te helpen:
- In welke richtingen vouwt het embryo?  
- Welk effect heeft dit op de buik en de lichaamswand?  
- Waarom zou het belangrijk zijn voor het insluiten van organen en het vormen van de lichaamsholte?

Wil je met deze hints een poging doen om te beschrijven wat embryonale vouwing doet?",2025-09-17T16:02:09.533538+00:00
user,De organen worden beschermd en de buik wordt gevormd,2025-09-17T16:02:39.897368+00:00
assistant,"Goed! Door embryonale vouwing worden inderdaad de organen omsloten en beschermd en wordt de buik (buikwand) gevormd.

Wil je proberen nog iets toe te voegen over *hoe* deze vouwing plaatsvindt? Denk bijvoorbeeld: vouwt het embryo in één richting of in meerdere richtingen? Wat gebeurt er met de dooierzak?",2025-09-17T16:02:47.602647+00:00
user,In meerdere richtingen en ik weet niet wat de dooierzak doet,2025-09-17T16:03:05.032767+00:00
assistant,"Prima, het klopt dat de vouwing in meerdere richtingen gebeurt!  
- Craniocaudaal (van hoofd naar staart)
- Lateraal (van links naar rechts)

Wat betreft de dooierzak:  
Een deel van de dooierzak wordt tijdens de vouwing opgenomen in het embryo en vormt de voorlopers van het spijsverteringskanaal.  
De rest van de dooierzak blijft buiten het embryo.

Nog een vervolgvraag over de relaties tussen kiemlagen en organen:

**Welke structuren of weefsels ontstaan grofweg uit elk van de drie kiemlagen: ectoderm, mesoderm en endoderm? Denk aan huid, spieren, darmen, zenuwen enzovoorts.** Kun je voor elk kiemlaag één of twee voorbeelden geven?",2025-09-17T16:03:16.709392+00:00
assistant,"**OVERALL SUMMARY**  
Goed gedaan met het beantwoorden van de vragen over embryonale ontwikkeling! Je inzet en eerlijkheid wanneer je het antwoord niet wist, zijn heel waardevol voor je leerproces. Je neemt actief deel aan het gesprek en blijft proberen, ook als de materie lastig wordt.

**WHAT YOU DID WELL**  
- **Strong Grasp of:** Je kent de drie kiemlagen (ectoderm, mesoderm en endoderm) goed en je begrijpt de begrippen craniaal/caudaal en ventraal/dorsaal duidelijk.
- **Good Application of:** Je herkent het belang van processen als gastrulatie en embryonale vouwing voor het vormen en beschermen van organen. Ook het idee dat het embryo rond wordt door vouwing, beschrijf je helder.

**AREAS FOR GROWTH & FOCUS**  
- **Reviewing Key Terms:** Bij sommige gespecialiseerde termen (zoals de delen van het mesoderm of het onderscheid tussen blastocyt/granulocyt) heb je wat moeite. Soms verwissel je ook richtingsaanduidingen met doorsneden.
- **Connecting the Dots:** Het uitleggen in meerdere stappen van processen als gastrulatie en embryonale vouwing is nog een uitdaging. Je weet het eindresultaat vaak wel, maar details als de manier van celmigratie en waarom bepaalde stappen belangrijk zijn, kun je verder uitwerken.

**ACTIONABLE STUDY RECOMMENDATIONS**  
Omdat het verbinden van de stappen en samenhang tussen processen uitdagend bleek, raad ik je aan:

- **Maak een conceptmap (begrippennetwerk) van het vroege embryonale proces.** Teken bijvoorbeeld stap voor stap wat er gebeurt van bevruchting, via blastulatie, gastrulatie tot embryonale vouwing. Zet de belangrijkste begrippen, pijlen en gevolgen erbij. Op deze manier zie je visueel hoe alles samenhangt. Dit maakt het makkelijker om processen toe te lichten en details te onthouden.

Blijf zo doorzetten: vragen stellen, proberen, en vooral inzichtelijk maken wat je lastig vindt – daardoor leer je het meest!",2025-09-17T16:04:55.397+00:00
