role,content,created_at
user,ik ben klaar om te beginnen,2025-09-17T13:14:14.820033+00:00
assistant,"Laten we beginnen!

Hier is de casus om je te helpen het onderwerp te plaatsen:

**Casus:**  
Een gezonde 25-jarige vrouw kreeg routine prenatale zorg. Bij een echo op 24 weken werd een kleine opening (~5 mm) aan de rechterkant van de buik, dicht bij de navelstreng gezien. Genetische tests waren normaal. De opening werd groter (tot 34 mm) en delen van de darmen van de baby zweefden in het vruchtwater. De baby groeide minder goed dan verwacht. Na 37 weken werd een keizersnede uitgevoerd. De pasgeborene had delen van de dunne en dikke darm en de maag buiten de buik. De diagnose was gastroschisis: een defect in de buikwand.

Eerste vraag:  
Wat betekent “embryonale plooivorming” (embryonic folding) tijdens de vroege ontwikkeling?",2025-09-17T13:14:27.476528+00:00
user,vocht in de nek,2025-09-17T13:16:39.805258+00:00
assistant,"Je antwoord lijkt te verwijzen naar vochtophoping in de nekregio van een embryo of foetus, wat we bijvoorbeeld zien bij een nekplooi-onderzoek (nuchal translucency) om chromosomale afwijkingen op te sporen. Dat is echter niet waar de term ""embryonale plooivorming"" op slaat.

Heb je een idee waar in de ontwikkeling van het embryo plooivorming een rol speelt? Welke richting(en) vouwt het embryo zich en waarom is dit belangrijk?",2025-09-17T13:16:48.705909+00:00
user,het embryo vouwt zich in de richting van het transverzale vlak,2025-09-17T13:17:29.976646+00:00
assistant,"Goed, je noemt het transversale vlak (dwarsdoorsnede), oftewel de laterale plooivorming, wat inderdaad een deel is van het proces. Maar embryonale plooivorming bestaat uit meer dan alleen laterale (transversale) plooien.

Kun je benoemen welke twee richtingen of assen belangrijk zijn bij embryonale plooivorming? Wat gebeurt er met het embryo in iedere van deze richtingen?",2025-09-17T13:17:39.153296+00:00
user,transversaal vlak en frontaal vlak,2025-09-17T13:18:19.422791+00:00
assistant,"Je zit in de goede richting! Het transversale vlak geeft de zijwaartse (laterale) plooivorming weer. Het frontale vlak is echter meer gerelateerd aan voor-achterwaartse doorsnede, maar in termen van embryonale plooivorming wordt meestal gesproken over twee specifieke assen:

- De **transversale (laterale) as**: waar het embryo van zijkant naar zijkant vouwt.
- De **cranio-caudale as**: waar het embryo vouwt van hoofd (craniaal) naar staart (caudaal).

Kun je uitleggen wat het effect is van embryonale plooivorming langs deze twee assen op de positie van de dooierzak, de amnionholte en de lichaamswand van het embryo?",2025-09-17T13:18:58.315113+00:00
user,de dooierzak split in twee delen en de lichaamswand is dicht,2025-09-17T13:19:47.827287+00:00
assistant,"Dat klopt voor een belangrijk deel! Je beschrijft goed dat de dooierzak door de plooivorming gedeeltelijk wordt opgesloten in het embryo, en dat de lichaamswand wordt gesloten. Wil je proberen te concretiseren wat er precies gebeurt met de **dooierzak** en welk deel ervan nu in het embryo komt te liggen, en welk deel erbuiten blijft?

En wat gebeurt er met de **amnionholte** tijdens deze plooivorming?",2025-09-17T13:19:56.080334+00:00
user,het bovenste deel van de dooierzak wordt opgesloten. de amnionholte wordt gevorm,2025-09-17T13:21:11.743307+00:00
assistant,"Goed gedaan! Je zegt dat het bovenste deel van de dooierzak wordt opgesloten, wat klopt: een deel van de dooierzak wordt opgenomen in het embryo en vormt zo de primitieve darm. Het buitenste deel blijft als de extra-embryonale dooierzak aanwezig.

Wat betreft de amnionholte: die omsluit steeds meer het embryo naarmate de plooivorming vordert, totdat het embryo vrijwel volledig in het amnion ligt.

Nu een nieuwe vraag over basisbegrippen:  
Noem de **drie kiemlagen** (germ layers) die ontstaan tijdens de vroege embryonale ontwikkeling.",2025-09-17T13:21:25.449996+00:00
user,"huid, opperhuid,",2025-09-17T13:25:37.654103+00:00
assistant,"Dat zijn onderdelen die uit de kiemlagen voortkomen, maar niet de namen van de kiemlagen zelf.

Heb je misschien de termen geleerd zoals ze in het Latijn worden genoemd? Ze beginnen allemaal met ""-derm"", zoals **...derm, ...derm, ...derm**. Kun je ze opnoemen?",2025-09-17T13:25:44.923624+00:00
user,de huid en opperhuid,2025-09-17T13:25:57.376877+00:00
assistant,"Dat zijn inderdaad delen die uit één van de kiemlagen ontstaan, maar de kiemlagen zelf hebben specifieke namen. Ze worden vaak aangeduid met een voorvoegsel en eindigen op “-derm”.

Tip: Denk aan drie termen die beginnen met “ecto-”, “meso-” en “endo-”.  
Kun je deze drie kiemlagen nu benoemen?",2025-09-17T13:26:04.737535+00:00
user,"ectoderm, mesoderm en endoderm",2025-09-17T13:26:43.878439+00:00
assistant,"Helemaal goed! De drie kiemlagen zijn: **ectoderm, mesoderm en endoderm**.

De volgende vraag:  
Het mesoderm wordt nog verder onderverdeeld in verschillende gebieden. Kun je de vier hoofdonderdelen van het mesoderm noemen die ontstaan tijdens de ontwikkeling?",2025-09-17T13:26:50.962685+00:00
user,splanchichs deel,2025-09-17T13:27:20.912882+00:00
assistant,"Je noemt het splanchnische deel, wat inderdaad een belangrijk onderdeel is van het mesoderm, maar er zijn **vier hoofdonderdelen** in total die je moet herkennen.

Kun je nog andere delen bedenken? Ze worden vaak aangeduid als:  
- axiaal mesoderm  
- paraxiaal mesoderm  
- intermediair mesoderm  
- laterale plaat mesoderm

Kun je deze vier hoofdonderdelen in jouw eigen woorden benoemen of uitleggen?",2025-09-17T13:27:44.582946+00:00
user,intermediair zit ergens tussen denk ik. laterale plaat zit er boven,2025-09-17T13:28:29.959552+00:00
assistant,"Goed, je hebt gelijk dat **intermediair mesoderm** tussen andere mesodermale gebieden ligt, en **laterale plaat mesoderm** vormt de laterale (buitenste) laag. Je noemt daarmee al twee belangrijke onderdelen.

Kun je kort proberen te omschrijven waar het **axiale mesoderm** en het **paraxiale mesoderm** zich bevinden ten opzichte van de andere mesodermale gebieden? Wat weet je over hun ligging in het embryo?",2025-09-17T13:28:39.459017+00:00
user,die zitten aan binnenkant \,2025-09-17T13:29:40.275899+00:00
assistant,"Je zit in de goede richting! Laten we dit preciseren:

- **Axiaal mesoderm**: Dit bevindt zich precies in het midden, langs de centrale as van het embryo (bijvoorbeeld de chorda dorsalis/notochord).
- **Paraxiaal mesoderm**: Dit ligt direct naast het axiale mesoderm, dus net naast de centrale as aan beide zijden.

Dus: axiaal = midden, paraxiaal = direct ernaast, intermediair = meer naar buiten, laterale plaat = meest buiten.

Laatste vraag over begrippen:  
Kun je uitleggen wat met de termen **caudaal** en **craniaal** wordt bedoeld in de embryonale anatomie?",2025-09-17T13:29:54.112324+00:00
user,hoofd en staart,2025-09-17T13:30:21.680388+00:00
assistant,"Precies! **Craniaal** betekent richting het hoofd (kopzijde), en **caudaal** betekent richting de staart (staartzijde).

Nu dat je de kernbegrippen kent, gaan we verder naar de processen.  
Kun je uitleggen wat er gebeurt tijdens **gastrulatie** in de vroege embryonale ontwikkeling?",2025-09-17T13:30:29.80062+00:00
assistant,"**OVERALL SUMMARY**  
Je hebt met enthousiasme meegedaan aan het gesprek en laten zien dat je actief probeert mee te denken, ook als je het antwoord niet meteen weet. Dat is een goede instelling voor het leren van embryologie!

**WHAT YOU DID WELL**
- **Strong Grasp of:** Je herkende de drie kiemlagen (ectoderm, mesoderm en endoderm) na een kleine hint en kon goed de begrippen craniaal en caudaal uitleggen.
- **Good Application of:** Je begreep dat bij embryonale plooivorming een deel van de dooierzak wordt opgenomen en benoemde correct dat de lichaamswand wordt gesloten. Je komt steeds dichter bij het juiste antwoord door logisch na te denken.

**AREAS FOR GROWTH & FOCUS**
- **Reviewing Key Terms:** Je had moeite met het direct benoemen van de namen van de kiemlagen en de hoofdonderdelen van het mesoderm. Soms benoem je eerder de afgeleide structuren dan de basisschema’s zelf.
- **Connecting the Dots:** Het uitleggen van processen zoals de plooivorming en het onderverdelen van het mesoderm kan nog wat duidelijker. Probeer per stap aan te geven wát er gebeurt en waarom.
- **Applying Theory to Practice:** Je bent nog niet toegekomen aan het koppelen van deze kennis aan klinische casussen zoals gastroschisis, maar het opfrissen van de basis helpt daarbij in het volgende stadium.

**ACTIONABLE STUDY RECOMMENDATIONS**
Omdat het vooral een uitdaging was om de termen van kiemlagen en mesodermonderdelen snel paraat te hebben, kun je het beste **flashcards gebruiken** (bijvoorbeeld met Quizlet). Zet op de ene kant de Latijnse termen (ectoderm, mesoderm, endoderm, paraxiaal etc.) en op de andere kant een korte beschrijving of wat eruit ontstaat. Zo oefen je het herkennen én toepassen van de belangrijkste basisstructuren voor embryologie!",2025-09-17T13:32:04.387+00:00
