role,content,created_at
user,Ik snap het verschil niet tussen reciproke en robertsoniaanse translocatie,2025-09-17T15:51:19.253196+00:00
assistant,"Laten we het kort en stap voor stap aanpakken!  
Kun je me vertellen wat je weet van het woord ""translocatie"" in genetica? Wat gebeurt er eigenlijk bij een chromosoomtranslocatie?",2025-09-17T15:51:24.540357+00:00
user,Er wordt genetische informatie uitgewisseld tussen chromosomen,2025-09-17T15:51:41.489565+00:00
assistant,"Goed, dat klopt! Bij een translocatie wordt genetisch materiaal uitgewisseld of verplaatst tussen chromosomen.

Laten we verder gaan.  
**Een ""reciproke translocatie""**—wat denk je dat ""reciproke"" betekent? Wat gebeurt er precies met de stukken chromosomen bij deze vorm van translocatie?",2025-09-17T15:51:51.966226+00:00
user,Laten we beginnen,2025-09-17T15:52:29.545004+00:00
assistant,"Prima, laten we bij het begin beginnen!

Wanneer we het hebben over een **reciproke translocatie**:  
Twee verschillende chromosomen breken beide op een plek, en de stukken die zijn losgekomen wisselen van plaats. Dus ze ""ruilen"" stukjes DNA uit—reciprok betekent “wederzijds”.

Heb je dit goed begrepen, of wil je dit in je eigen woorden proberen samen te vatten?",2025-09-17T15:52:37.804549+00:00
user,Laten we beginnen,2025-09-17T15:52:45.833161+00:00
assistant,"Hier volgt opnieuw de casus om het onderwerp te kaderen:

Een gezonde 25-jarige vrouw kreeg routine prenatale zorg. Bij 24 weken zwangerschap werd via een echo een kleine opening (ongeveer 5 mm) aan de rechterkant van de buik van de baby, dicht bij de navelstreng, gezien. Genetisch onderzoek van het vruchtwater op 26 weken was normaal. De opening werd groter (tot 34 mm), en delen van de baby’s darmen kwamen buiten de buikholte in het vruchtwater te liggen. Bij de geboorte lag een deel van de maag, dunne en dikke darm buiten het lichaam. De diagnose was gastroschisis, een defect in de buikwand.

Om te beginnen:  
Wat wordt bedoeld met ""embryonale vouwing"" in de embryonale ontwikkeling?",2025-09-17T15:52:58.233637+00:00
user,De mesoderm ectoderm en endoderm vormen de neurale buis tijdens de vouwing,2025-09-17T15:53:39.409884+00:00
assistant,"Dat is al een goed begin! Je noemt de drie kiemlagen en de neurale buis. Maar laten we het nog wat preciezer bekijken:

- Wat bedoelen we precies met ""embryonale vouwing""? Denk niet alleen aan de neurale buis, maar aan de algemene bewegingen van het embryo als geheel tijdens deze periode.
- Kun je uitleggen wat er verandert aan de vorm van het embryo en waarom die vouwing belangrijk is?

Welke gedachten heb je hierover?",2025-09-17T15:54:21.133004+00:00
user,"Rond de neurale buis wordt ruimte gemaakt voor de organen en voor de huid. Het hart gaat door vouwing naar de juiste plaats. Eigenlijk is het echt het begin van de embryologie, omdat de vorm van de embryo wordt gevormd, wat eerst uit de platte kiembladen bestond",2025-09-17T15:55:12.942655+00:00
assistant,"Heel goed! Je beschrijft dat het embryo van een platte schijf door vouwing een driedimensionale structuur krijgt, en dat dit essentieel is voor het positioneren van organen én het vormen van een lichaamsvorm. 

Kun je benoemen welke twee hoofdtypes van vouwing plaatsvinden tijdens deze embryonale fase? En in welke richting(en) deze plaatsvindt?",2025-09-17T15:55:20.268968+00:00
user,"Caudaal en naar de staart, ik weet de naam niet meer",2025-09-17T15:55:40.133905+00:00
assistant,"Je zit al op het goede spoor! Eén van de richtingen heb je genoemd: caudaal betekent ""naar de staart"" (onderzijde). Maar er is nog een andere richtingsas waarop vouwing optreedt.

Weet je nog wat het tegenovergestelde is van caudaal? En kun je bedenken wat de andere hoofdas van vouwing is naast de lengte van het embryo?",2025-09-17T15:55:47.365876+00:00
user,Craniaal,2025-09-17T15:55:56.431636+00:00
assistant,"Precies, craniaal is het tegenovergestelde van caudaal en betreft de kopzijde van het embryo!

Naast de craniale en caudale vouwing gebeurt er nog een ander type vouwing—de tweede hoofdrichting. 
Weet je welke dat is? Denk aan de breedte van het embryo. Hoe heet deze as of deze vouwing?",2025-09-17T15:56:04.563712+00:00
user,Lateraal,2025-09-17T15:56:11.231633+00:00
assistant,"Juist! Laterale vouwing betreft de zijkanten van het embryo die naar elkaar toe bewegen.

Even samenvatten: tijdens de embryonale ontwikkeling vindt zowel craniaal/caudale vouwing (kop-staart, in de lengterichting) als laterale vouwing (van de zijkanten naar het midden) plaats. Dit leidt ertoe dat het embryo van een platte schijf een buisstructuur wordt.

Laten we nu een andere basisdefinitie uit dit onderwerp pakken:
Wat zijn de drie kiemlagen waaruit het embryo bestaat, en welke basisstructuren worden daaruit gevormd? Noem ze en één voorbeeld voor elk.",2025-09-17T15:56:22.735026+00:00
user,Endoderm,2025-09-17T15:56:31.978502+00:00
assistant,Goed! De endoderm is één van de drie kiemlagen. Kun je ook de andere twee kiemlagen noemen? En zou je van elke kiemlaag één voorbeeld kunnen geven van een structuur die eruit ontstaat?,2025-09-17T15:56:38.136162+00:00
user,"Endoderm zorgt voor de binnenbekleding van organen, ectoderm voor de huid en  ruggenmerg, mesoderm de rest",2025-09-17T15:57:13.239431+00:00
assistant,"Dat is heel goed! Je koppelt de kiemlagen aan hun belangrijkste afgeleiden. Je zou het eventueel nog iets specifieker kunnen maken:

- **Endoderm:** binnenbekleding van het maag-darmkanaal en organen als lever en longen.
- **Ectoderm:** huid (epidermis), zenuwstelsel (waaronder ruggenmerg en hersenen).
- **Mesoderm:** spieren, botten, bloedvaten, nieren, hart, en bindweefsel (“de rest” zoals je al goed zei).

Goed, je hebt de basiskiemlagen nu helder.  
Welke vier hoofdonderdelen kent het mesoderm, en kun je kort benoemen waar elk onderdeel bijdraagt in de lichaamsontwikkeling?",2025-09-17T15:57:24.404758+00:00
user,"Paraxiaal mesoderm, intermediair mesoderm en lateraal plaat mesoderm",2025-09-17T15:58:51.935949+00:00
assistant,"Heel goed, je noemt er al drie: paraxiaal mesoderm, intermediair mesoderm en lateraal plaat mesoderm. Er is echter nóg een belangrijk onderdeel van het mesoderm. Weet je welke dat is? (Hint: het ligt in het midden, dicht bij de as van het embryo.)

En zou je daarnaast kunnen aangeven waar één van de mesoderm-subtypes vooral aan bijdraagt qua ontwikkeling (bijvoorbeeld spieren, nieren, of lichaamswand)?",2025-09-17T15:59:00.684046+00:00
user,Notochord?,2025-09-17T15:59:05.731941+00:00
assistant,"Juist! De notochord (chorda dorsalis) is inderdaad het middelste (axiale) deel van het mesoderm en is een belangrijk structuur tijdens de vroege ontwikkeling.

Kun je nog benoemen waar de notochord (axiale mesoderm) een rol in speelt tijdens de ontwikkeling van het embryo? Wat is de belangrijkste functie van de notochord?",2025-09-17T15:59:13.935967+00:00
user,Notochord zorgt voor de innervatie denk ik,2025-09-17T15:59:54.045327+00:00
assistant,"Interessante gedachte! Je brengt de notochord in verband met innervatie (zenuwvoorziening), maar de rol van de notochord is iets anders.

Hint: de notochord fungeert als een soort “aanwijzer” of signaalgever in het embryo. Zij is heel belangrijk voor de ontwikkeling van een andere grote structuur.  
Weet je welke structuur vooral door signalen van de notochord wordt gevormd, en waar deze zich in het lichaam bevindt? (Denk aan het zenuwweefsel.)",2025-09-17T16:00:02.800068+00:00
user,Ruggenmerg?,2025-09-17T16:00:11.461072+00:00
assistant,"Precies! De notochord geeft signalen af die de vorming van het zenuwstelsel sturen, en dan vooral het ruggenmerg (en de gehele neurale buis). 

Samengevat:  
- De **notochord** (axiale mesoderm) speelt een sleutelrol bij de inductie en ontwikkeling van de neurale buis, waaruit het ruggenmerg en de hersenen ontstaan.

Goed!  

Zou je nu kunnen benoemen waar het **paraxiale mesoderm** in het bijzonder aan bijdraagt wat betreft lichaamsstructuren?",2025-09-17T16:00:25.081192+00:00
user,Hoofd en huid?,2025-09-17T16:01:11.925667+00:00
assistant,"Je zit in de buurt! Het paraxiale mesoderm levert inderdaad onderdelen in het hoofd, maar zijn hoofdbijdrage is iets anders.

Even een hint: Het paraxiale mesoderm vormt somieten langs beide kanten van de neuraalbuis. Deze somieten ontwikkelen zich tot spierweefsel, botten van de wervelkolom én een deel van de dermis van de huid, vooral in de romp.

Kun je deze invulling afmaken? Wat vormen somieten en waar vind je die structuren vooral terug?",2025-09-17T16:01:24.22122+00:00
user,"Somieten vormen sclerotoom, myotoom en dermatoom",2025-09-17T16:02:04.635582+00:00
assistant,"Juist! Dat is helemaal correct. De somieten splitsen zich op in:

- **Sclerotoom**: vormt het axiale skelet (zoals de wervels)
- **Myotoom**: vormt skeletspieren
- **Dermatoom**: vormt het onderhuidse bindweefsel (dermis) van de huid

Goed gedaan!

Laten we doorpakken met een laatste basisvraag:  
Wat betekenen de termen *ventraal* en *dorsaal* in de context van embryonale ontwikkeling?",2025-09-17T16:02:13.744294+00:00
user,Ventraal betekent naar de buik en dorsaal naar de rug,2025-09-17T16:02:35.743458+00:00
assistant,"Helemaal juist! Ventraal betekent inderdaad “naar de buikzijde” (de voorkant), en dorsaal betekent “naar de rugzijde” (de achterkant) van het embryo of lichaam.

Heel goed, je beheerst nu de belangrijkste termen voor deze leerdoelstelling.

Gaan we nu een stapje verder: kun je uitleggen waarom gastrulatie zo’n centrale stap is in de vroege embryonale ontwikkeling? Wat gebeurt er tijdens gastrulatie, en waarom is dit belangrijk voor alles wat daarna volgt?",2025-09-17T16:02:47.113462+00:00
user,"Tijdens gastrulatie wordt de neurale buis gevormd, alle andere structuren vormen zich hier omheen",2025-09-17T16:03:21.384962+00:00
assistant,"Je legt de nadruk op de neurale buis, wat inderdaad een belangrijk gevolg is van vroege embryonale ontwikkeling, maar gastrulatie draait eigenlijk om iets breder.

Hint: Gastrulatie is een proces waarbij het embryo van een eenvoudige laag naar meerdere lagen verandert, en dit vormt de basis voor ál het verdere weefsel- en orgaansysteem.

Kun je beschrijven wat er precies gebeurt met de cellen tijdens gastrulatie, en welke drie hoofdstructuren daaruit ontstaan?",2025-09-17T16:03:30.519319+00:00
