role,content,created_at
user,ik ben klaar om te beginnen,2025-09-17T14:11:06.22075+00:00
assistant,"Hier volgt de klinische casus als context voor jouw leerproces:

Een gezonde 25-jarige vrouw kwam voor routine prenatale controles. Tijdens een echo op 24 weken zwangerschap werd een kleine opening (~5 mm) aan de rechterzijde van de buik van de baby, vlak bij de navelstreng, gevonden. Genetisch onderzoek was normaal. De opening werd in de loop van de zwangerschap groter (tot 34 mm), en delen van de darmen kwamen in het vruchtwater terecht. Bij de geboorte werden delen van de dunne en dikke darm én de maag buiten de buikholte gevonden. De diagnose was gastroschisis, een buikwanddefect.

Laten we bij de basis beginnen:
Wat is gastrulatie?",2025-09-17T14:11:18.078354+00:00
user,gas buiten het verteringsstelsel?,2025-09-17T14:13:49.849447+00:00
assistant,"Je verwart mogelijk het woord ""gastrulatie"" met iets uit het verteringsstelsel. ""Gastrulatie"" is een proces dat gebeurt tijdens de vroege embryonale ontwikkeling.

Laten we het iets anders proberen:  
Gastrulatie is een belangrijk ontwikkelingsproces in het embryo, waarbij drie kiemlagen ontstaan. Kun je de namen van die drie kiemlagen opsommen?",2025-09-17T14:13:57.03172+00:00
user,endoderm ectoderm en mesoderm,2025-09-17T14:14:20.419141+00:00
assistant,"Dat klopt! De drie kiemlagen die tijdens gastrulatie ontstaan zijn: endoderm, ectoderm en mesoderm.

Gaan we door naar de volgende basisvraag:
Kun je uitleggen wat embryonale vouwing (embryonic folding) is?",2025-09-17T14:14:28.577362+00:00
user,tijdens deze vouwing veranderd het embryo van een platte schijf in een meer 3d vorming figuur,2025-09-17T14:15:33.872613+00:00
assistant,"Precies, goede uitleg! Embryonale vouwing zorgt ervoor dat het embryo van een platte schijf verandert in een driedimensionaal structuur. Deze vouwing is cruciaal voor het vormen van het lichaam van de baby.

Volgende vraag om je kennis te verbreden:
Wat is het verschil tussen ventraal en dorsaal?",2025-09-17T14:15:40.270145+00:00
user,ventraal is de buik kant en dorsaal is de rug kant,2025-09-17T14:16:48.350275+00:00
assistant,"Helemaal juist! Ventrale zijde is de buikzijde (voorzijde) en dorsale zijde is de rugzijde (achterzijde) van het embryo.

Ga zo door! De volgende vraag:
Noem de vier belangrijkste subdelen (subdivisies) van het mesoderm tijdens de vroege embryonale ontwikkeling.",2025-09-17T14:16:55.492221+00:00
user,die 4 subdelen weet ik niet,2025-09-17T14:18:44.958548+00:00
assistant,"Geen probleem, je hoeft het nog niet te weten! Denk aan de plek waar het mesoderm zich bevindt ten opzichte van de middenlijn van het embryo.

- Helemaal in het midden, dichtbij de as van het embryo, daar ligt een specifiek deel.
- Aan weerszijden daarvan is er nog een deel, en verder naar buiten zijn er twee andere belangrijke delen.
- Ze worden vaak genoemd: **axiaal**, **paraxiaal**, **intermediate** en **laterale plaat** mesoderm.

Kun je met deze hints proberen de vier te benoemen?",2025-09-17T14:18:54.589878+00:00
user,axiaal mesoderm paraxiaal mesoderm intermediate mesoderm lateraal mesoderm,2025-09-17T14:19:46.662131+00:00
assistant,"Dat is helemaal goed! De vier belangrijkste subdelen van het mesoderm zijn:

- Axiaal mesoderm
- Paraxiaal mesoderm
- Intermediate mesoderm
- Laterale plaat mesoderm

Goed gedaan!  
Volgende vraag:  
Wat betekent de term ""caudaal"" in embryonale anatomie?",2025-09-17T14:19:54.456175+00:00
user,naar het hoofd?,2025-09-17T14:20:10.35143+00:00
assistant,"Bijna goed, maar het is precies de andere richting. In de embryonale anatomie betekent “caudaal” het tegenovergestelde van “craniaal”. 

Kun je nu toelichten wat “caudaal” betekent, en wat “craniaal” betekent?",2025-09-17T14:20:17.685996+00:00
user,oke dan is craniaal naar het hoofd en causaal naar de anus,2025-09-17T14:20:47.889363+00:00
assistant,"Helemaal juist!  
- **Craniaal** betekent naar het hoofd toe (de “kop”-kant).
- **Caudaal** betekent naar de staart-/anus-kant.

Je hebt nu mooie basiskennis laten zien over deze termen!  
Kun je uitleggen wat morphogenese is?",2025-09-17T14:20:55.710359+00:00
user,ik heb werkelijk geen idee vast iets met het embryo,2025-09-17T14:21:29.80224+00:00
assistant,"Dat is een logische gedachte, want morphogenese hoort inderdaad bij de ontwikkeling van het embryo!  
Laten we het samen opbouwen:

- Het woord “morpho” betekent “vorm”.
- “Genese” betekent “vorming” of “creatie”.

Als je dat weet: waar zou morphogenese dan betrekking op kunnen hebben bij de embryonale ontwikkeling? Wat gebeurt er in deze fase met het embryo, denk je?",2025-09-17T14:21:38.020423+00:00
user,misschien iets met de vorming van het embryo dus de verschillende vouwingen die het embryo doormaakt,2025-09-17T14:22:28.849577+00:00
assistant,"Precies! Morphogenese gaat inderdaad over de vorming van het embryo, dus hoe het embryo zijn uiteindelijke vorm en structuur krijgt. Dit omvat processen zoals vouwing, buigen, en het ontstaan van verschillende lichaamsdelen.

Heel goed, je beheerst nu de kernbegrippen!  
Laten we een niveau dieper gaan:

Kun je uitleggen wat er gebeurt tijdens gastrulatie en waarom dit proces belangrijk is?",2025-09-17T14:23:01.252509+00:00
user,ik denk dat tijdens de gastrulatie het embryo zich in 2 lichaamsrichtingen vouwt en dat daardoor het eerste vorm van een mens ontstaat,2025-09-17T14:24:37.675925+00:00
assistant,"Dat is een interessante gedachte — het vouwen van het embryo gebeurt inderdaad, maar dat is juist typisch voor *embryonale vouwing* (folding). Gastrulatie is een stap daarvoor.

Denk aan gastrulatie als het proces waarbij uit één laag (de epiblast) meerdere verschillende lagen ontstaan. Dit gebeurt zelfs vóórdat het embryo begint te vouwen.

Kun je op basis hiervan vertellen wat het gevolg is van gastrulatie voor de opbouw van het embryo? Wat ontstaat er na gastrulatie?",2025-09-17T14:24:47.610484+00:00
user,is gastrulate dan het vormen van het mesoderm,2025-09-17T14:25:24.177033+00:00
assistant,"Dat klopt gedeeltelijk! Gastrulatie is het proces waarbij uit de oorspronkelijke cellen van het embryo drie kiemlagen ontstaan, waaronder het mesoderm.

Weet je nog welke andere twee kiemlagen ook ontstaan tijdens gastrulatie, naast het mesoderm? Wat is het totale resultaat van dit proces?",2025-09-17T14:25:31.630222+00:00
assistant,"**OVERALL SUMMARY**  
Goed gedaan! Je laat duidelijk zien dat je gemotiveerd bent om de basis van de embryonale ontwikkeling te leren. Je hebt actief meegedacht, raadt wat je niet zeker weet, en pakt hints goed op om tot het juiste antwoord te komen. Super dat je zo gemotiveerd en open in het leerproces staat!

**WHAT YOU DID WELL**
- **Strong Grasp of:**  
  Je kent de drie kiemlagen (endoderm, ectoderm, mesoderm) uitstekend, en je weet het verschil tussen ventraal/dorsaal en craniaal/caudaal goed te omschrijven. Ook vulde je de vier subdelen van het mesoderm keurig in met hints!
- **Good Application of:**  
  Je wist bij nieuwe begrippen zoals ""morphogenese"" en gastrulatie logisch te redeneren en de verbanden te leggen met de eerdere uitleg. Je gebruikt daarbij hints effectief om je kennis uit te breiden.

**AREAS FOR GROWTH & FOCUS**
- **Reviewing Key Terms:**  
  Sommige termen zoals ""morphogenese"" en de vier mesoderm-subdivisies waren lastig zonder hints. Het automatisch herkennen van deze begrippen kan je helpen om sneller complexere concepten te begrijpen.
- **Connecting the Dots:**  
  Je haalt embryonale vouwing en gastrulatie soms door elkaar. Het kan helpen nog eens te oefenen met de precieze volgorde en het belang van deze processen voor de opbouw van het embryo.

**ACTIONABLE STUDY RECOMMENDATIONS**  
Maak een schema of tekening waarin je de volgorde van de vroege embryonale processen (zoals gastrulatie, vorming van de kiemlagen, embryonale vouwing) en de bijbehorende termen overzichtelijk naast elkaar zet. Zo zie je in één oogopslag wat wanneer gebeurt en welke termen daarbij horen. Dit helpt je om orde in de begrippen te brengen en sneller verbanden te leggen!",2025-09-17T14:25:46.747+00:00
