role,content,created_at
user,ik ben klaar om te beginnen,2025-09-17T13:15:53.114734+00:00
assistant,"Laten we beginnen! Hier is de klinische casus om ons onderwerp te kaderen:

**Vignette:**  
Een gezonde vrouw van 25 jaar had routine prenatale controles. Bij een echo op 24 weken zwangerschap werd een kleine opening (~5 mm) aan de rechterkant van de baby’s buik, vlak bij de navel, gezien. Genetisch onderzoek op 26 weken was normaal. De opening werd groter, en delen van de darmen lagen in het vruchtwater. De baby was ook kleiner dan verwacht. Bij de geboorte lagen delen van de darmen en maag buiten het lichaam. De diagnose was gastroschisis, een defect van de buikwand.

Om goed te begrijpen wat hier gebeurt, beginnen we bij de basis:

**Vraag:**  
Wat wordt bedoeld met “embryonale vouwing” (embryonic folding) tijdens de eerste weken van de embryonale ontwikkeling?",2025-09-17T13:16:05.580081+00:00
user,het vormen van de embryo en de neurale buis,2025-09-17T13:17:04.222558+00:00
assistant,"Dat is al een goed begin! Je noemt het vormen van de embryo en de neurale buis.  

Heb je nagedacht over hoe de “vouwing” precies gebeurt?  
- Vindt de vouwing in één richting plaats, of in meerdere richtingen?
- En wat is het doel van deze vouwprocessen bij het embryo?

Kun je je antwoord verder aanvullen met deze punten?",2025-09-17T13:17:11.891688+00:00
user,"eerst worden de kiemlagen gevormd en daaruit wordt de neurale buis gevouwen, hoe het zich daarna verder vouwt weet ik niet",2025-09-17T13:17:55.711294+00:00
assistant,"Dat klopt: eerst worden de drie kiemlagen (ectoderm, mesoderm, endoderm) gevormd tijdens gastrulatie, en daarna ontstaat uit het ectoderm de neurale buis. Maar embryonale vouwing gaat nog verder!

Denk even terug aan de vorm van het embryo vóór de vouwing: het is dan nog plat als een schijf. Tijdens de embryonale vouwing verandert deze schijf.

Kun je, op basis van wat je weet of denkt, aangeven in welke richtingen het embryo zich vouwt om een buisvormig lichaam te maken? Misschien kun je noemen welke “randen” van het embryo naar elkaar toe bewegen bij deze processen?",2025-09-17T13:18:06.979475+00:00
user,de randen van het ectoderm bewegen naar elkaar toe waardoor zich een amnion vormt,2025-09-17T13:18:35.301602+00:00
assistant,"Goed, je denkt aan het bewegen van de randen naar elkaar toe—dat is inderdaad een onderdeel van het proces. De vorming van het amnion gebeurt eerder al, maar wat je beschrijft past wél bij het idee van vouwing.

Laten we het nog iets concreter maken:  
- Het embryo vouwt zowel in de lengte (craniaal/caudaal) als in de breedte (lateraal).
- Door deze vouwbewegingen ontstaat een buisvormig lichaam uit de platte kiemschijf.

Kun je dit aanvullen?  
Welke primaire lichaamsstructuur ontstaat als het embryo in beide richtingen opvouwt, en waarom is dit belangrijk voor het buikoppervlak en de inwendige organen?",2025-09-17T13:18:48.581039+00:00
user,er ontstaat ruimte in de mesoderme laag om organen te vorme,2025-09-17T13:21:13.164086+00:00
assistant,"Dat is een mooi inzicht! Er ontstaat inderdaad ruimte binnen het mesoderm, wat heel belangrijk is voor de vorming van lichaams- en orgaanholtes.

Wil je nog proberen het als volgt samen te vatten?  
Wat gebeurt er met de positie van de dooierzak en de organen als gevolg van laterale en craniaal/caudale vouwing—en waarom is dat belangrijk voor het sluiten van de voorste buikwand?",2025-09-17T13:21:21.112858+00:00
user,"het embryo vormt zich vanuit een plaat naar een buis, hierdoor is de hele buitenste laag ectoderm en binnen veel mesoderm",2025-09-17T13:22:20.526747+00:00
assistant,"Heel goed! Door deze vouwing verandert het embryo van een platte plaat in een buisje, waardoor de buitenkant voornamelijk ectoderm wordt en het mesoderm (en endoderm) aan de binnenzijde liggen. 

Dit zorgt ervoor dat de orgaanvorming en het sluiten van de buikwand mogelijk wordt.

Dankjewel voor je antwoorden! Laten we nu verdergaan met een volgende basisvraag:

Kun je de drie kiemlagen die tijdens de embryonale ontwikkeling ontstaan benoemen? Wat zijn hun namen?",2025-09-17T13:22:29.52085+00:00
user,"ectoderm, mesoderm en endoderm",2025-09-17T13:23:17.650588+00:00
assistant,"Precies goed! De drie kiemlagen zijn: ectoderm, mesoderm en endoderm.

Nu nog een stapje verder:  
Het mesoderm wordt verder onderverdeeld in verschillende delen. Kun je de namen noemen van de vier “subdivisies” van het mesoderm?",2025-09-17T13:23:29.058887+00:00
user,"paraxiaal, mediteraal en lateraal, de vierde weet ik niet",2025-09-17T13:23:52.520302+00:00
assistant,"Goed geprobeerd! Je hebt paraxiaal en lateraal genoemd—dat zijn er twee van de vier. “Mediteraal” is niet helemaal goed, maar je zit wel in de buurt qua klank.

Denk aan de ligging ten opzichte van de middenlijn van het embryo.  
- Naast paraxiaal en lateraal, is er een soort “tussenliggende” groep mesoderm.
- En eentje die precies de middenlijn van het embryo vormt.

Kun je de ontbrekende twee benoemen? Misschien heb je eerder over “axiaal” of “intermediair” mesoderm gehoord?",2025-09-17T13:24:02.860539+00:00
user,intermediar en axiaal?,2025-09-17T13:24:57.811788+00:00
assistant,"Dat klopt helemaal! De vier subdivisies van het mesoderm zijn:  
- Axiaal mesoderm  
- Paraxiaal mesoderm  
- Intermediair mesoderm  
- Laterale plaat mesoderm

Goed gedaan!

Laten we de basiskennis afronden met een laatste vraag voordat we naar grotere processen gaan kijken:  
Wat wordt bedoeld met de termen “craniaal”, “caudaal”, “ventraal” en “dorsaal” in de anatomie van het embryo?",2025-09-17T13:25:06.872478+00:00
user,"craniaal is richting het hoofd, caudaal richting de staart, ventraal richting de buik en dorsaal richting de rug",2025-09-18T14:06:15.454986+00:00
assistant,"Helemaal juist!  
- Craniaal = richting het hoofd  
- Caudaal = richting de staart (of stuit)  
- Ventraal = richting de buikzijde  
- Dorsaal = richting de rugzijde  

Je hebt de basistermen en indelingen goed onder de knie!

Nu gaan we verder naar de processen:  
Kun je uitleggen wat er tijdens gastrulatie gebeurt in de vroege embryonale ontwikkeling? Wat verandert er dan aan het embryo?",2025-09-18T14:06:26.485573+00:00
user,bij gatsrulatie worden uit de epiblast en hypoblast laag drie kiemlagen gevormd,2025-09-18T14:08:21.815528+00:00
assistant,"Heel goed! Tijdens gastrulatie ontstaan inderdaad uit de epiblast drie kiemlagen: ectoderm, mesoderm en endoderm. Je noemde ook de hypoblast—denk eraan dat vooral de epiblast de oorsprong is van deze drie lagen.

Een vervolgvraag om het proces verder uit te diepen:  
Welke belangrijke structuur (of groeve) ontstaat er tijdens gastrulatie om deze celdifferentiaties en -migratie mogelijk te maken? Weet je hoe deze heet?",2025-09-18T14:08:34.937659+00:00
user,nee dat weet ik niet kan je het uitleggen?,2025-09-18T14:09:06.059422+00:00
assistant,"Prima dat je het nog niet weet! Dit is een belangrijk detail bij gastrulatie.

Denk aan het begin van gastrulatie:  
Er vormt zich een lijn in het midden van de epiblast waar cellen naar beneden gaan migreren om zo de drie kiemlagen te creëren.

Kun je je misschien herinneren hoe deze lijn genoemd wordt? Het begint met “primi…”  
Als je wilt kun je het opzoeken (bijvoorbeeld in je embryologieboek of via een betrouwbare medische bron) en het hier proberen te benoemen! Wat denk je?",2025-09-18T14:09:16.507998+00:00
user,de primitieve strook?,2025-09-18T14:11:22.05373+00:00
assistant,"Precies, de primitieve strook! Goed opgezocht en ingevuld.

De primitieve strook (of primitieve streep) vormt zich in de epiblast en is essentieel omdat via deze structuur de cellen naar binnen migreren om het ectoderm, mesoderm en endoderm te vormen.

Laten we nu verdergaan met de volgende procesvraag:

Kun je uitleggen *waarom* embryonale vouwing nodig is na de gastrulatie, en wat het doel is van deze vouwprocessen voor het ontstaan van het menselijk lichaam?",2025-09-18T14:11:31.743996+00:00
user,of groeve?,2025-09-18T14:11:33.70277+00:00
assistant,"Goede vraag! Je zit er dicht bij: de ""primitieve strook"" (primitive streak) is de hele lijn waarlangs cellen migreren. Aan het craniale uiteinde van deze strook vormt zich een ""primitieve groeve"" (primitive groove), en daarbinnen een ""primitief knoop"" (primitive node).

Dus je hebt gelijk dat naast de strook ook de primitieve groeve betrokken is bij het proces. De groeiende strook met daarin de groeve en knoop zijn allemaal onderdeel van het gastrulatieproces!

Wil je nu proberen uit te leggen waarom het zo belangrijk is dat na gastrulatie het embryo zich gaat vouwen? Wat is het functionele gevolg van deze vouwing voor de verdere ontwikkeling van het lichaam?",2025-09-18T14:11:45.352035+00:00
user,nee ik weet het niet kan je het uitleggen?,2025-09-18T14:13:09.714312+00:00
assistant,"Natuurlijk! Denk eerst terug aan hoe het embryo eruitziet direct na gastrulatie: het is dan nog een platte “schijf” met drie kiemlagen.

De embryonale vouwing is nodig om:
- De platte schijf te veranderen in een driedimensionale buis (die uiteindelijk de basis vormt voor de romp van het lichaam).
- De organen van het embryo op de juiste plek te brengen, bijvoorbeeld door de darm te vormen uit een buis van endoderm.
- De buikwand dicht te maken, zodat de organen ingesloten raken in de lichaamsholte in plaats van daarbuiten te ‘hangen’.

Wil je dit oppakken en in je eigen woorden samenvatten waarom vouwing functioneel zo belangrijk is om het lichaam te laten ontstaan? Probeer te benoemen wat er mis zou gaan als deze vouwing niet of niet volledig plaatsvindt.",2025-09-18T14:13:22.578744+00:00
user,om van een platte schijf naar een driedementionaal lichaam waarin de organen alvast op de goede plek worden gezet vppr de verdere embryonale ontwikkeling. en im het lichaam te sluiten,2025-09-18T14:19:35.585621+00:00
assistant,"Heel goed samengevat!  
Embryonale vouwing zorgt ervoor dat uit een platte schijf een driedimensionaal lichaam ontstaat, waarbij organen op hun juiste plek komen en de buikwand (en andere lichaamswanden) sluiten zich om de organen heen. Dit is cruciaal om een functioneel menselijk lichaam te vormen.

Laten we doorgaan naar de relatie tussen kiemlagen en orgaanontwikkeling:

Kun je uitleggen hoe de drie kiemlagen zich ontwikkelen tot verschillende orgaansystemen in het embryo? Bijvoorbeeld: welke kiemlaag vormt het zenuwstelsel, welke laag het darmkanaal, en welke de spieren?",2025-09-18T14:19:46.313844+00:00
user,"mesoderm ontwikkelt zich tot de spieren, ectoderm tot het zenuwstelsel en endoderm tot darmkanaal",2025-09-18T14:30:40.514794+00:00
assistant,"Precies goed!  
- Mesoderm vormt de spieren (en ook onder andere botten en bloedvaten)
- Ectoderm vormt het zenuwstelsel (en ook huid)
- Endoderm vormt het darmkanaal (en bijvoorbeeld ook lever en longen)

Nu een volgende kernvraag:  
Hoe ontstaan de lichaamsholtes (zoals de buikholte) uit het mesoderm tijdens de embryonale ontwikkeling? Wat gebeurt er zodat deze ruimten ontstaan?",2025-09-18T14:30:48.798256+00:00
user,dat weet ik niet kan je het uitleggen?,2025-09-18T14:31:46.021384+00:00
assistant,"Natuurlijk! Denk aan het laterale plaat mesoderm, één van de delen waar we het eerder over hadden.

In het laterale plaat mesoderm:
- Splijt het mesoderm in twee lagen: een binnenste (visceraal/splanchnisch) en een buitenste (pariëtaal/somatisch) blad.
- Tussen deze lagen ontstaat een ruimte: dit is de intra-embryonale coeloom, de basis voor de toekomstige lichaamsholten zoals de buikholte, borstholte en hartzakje.

Wil je proberen samen te vatten wat er gebeurt met het laterale plaat mesoderm? Wat splitsen die twee bladen af, en waar leidt dat toe qua ruimte? Probeer het in je eigen woorden!",2025-09-18T14:32:04.597307+00:00
