role,content,created_at
user,hoi,2025-09-17T13:41:16.589764+00:00
assistant,"Hoi! Laten we samen het leerdoel verkennen over de embryonale ontwikkeling, gericht op de eerste acht weken, met speciale aandacht voor week 4 en 5.

Hier is een klinische casus om alles te koppelen aan de praktijk:

**Vignette:**  
Een gezonde 25-jarige vrouw heeft tijdens de zwangerschap bij de 24-wekenecho een kleine opening aan de rechterkant van de buik van haar baby, vlak bij de navel. Later werd dit groter, met delen van de darmen vrij in het vruchtwater. De baby wordt kleiner geschat dan verwacht. Na een keizersnede bij 37 weken blijkt een deel van de maag en darmen buiten de buik te liggen. Het kind werd gediagnosticeerd met gastroschisis (een buikwanddefect).

Mijn eerste vraag:  
Wat is ""gastrulatie"" in de context van de embryonale ontwikkeling?",2025-09-17T13:41:33.847968+00:00
user,ontwikkeling  van twee kiemlagen naar driekiemlagen,2025-09-17T13:42:44.221026+00:00
assistant,"Goed! Gastrulatie is inderdaad het proces waarbij het embryo overgaat van twee naar drie kiemlagen.

Even een vervolgvraag:  
We hebben de termen “kiemlagen” genoemd. Kun je de drie kiemlagen benoemen die door gastrulatie ontstaan?",2025-09-17T13:43:08.639749+00:00
user,"endoderm, ectoderm en mesoderm",2025-09-17T13:43:40.523573+00:00
assistant,"Dat klopt helemaal! De drie kiemlagen zijn het endoderm, ectoderm en mesoderm.

Nu een volgende vraag over termen die vaak terugkomen in dit onderwerp:  
Wat betekenen de termen ""craniaal"" en ""caudaal"" bij het beschrijven van het embryo?",2025-09-17T13:43:46.529013+00:00
user,richting de staart caudaal en richting het hoofd is craniaal,2025-09-17T13:44:48.005348+00:00
assistant,"Precies! Craniaal betekent richting het hoofd, en caudaal betekent richting de staart van het embryo.

Laten we nog een belangrijke term behandelen:  
Kun je uitleggen wat met ""embryonale plooing"" (embryonic folding) wordt bedoeld?",2025-09-17T13:44:54.553417+00:00
user,de kiemlagen vouwen om elkaar heen dus ze gaan van een plaat naar een cilinder vorm,2025-09-17T13:45:48.662853+00:00
assistant,"Heel goed! Tijdens de embryonale plooing vouwen de kiemlagen inderdaad van een platte structuur naar een soort buis- of cilindervorm, wat essentieel is voor het ontstaan van het lichaamsplan van het embryo.

Een andere belangrijke term is ""morphogenese"".  
Weet je wat met morphogenese wordt bedoeld in de embryonale context?",2025-09-17T13:45:59.647862+00:00
user,geen idee,2025-09-17T13:46:30.423758+00:00
assistant,"Dat is begrijpelijk! Laten we het samen verkennen.

Morphogenese draait om het proces waarbij de vorm en de structuur van het embryo ontstaat. Het is eigenlijk de organisatie van cellen en weefsels tot herkenbare organen en lichaamsstructuren.

Denk je dat morphogenese alleen plaatsvindt tijdens de eerste weken, of gaat het proces ook daarna nog door in het embryo? Waarom denk je dat?",2025-09-17T13:46:39.150748+00:00
user,"alleen in de eerste 8 weken, omdat daarna alleen nog groeiontwikkeling plaats moet vinden",2025-09-17T13:48:15.613663+00:00
assistant,"Interessante redenering! Veel van de grote, vormgevende processen zoals aanleg van organen en structuren vinden inderdaad plaats in de eerste 8 weken—dat noemen we de embryonale fase. Maar…

Denk eens na, ontwikkelen en veranderen organen en lichaamsdelen niet ook daarna nog, bijvoorbeeld door verder te groeien, te differentiëren of functioneel te worden? Wat weet je daarvan?",2025-09-17T13:48:24.738629+00:00
user,"jawel blijven daarna ook nog verder ontwikkelen, is de hele zwangerschap dan morphogenese?",2025-09-17T13:50:56.656928+00:00
assistant,"Goede gedachte! Morphogenese speelt een grote rol in de vroege ontwikkeling (de embryonale periode), maar naarmate het embryo verder groeit tot foetus (vanaf ongeveer week 9), verschuift de nadruk meer naar groei en functionele rijping van structuren.

Dus:  
Morphogenese is het sterkst in de eerste 8 weken, wanneer de organen en structuren hun basisvorm krijgen. Daarna ontwikkelen organen zich verder, groeien ze en rijpen ze functioneel, maar de grootste “vormveranderingen” zijn dan meestal al afgerond.

Als laatste term voor nu:  
Kun je kort uitleggen wat wordt bedoeld met de “paraxiale,” “axiale,” “intermediaire,” en “laterale plaat mesoderm”? Wat weet je van deze mesodermale delen?",2025-09-17T13:51:08.920092+00:00
user,"paraxiale worden de somieten gevormd, axiale plaat mesoderm wordt de chorda dorsalis  uitgevorm, laterale plaat mesoderm ontstaan de ledematen uit en intermediare plaat mesoderm ontstaan de ....... uit.",2025-09-17T13:58:21.168786+00:00
assistant,"Goed gedaan! Je hebt de meeste belangrijke punten over deze mesodermale delen genoemd. Er lijkt nog wat twijfel over de intermediaire plaat mesoderm.

Tip: De intermediaire plaat mesoderm vormt structuren die te maken hebben met een bepaald systeem dat zorgt voor afvalafvoer en voortplanting in het lichaam.

Kun je nu bedenken welke organen uit het intermediaire mesoderm ontstaan?",2025-09-17T13:58:28.980776+00:00
user,"nieren, darmen",2025-09-17T14:00:24.896536+00:00
assistant,"Je zit al goed qua richting! Het intermediaire mesoderm vormt inderdaad de nieren, maar de darmen ontstaan voornamelijk uit het endoderm.

Kun je iets meer zeggen over welke andere structuren, naast de nieren, ook uit het intermediaire mesoderm ontstaan? Denk aan het voortplantingssysteem…",2025-09-17T14:00:31.455422+00:00
user,"eierstokken, testes, baarmoeder, eileiders,",2025-09-17T14:01:23.427483+00:00
assistant,"Perfect! Precies: het intermediaire mesoderm geeft aanleiding tot onderdelen van de urinewegen (zoals de nieren) én het voortplantingsstelsel (zoals eierstokken, testes, baarmoeder, en eileiders).

Je beheerst nu knap veel kernbegrippen rondom de vroege embryonale ontwikkeling!  
Nu we de onderdelen en termen helder hebben, gaan we verder met de processen: waarom vinden bepaalde dingen plaats en wat zijn de gevolgen daarvan.

Mijn vraag:  
Waarom is het proces van gastrulatie zo belangrijk voor de verdere ontwikkeling van het embryo? Wat gebeurt er als dit proces niet goed verloopt?",2025-09-17T14:01:35.7706+00:00
user,als de ontwikkeling van de drie kiemlagen niet goed verloopt verloopt ook de ontwikkeling van het embryo niet goed en is het niet levensvatbaar.,2025-09-17T14:04:08.710384+00:00
assistant,"Heel juist! Gastrulatie is echt cruciaal: als de drie kiemlagen niet goed ontstaan, kunnen de basisstructuren van het lichaam niet verder gevormd worden en dat is meestal niet verenigbaar met het leven.

Laten we nu naar een ander belangrijk proces gaan:  
Waarom is de embryonale plooing (embryonic folding) zo essentieel voor het succesvol vormen van het embryo? Wat heeft dat voor gevolgen voor de ruimtelijke organisatie van de kiemlagen en toekomstige organen?",2025-09-17T14:04:18.140447+00:00
user,voor het vormen van een buikholte waar uiteindelijk je organen in komen te liggen.,2025-09-17T14:05:45.888706+00:00
assistant,"Goed begin! Je noemt een belangrijk gevolg: het ontstaan van de buikholte. Door de plooing krijgen de organen inderdaad hun plek binnen het lichaam.

Kun je aanvullen:  
Wat gebeurt er met de ligging van de kiemlagen en de positie van structuren zoals de dooierzak tijdens deze plooing? Wat verandert er in hun relatie tot elkaar?",2025-09-17T14:05:53.758375+00:00
user,"het ectoderm ontvouwt zich om de andere twee kiemlagen heen,",2025-09-17T14:07:14.465354+00:00
assistant,"Precies, het ectoderm omhult de andere kiemlagen door de plooing van het embryo.

Kun je verder toelichten wat er gebeurt met het endoderm en mesoderm tijdens deze plooien? Met andere woorden: krijgen deze lagen ook een specifieke positie of structuur doordat het embryo plooit?",2025-09-17T14:07:21.53549+00:00
user,het endoderm wordt tot een buis samen geperst en het mesoderm zit daar weer omheen.,2025-09-17T14:08:25.416613+00:00
assistant,"Mooi uitgelegd! Het endoderm vormt inderdaad een buis (de toekomstige darmbuis) tijdens de plooien, en daaromheen positioneert zich het mesoderm.

Nu een volgende stap:  
Hoe dragen de verschillende mesodermale subdivisies (axiaal, paraxiaal, intermediair, laterale plaat mesoderm) bij aan de vorming van de lichaamsholten? Wat is de rol van het laterale plaat mesoderm hierin?",2025-09-17T14:08:34.656031+00:00
user,het axiale plaat mesoderm was eerst boven je hoofd zeg maar en verplaatst zich nu meer naar het centrum wat uiteindelijk je borst wordt.,2025-09-17T14:10:47.5398+00:00
assistant,"Interessante poging! Je benoemt een verplaatsing, maar ik zie dat het antwoord vooral over het axiale mesoderm/chorda dorsalis gaat. Even focussen op de lichaamsholte:

Denk eens aan het laterale plaat mesoderm:  
Het splijt in twee lagen — weet je wat deze twee lagen zijn, en wat zij begrenzen of vormen binnen het embryo? Heb je hier ideeën over?",2025-09-17T14:10:55.20873+00:00
user,de holtes worden gevormd in het mesoderm vna de zijplaat,2025-09-17T14:12:16.505365+00:00
assistant,"Heel goed, dat klopt! De lichaamsholten ontstaan inderdaad tussen de lagen van het laterale plaat mesoderm (zijplaatmesoderm).

Weet je ook hoe deze twee lagen heten (deze bekleden het inwendige van de lichaamswand en de organen zelf)? En wat is hun betekenis voor verdere ontwikkeling en beweging van de ingewanden?",2025-09-17T14:12:26.746785+00:00
user,endoderm en mesoderm een beschermingslaag,2025-09-17T14:14:23.059+00:00
assistant,"Je zit al in de goede richting, maar de twee lagen waar ik op doel zijn beide onderdeel van het laterale plaat mesoderm, niet het endoderm. Ze vormen de bekleding van respectievelijk de lichaamswand en de organen.

Wil je nog een gok doen? Denk: één laag aan de buitenkant (tegen de lichaamswand) en één laag aan de binnenkant, rondom de organen. Welke namen passen daar bij?",2025-09-17T14:14:30.955155+00:00
user,epitheel en bindweefsel,2025-09-17T14:15:26.908763+00:00
assistant,"Dat zijn algemene termen voor celtypen en weefsels, maar de namen die we zoeken zijn specifieker voor de embryonale situatie en lichaamsholten. 

Denk nog eens: de ene laag wordt wel de “parietale” laag genoemd (tegen de lichaamswand), de andere de “viscerale” laag (tegen de organen).

Welke functies denk je dat deze “parietale” en “viscerale” lagen hebben als het gaat om de lichaamsholte?",2025-09-17T14:15:38.267095+00:00
user,we weten het niet zeg het  maar,2025-09-17T14:15:43.910515+00:00
assistant,"Ik snap dat het lastig is! Maar in plaats van het antwoord direct te geven: kun je eens proberen te bedenken waarom het logisch zou zijn om rond de organen en langs de binnenkant van de lichaamswand een bekleding te hebben? Denk je dat dat iets te maken heeft met beweging, bescherming of ruimte? Wat is het voordeel van een ""dubbele bekleding"" voor iets als de ingewanden?",2025-09-17T14:15:52.287022+00:00
