role,content,created_at
user,Hi,2025-09-17T13:33:18.064385+00:00
assistant,"Hello! Let's get started with your learning objective on embryonic development.

Here’s a clinical vignette to guide our session:

A healthy 25-year-old woman had routine prenatal care. At 24 weeks of pregnancy, an ultrasound revealed a small opening (~5 mm) on the right side of the baby’s belly, near the umbilical cord. Genetic tests (amniotic fluid analysis) at 26 weeks were normal. Over time, the opening enlarged (up to 34 mm), and parts of the baby’s intestines were seen floating in the amniotic fluid. The baby also measured smaller than expected. At 37 weeks, a caesarean section was performed. The newborn boy had parts of his small and large intestines, and stomach, located outside the abdomen. The supporting tissue was short, and the bowel appeared swollen. The diagnosis was gastroschisis, a defect in the abdominal wall.

To build your learning step by step, let’s start with some fundamentals:

**What are the three germ layers formed during early embryonic development called?**",2025-09-17T13:33:57.896088+00:00
user,kun je in het nederlands verder?,2025-09-17T13:34:10.164778+00:00
assistant,"Dat is prima! We gaan verder in het Nederlands.

Laten we beginnen met een basisvraag over embryonale ontwikkeling:

**Hoe heten de drie kiembladen die gevormd worden tijdens de vroege embryonale ontwikkeling?**",2025-09-17T13:34:15.798101+00:00
user,"ectoderm, mesoderm en endoderm",2025-09-17T13:34:40.13173+00:00
assistant,"Heel goed! De drie kiembladen zijn inderdaad het **ectoderm**, **mesoderm** en **endoderm**.

Volgende vraag om je kennis verder uit te bouwen:

**Wat wordt bedoeld met “embryonale plooing” (embryonic folding) tijdens de ontwikkeling van het embryo?**",2025-09-17T13:34:49.774454+00:00
user,de neurale platen vouwen waardoor er twee neurale plooien ontstaan,2025-09-17T13:35:51.598457+00:00
assistant,"Dat is een interessante associatie, maar embryonale plooing gaat eigenlijk over iets anders dan de vorming van de neurale buis. Je hebt het nu over neurulatie, waarbij de neurale plaat zich omvormt tot de neurale buis. Embryonale plooing verwijst naar een proces dat het hele embryo betreft.

Kun je je herinneren wat er met het **hele embryo** gebeurt tijdens de embryonale plooing, bijvoorbeeld in relatie tot de lichaamsvorm van het embryo? Wat gebeurt er met de positie van de dooierzak en de lichaamswand?",2025-09-17T13:36:02.445124+00:00
user,head-to-tail folding,2025-09-17T13:37:32.85435+00:00
assistant,"Dat is inderdaad een belangrijk deel van embryonale plooing! Tijdens de embryonale plooing vindt er een soort “head-to-tail folding” (craniaal-caudale plooing) plaats.

Kun je beschrijven wat er daarnaast gebeurt met de zijkanten van het embryo (“lateral folding”)? Wat is het gevolg hiervan voor de vorm van het embryo en de positie van de kiembladen?",2025-09-17T13:37:41.180554+00:00
user,kun je per week uitleggen welke embryonale processen er plaats vinden?,2025-09-17T13:40:41.290441+00:00
assistant,"Goede vraag! We gaan even stapsgewijs door de belangrijkste processen per week in de vroege embryonale ontwikkeling. Ik help je alvast op weg, en jij probeert daarna zelf het lijstje aan te vullen of samen te vatten.

**Week 1:**  
De bevruchte eicel ondergaat klievingsdelingen en vormt een blastocyst.

**Week 2:**  
Implantatie in de baarmoederwand; differentiatie in twee lagen: epiblast en hypoblast.

**Week 3:**  
Start van de gastrulatie – vorming van de drie kiembladen (ectoderm, mesoderm, endoderm). Ook start van de aanleg van het primitiefstreep en begin van het vormen van het notochord.

**Week 4:**  
Belangrijk! Hier ontstaan de lichaamsplooien (embryonale plooing):  
- Craniaal-caudale plooing (kop- en staartplooi)
- Laterale plooing (zijkanten vouwen naar binnen)
- Begin van het vormen van de buikwand en de primitieve lichaamsvorm  
Hier ontstaat ook de aanleg van organen (organogenese begint).

**Week 5:**  
Verder ontwikkelen van organen, segmentatie van het mesoderm in somieten, groeien van ledematen begint, verdere uitbouw van de neurale buis en ontwikkeling van het hart.

Kun je deze samenvatting verder aanvullen, of aangeven wat je opvalt aan de embryonale processen in deze eerste vijf weken? Wat zijn volgens jou de belangrijkste veranderingen tussen week 3 en week 5?",2025-09-17T13:41:03.658054+00:00
user,je gaat tussen week 3 en week 5 opeens  van enkel de kiembladen tot de vorming van organen,2025-09-17T13:43:02.209096+00:00
assistant,"Goed opgemerkt! Tussen week 3 en week 5 gebeurt er inderdaad heel veel in korte tijd. In week 3 ontstaan de kiembladen, maar in week 4 en 5 gaat het embryo razendsnel over van een platte schijf naar een driedimensionale structuur met vroege organen.

Om je te helpen dit te structureren:

- **Week 3:** Gastrulatie: Vorming 3 kiembladen (ectoderm, mesoderm, endoderm) en begin aanleg van de primitiefstreep en het notochord.
- **Week 4:** Embryonale plooing (longitudinaal en lateraal):  
   - Het embryo buigt in de lengte en breedte.  
   - Sluiting van de lichaamsholte (coeloom).  
   - Het hart begint te kloppen.  
   - Begin van de neurale buisvorming (neurulatie).  
- **Week 5:**  
   - Vroege orgaanontwikkeling (organogenese) begint echt op gang te komen.  
   - Mesoderm splitst in verschillende delen (axiaal, paraxiaal, intermediair, laterale plaat).  
   - Eerste zichtbare ledemaatknoppen ontstaan.

Welke van deze processen – of een stap die ik genoemd heb – zou je graag wat verder uitgelegd of uitgediept willen hebben? Of wil je een deel zelf proberen te omschrijven?",2025-09-17T13:43:21.427036+00:00
user,kun je weer andere vragen stellen los van dit stukje?,2025-09-17T13:44:13.873637+00:00
assistant,"Zeker! We gaan weer verder met losse kennisvragen over de vroege embryonale ontwikkeling.

**Vraag:**  
Hoe noem je het proces waarbij uit de drie kiembladen verschillende typen weefsels en organen ontstaan?",2025-09-17T13:44:38.22974+00:00
user,neurulatie,2025-09-17T13:46:19.557569+00:00
assistant,"Dat is een begrijpelijke verwarring! **Neurulatie** is namelijk het proces waarbij specifiek het zenuwstelsel (de neurale buis) wordt gevormd uit het ectoderm. Mijn vraag ging over het algemene proces waarbij uit álle kiembladen samen de verschillende weefsels en organen ontstaan.

Kun je nog eens nadenken: welk algemener begrip gebruiken we hiervoor? Je kunt denken aan een term die aangeeft hoe vormen en structuren ontstaan uit het embryo.",2025-09-17T13:46:27.965474+00:00
user,gastrulatie,2025-09-17T13:46:32.891181+00:00
assistant,"Je bent al goed op weg! Gastrulatie is het proces waarbij de drie kiembladen (ectoderm, mesoderm, endoderm) ontstaan uit de epiblast, dus het op gang brengen van de differentiatie van cellagen.

Maar het proces waarbij uit deze kiembladen vervolgens alle specifieke weefsels, organen en structuren zich gaan vormen, heet iets anders. Het begint met een ""m"" en wordt vaak gezien als het geheel van vormgevingsprocessen in het embryo. Kun je nu op het woord komen?",2025-09-17T13:46:43.860316+00:00
user,mesoderm,2025-09-17T13:48:02.978352+00:00
assistant,"Je maakt een logische associatie, want het **mesoderm** is inderdaad één van de kiembladen waaruit veel weefsels ontstaan. Maar de term die we zoeken is iets algemener, en beschrijft het hele proces waarbij *vorm en structuur* ontstaat uit het embryo, vanuit alle kiembladen (niet alleen mesoderm).

Denk aan een woord dat ook in andere contexten wordt gebruikt om de ontwikkeling van *vorm* aan te duiden...  
Kun je het proberen? (Tip: het begint met ""morph-"").",2025-09-17T13:48:12.482533+00:00
user,morphogenese,2025-09-17T13:48:28.763222+00:00
assistant,"Helemaal juist! **Morphogenese** is inderdaad het proces waarbij de vorm en structuur van het embryo wordt opgebouwd, doordat cellen uit de verschillende kiembladen zich organiseren tot weefsels en organen.

Nog een kennisvraag om verder te oefenen:

Het mesoderm splitst zich op in verschillende onderdelen. Kun je de vier hoofdsubdivisies van het mesoderm noemen?",2025-09-17T13:48:36.518185+00:00
user,"paraxiaal, lateraal",2025-09-17T13:49:35.693268+00:00
assistant,"Goed! Je hebt er al twee: **paraxiaal** mesoderm en **lateraal** mesoderm.

Er zijn in totaal vier hoofdsubdivisies. Kun je je bedenken wat de andere twee zijn? Misschien kun je denken aan de ligging ten opzichte van de lichaamsas en de organen die eruit ontstaan.",2025-09-17T13:49:42.562286+00:00
user,ik weet het niet,2025-09-17T13:49:59.222113+00:00
assistant,"Geen probleem! Je hebt al een goede poging gedaan. 

Een tip:  
- Eén van de ontbrekende subdivisies draagt bij aan de vorming van de urogenitale stelsels (zoals nieren en voortplantingsorganen).
- De andere loopt precies in het midden als een dunne streng, belangrijk voor asvorming van het embryo.

Kun je met deze aanwijzingen de namen proberen te vinden of herinneren? Zo niet, probeer het eens op te zoeken in je boek of aantekeningen en laat het me weten!",2025-09-17T13:50:17.430561+00:00
assistant,"**OVERALL SUMMARY**  
Je hebt actief meegedacht en veel verschillende stappen van de embryonale ontwikkeling geprobeerd uit te leggen. Je toont een goede inzet en neemt initiatief door zelf aanvullende vragen te stellen, wat erg positief is!

**WHAT YOU DID WELL**
- **Sterke grip op:** De basiskennis van de kiembladen (ectoderm, mesoderm, endoderm) is bij jou goed aanwezig. Je kunt ook goed benoemen wanneer bepaalde processen (zoals head-to-tail folding) plaatsvinden.
- **Goede toepassing van:** Je laat kritisch denken zien door aandacht te besteden aan de overgang van de platte kiembladschijf naar de beginstadia van orgaanvorming, en je vraagt actief door waar je extra uitleg wenst.

**AREAS FOR GROWTH & FOCUS**
- **Begrippen reviewen:** Het blijkt soms lastig onderscheid te maken tussen processen als gastrulatie, neurulatie en morfogenese. Ook het benoemen van de vier subdivisies van het mesoderm mag je nog oefenen.
- **De verbanden leggen:** Het koppelen van algemene processen aan specifieke voorbeelden (zoals wat morfogenese betekent ten opzichte van gastrulatie) kan je sterker maken door de termen in samenhang te zien.
- **Uitbreiden toepassingsniveau:** Je geeft duidelijk aan als je iets niet weet, wat goed is. Een volgende stap is om – ook als je twijfelt – te benoemen wat je wél weet en hoe je tot een antwoord zou proberen te komen.

**ACTIEGERICHT LEERADVIES**  
Omdat het onderscheiden van en het onthouden van specifieke begrippen (zoals gastrulatie, neurulatie, morfogenese en de subdivisies van het mesoderm) een aandachtspunt is:

**Gebruik flashcards om de kernbegrippen en hun definities actief te oefenen.** Zet op de ene kant van de kaartjes de term (bijvoorbeeld: ""neural tube formation""), en op de andere kant het bijbehorende proces (""neurulatie, uit het ectoderm gevormd, week 4""). Dit helpt je beter en sneller schakelen tussen termen en processen.

Blijf vooral actief vragen stellen, dit versnelt je leerproces!",2025-09-17T13:55:21.4+00:00
