role,content,created_at
user,laten we beginnen,2025-09-17T14:47:03.656087+00:00
assistant,"Hier volgt de casus om het onderwerp te kaderen:

**Vignette:**  
Een gezonde 25-jarige vrouw had routine prenatale zorg. Bij 24 weken zwangerschap werd op de echo een kleine opening (~5 mm) aan de rechterzijde van de buik van de baby gezien, nabij de navelstreng. Genetisch onderzoek op 26 weken was normaal. De opening werd groter tot 34 mm en delen van de darmen dreven in het vruchtwater. Bij de geboorte, na een keizersnede op 37 weken, had de pasgeboren jongen delen van het maag-darmkanaal buiten de buik, met een korte ondersteunende band en opgezwollen darmen. De diagnose: gastroschisis, een defect van de buikwand.

Mijn eerste vraag om mee te starten:

**Wat is gastrulatie?**",2025-09-17T14:47:17.319916+00:00
user,"tijdens de gastrulatie wordt de neurale buis gevormd en ectoderm, mesoderm en endoderm",2025-09-17T14:48:12.895016+00:00
assistant,"Je uitleg is al op de goede weg! Maar er zijn een paar details die aandacht verdienen.

Heb je erover nagedacht of de neurale buis écht tijdens de gastrulatie wordt gevormd? Of gebeurt dat in een latere fase? Gastrulatie draait vooral om iets anders.

Kun je proberen te omschrijven wat gastrulatie zelf precies inhoudt en wat er tijdens dat proces gebeurt met de kiemlagen? Wat weet je van de bewegende cellen in die fase?",2025-09-17T14:48:22.410623+00:00
user,de kiemlagen gaan tijdens de gastrulatie vouwen. Hierbij ontstaan organen en de rest van het lichaam van embryo gaat groeien.,2025-09-17T14:49:18.756792+00:00
assistant,"Goed dat je focust op de kiemlagen! Maar denk nog eens goed na: wat gebeurt er echt tijdens de gastrulatie – gaat het al om het vormen van organen, of speelt er een meer basaal proces?  
Vouwen is een belangrijk begrip, maar is dat precies wat tijdens gastrulatie gebeurt?  

Tip: Gastrulatie zorgt ervoor dat een tweelaags embryo een drielaags embryo wordt. Kun je met die hint opnieuw proberen uit te leggen wat gastrulatie is en wat er dan precies wordt gevormd?",2025-09-17T14:49:27.86724+00:00
user,er wordt een drielagen structuur in het kiemblad gevormd. Hieruit kunnen weefsel en organen ontstaan,2025-09-17T14:50:51.537321+00:00
assistant,"Dat klopt! Tijdens de gastrulatie ontstaat uit het tweelagige embryo een drielaags structuur met drie kiemlagen: ectoderm, mesoderm, en endoderm. Deze kiemlagen vormen later alle verschillende weefsels en organen van het lichaam.

Volgende vraag:  
**Kun je de drie kiemlagen (ectoderm, mesoderm, endoderm) benoemen en kort aangeven waar ieder voor dient in de embryonale ontwikkeling?**",2025-09-17T14:51:01.722771+00:00
user,"ectoderm ontwikkelt zich de zenuwstelsel, mesoderm vormt hartspiercellen, spiercellen. Endoderm vormt spijsverteringskanalen",2025-09-17T14:52:02.461146+00:00
assistant,"Goed! Je koppelt elke kiemlaag aan belangrijke structuren:

- Ectoderm → zenuwstelsel
- Mesoderm → hartspiercellen en andere spiercellen
- Endoderm → spijsverteringskanaal

Misschien kun je voor elke laag nog 1 extra orgaan, structuur of type weefsel noemen die uit die kiemlaag ontstaat? Zo leer je breder toepassen. Wat zou je erbij zetten voor bijvoorbeeld het ectoderm en mesoderm?",2025-09-17T14:52:11.274454+00:00
user,ectoderm vorm epitheelcellen. Mesoderm vormt spieren,2025-09-17T14:53:35.677008+00:00
assistant,"Prima: inderdaad — het ectoderm vormt ook epitheel (denk aan de huid/opperhuid), en het mesoderm vormt spieren. Wil je het afmaken door te noemen wat het endoderm naast het spijsverteringskanaal nog meer vormt? Misschien kun je denken aan andere organen die met het spijsverteringskanaal verbonden zijn!",2025-09-17T14:53:43.008777+00:00
user,"slokdarm, dunne darm, maag",2025-09-17T14:54:17.848968+00:00
assistant,"Dat klopt! De slokdarm, dunne darm en maag vormen allemaal delen van het spijsverteringskanaal, dat uit het endoderm ontstaat. Maar het endoderm vormt ook sommige andere organen die niet direct “kanaal” zijn. Heb je gedacht aan klieren of organen die met spijsvertering of ademhaling te maken hebben, zoals de lever of longen?

Laten we nu naar een nieuwe term gaan:

**Wat is embryonale plooivorming (embryonic folding)?**",2025-09-17T14:54:28.462303+00:00
user,hierbij onstaat organen die plooing nodig hebben zoals de dunne darm,2025-09-17T14:55:24.120721+00:00
assistant,"Interessant dat je de focus legt op het vouwen van organen zelf! Maar embryonale plooivorming (embryonic folding) is iets fundamentelers — het gaat over het vouwen van het hele embryo, zodat het zijn uiteindelijke lichaamsvorm krijgt.

Denk aan het beginstadium, waar het embryo nog een soort platte schijf is…  
Kun je nog eens proberen uit te leggen wat embryonale plooivorming inhoudt voor het hele embryo en wat het doel is van die plooien? Wat verandert er grofweg aan de bouw van het embryo door deze plooivorming?",2025-09-17T14:55:34.497753+00:00
user,Door de hele embryo te plooien groeit het embryo in zijn goede vorm. Hierbij komt de hart op de juiste plek te liggen in plaats van boven de hersenen,2025-09-17T14:56:30.206415+00:00
assistant,"Precies! Door embryonale plooivorming verandert het embryo van een platte schijf naar een cilindervormig lichaam, waardoor structuren zoals het hart, dat eerst “boven” de hersenen zit, naar hun juiste plek in het lichaam bewegen. Ook worden zo de buik- en borstholte gevormd.

Goed! Laten we verder gaan met nog een basale term:  

Wat betekent het als iets craniaal, caudaal, ventraal of dorsaal ligt in het embryo? Kun je deze termen kort toelichten?",2025-09-17T14:56:39.031584+00:00
user,"craniaal is de voorzijde bij de neurale buis, caudaal is de achterzijde van de neurale buis. Ventraal is midden aan de voorzijde van je lichaam en dorsaal is de achterkant van je lichaam",2025-09-17T14:57:40.389464+00:00
assistant,"Heel goed! Je hebt de richtingaanwijzingen goed toegepast op het embryo en het volwassen lichaam.

- Craniaal is richting het hoofd
- Caudaal is richting het staart- of stuitbeeneinde
- Ventraal is de buikzijde (voorzijde)
- Dorsaal is de rugzijde (achterzijde)

Nu een volgende basisvraag die aansluit op het leerdoel:

Het mesoderm wordt tijdens de ontwikkeling onderverdeeld in verschillende delen.  
Kun je de vier belangrijkste onderdelen van het mesoderm noemen?",2025-09-17T14:57:49.047172+00:00
user,nee dat kan ik niet,2025-09-17T14:58:32.888106+00:00
assistant,"Geen probleem! Ze zijn belangrijk voor verdere studie, dus laten we het samen doorlopen.

Het mesoderm wordt in vier delen verdeeld afhankelijk van hun locatie ten opzichte van de middenlijn van het embryo. Kun je bedenken wat het centrale “as” deel is? Bijvoorbeeld het deel dat direct naast het zenuwstelsel ligt? Wat weet je nog van termen als “axiaal” of “paraxiaal”?",2025-09-17T14:58:40.692532+00:00
user,nee dat weet ik niet meer,2025-09-17T14:59:02.457366+00:00
assistant,"Dat is helemaal niet erg! Laten we het stap voor stap proberen.  
Denk aan “axiaal”—dat woord lijkt op “as”.  
Zou het logisch zijn dat het axiale mesoderm vlak langs de centrale as van het embryo ligt? En als je “paraxiaal” hoort, betekent dat misschien “naast de as”?

Probeer eens die redenatie af te maken:  
Waar zou je dan het axiale en paraxiale mesoderm verwachten in het embryo?  
En wat zou dan mogelijk het verschil tussen deze twee onderdelen zijn?",2025-09-17T14:59:19.110071+00:00
user,axiale mesoderm bij de buik en paraxiaal bij de longen en het hart.,2025-09-17T15:00:17.148619+00:00
assistant,"Je probeert logische plekken te noemen, dat is al goed! Maar de axiale as ligt in het midden—denk aan de echte 'centrale lijn' van het embryo.  

Het axiale mesoderm ligt héél centraal, precies langs de neurale buis. Het paraxiale mesoderm ligt er direct naast, aan weerszijden van de as.

Wil je proberen het met deze aanwijzing nogmaals te beschrijven? Waar loopt de as bij het embryo, en waar ligt dan het paraxiale mesoderm?",2025-09-17T15:00:25.967734+00:00
user,ligt in de neurale plaat,2025-09-17T15:00:51.257022+00:00
user,wat is de vraag?,2025-09-17T15:02:21.083472+00:00
assistant,"Goede vraag! Ik vroeg of je — naast het **axiale** en **paraxiale mesoderm** — ook de namen weet van de andere twee onderdelen van het mesoderm die tijdens de embryonale ontwikkeling ontstaan. Misschien heb je wel eens termen gehoord als “intermediate” of “lateral”?

Heb je een idee welke vier termen bij elkaar horen voor de mesodermale onderdelen? Zo niet, wil je het eens proberen te benoemen of gokken?",2025-09-17T15:02:29.665336+00:00
user,"lateral, ventraal, dorsaal,",2025-09-17T15:03:06.882752+00:00
assistant,"Je kiest logische richtingen, maar niet helemaal de wetenschappelijke indeling voor de mesodermale subdivisies.

Misschien helpt het als ik je vertel dat na “axiaal” (centrum/as) en “paraxiaal” (ernaast), de volgende lagen “intermediate” (tussenin) en “lateral plate” (aan de zijkant) mesoderm zijn genoemd.

Kende je deze termen: intermediate mesoderm en lateral plate mesoderm?  
Zou je kunnen proberen te herhalen wat nu de vier onderdelen van het mesoderm zijn, volgens deze indeling?",2025-09-17T15:03:17.859608+00:00
user,ik weet het niet,2025-09-17T15:03:46.534736+00:00
assistant,"Dat is niet erg! Hier komt een korte hint die je helpt het straks te onthouden:

Langs de middenlijn heb je eerst het **axiale mesoderm**, daarnaast het **paraxiale mesoderm**, vervolgens aan beide kanten het **intermediate mesoderm**, en het meest naar buiten het **lateral plate mesoderm**.

Kun je nu, met deze hint, de vier mesodermale onderdelen nog één keer opsommen? Zo onthoud je het beter.",2025-09-17T15:03:54.520373+00:00
user,axiale,2025-09-17T15:04:35.316534+00:00
assistant,"Goed, dat is de eerste! Kun je nu proberen op basis van de hint de drie andere direct opnoemen, naast “axiale”? Gewoon hardop proberen!",2025-09-17T15:04:41.439719+00:00
user,"paraxiale, intermediate, lateral plate",2025-09-17T15:04:53.283093+00:00
assistant,"Exact!  
Dat zijn ze: axiale, paraxiale, intermediate en lateral plate mesoderm.

Hiermee heb je belangrijke basiskennis gelegd.

Zullen we nu doorgaan naar uitlegvragen, waarin je kunt laten zien hoe deze structuren ontstaan en samenwerken? 

Mijn vraag: **Kun je uitleggen wat er gebeurt tijdens gastrulatie, en waarom dit proces belangrijk is voor de verdere ontwikkeling van het embryo?**",2025-09-17T15:05:17.998771+00:00
user,"bij de gastrulatie ontwikkeld de drie laagse kiembladen, hierdoor kunnen weefsel en organen van embryo's ontwikkelen",2025-09-17T15:05:55.126485+00:00
assistant,"Mooi, je hebt het kernidee te pakken: door gastrulatie ontstaan de drie kiemlagen, die later de verschillende weefsels en organen vormen.

Misschien kun je de stap nog iets concreter maken:  
Wat gebeurt er met de cellen tijdens gastrulatie? Gaan ze ergens heen, migreren ze, veranderen ze van plek? Waarom is dat verplaatsen voor de vorming van kiemlagen zo belangrijk volgens jou?",2025-09-17T15:06:03.123632+00:00
user,de cellen gaan vouwen en verplaatsen. door kiemlagen te verplaatsen ontstaan verschillende organen en kan de embryo groeien,2025-09-17T15:06:45.262438+00:00
assistant,"Goed! Je beschrijft dat cellen zich verplaatsen en dat dit essentieel is voor de vorming van organen. Wat je noemt over “vouwen” past inderdaad bij de dynamiek van gastrulatie, maar vooral het verplaatsen (migratie) en doordringen van cellen door het embryonale epiblastlaagje is hier heel belangrijk.

Nu door naar het volgende proces:

**Kun je uitleggen waarom embryonale plooivorming (embryonic folding) nodig is, en wat er gebeurt met de ligging van lichaamsdelen tijdens dit proces?**",2025-09-17T15:06:54.257915+00:00
assistant,"**OVERALL SUMMARY**  
Goed gedaan! Je hebt je actief ingezet om basisconcepten uit de embryologie te begrijpen en je liet niet los, ook als het even lastig werd. Door goed op hints in te gaan en telkens te proberen opnieuw uit te leggen, toon je doorzettingsvermogen en leergierigheid.

**WHAT YOU DID WELL**
- **Strong Grasp of:** De drie kiemlagen (ectoderm, mesoderm, endoderm) en hun basisfuncties heb je goed herkend en benoemd. Ook richtingtermen als craniaal, caudaal, ventraal en dorsaal kun je toepassen.
- **Good Application of:** Je past geleerde kennis toe als je terugkomt op de functies van kiemlagen en de processen rondom embryonale plooivorming. Je wist beschrijvend onder woorden te brengen waarom bepaalde processen (zoals gastrulatie) belangrijk zijn.

**AREAS FOR GROWTH & FOCUS**
- **Reviewing Key Terms:** Je had moeite met het direct benoemen van de vier delen van het mesoderm en vergat soms de exacte volgorde of de gebruikte termen (axiaal, paraxiaal, intermediate, lateral plate). Ook bij sommige organsystemen samengesteld uit bepaalde kiemlagen bleef je soms steken.
- **Connecting the Dots:** Bij uitleggen van processen zoals gastrulatie of embryonale plooivorming bleef je antwoord soms wat algemeen (“cellen gaan vouwen/verplaatsen”), terwijl het extra inzicht geeft als je specifieker onderscheidt: migratie, invaginatie, vormverandering, enzovoorts.

**ACTIONABLE STUDY RECOMMENDATIONS**
Omdat vooral het vlot en juist benoemen van key terms en onderdelen lastig was, raad ik je aan:
- **Maak gebruik van flashcards:** Schrijf op de ene kant van een kaartje bijvoorbeeld “vier onderdelen mesoderm”, op de andere kant “axiaal, paraxiaal, intermediate, lateral plate”. Doe dit ook voor de kiemlagen, richtingtermen en embryonale processen. Oefen ze hardop totdat je ze zonder twijfel kunt opnoemen—het leggen van deze basis maakt het uitleggen van processen later veel makkelijker!",2025-09-17T15:07:42.208+00:00
user,ik ben er klaar voor,2025-09-18T17:34:02.738856+00:00
assistant,"Dankjewel! Hier volgt de casus waarmee we starten:

### VIGNETTE ###
Een gezonde vrouw van 25 jaar kreeg routine prenatale zorg. Bij 24 weken zwangerschap werd op de echo een klein openingetje (~5 mm) aan de rechterkant van de buik van de baby gezien, naast de navelstreng. Genetisch onderzoek (vruchtwaterpunctie) bij 26 weken was normaal. De opening werd groter (tot 34 mm) en delen van de darmen dreven in het vruchtwater. De baby bleek kleiner dan verwacht. Bij 37 weken werd een keizersnede verricht. De pasgeboren jongen had delen van zijn dunne en dikke darm, en de maag, buiten de buikholte. Het ondersteunende weefsel was kort en de darm was opgezet. Er werd gastroschisis (open buikwanddefect) vastgesteld.

Hier volgt mijn eerste vraag:

**Wat is gastrulatie?**",2025-09-18T17:34:17.040374+00:00
user,Bij gastrulatie worden de kiemlagen gevormd voor de drielaagse embryo,2025-09-18T17:35:11.115491+00:00
assistant,"Goed! Inderdaad, tijdens gastrulatie ontstaan de drie kiemlagen.

Kun je deze drie kiemlagen bij naam noemen?",2025-09-18T17:35:16.726238+00:00
user,"Ectoderm, mesoderm, Endoderm",2025-09-18T17:35:25.950865+00:00
assistant,"Heel goed, dat klopt!

Nu een vervolgvraag:  
**Wat wordt bedoeld met embryonale plooing (embryonic folding)?**",2025-09-18T17:35:31.183041+00:00
user,Met embryonale plooing worden het vouwen van de embryo bedoelt zodat het hart onder het hoofd van het embryo komt te liggen,2025-09-18T17:36:08.902065+00:00
assistant,"Mooie poging! Je noemt al het hart en het hoofd, wat inderdaad tijdens het plooien verschuift. Maar embryonale plooing heeft nog meer functies en gebeurt niet alleen aan de kopzijde.

Kun je beschrijven wat er met de rest van het embryo gebeurt tijdens deze plooifase? Heb je gedacht aan de richting waarin het embryo vouwt en wat er met de embryonale lichaamsholte gebeurt?",2025-09-18T17:36:17.206621+00:00
user,de embryo vouwt in een cilinder. De lichaamsholte groeit en er ontstaan weefsels en organen,2025-09-18T17:36:58.885021+00:00
assistant,"Dat is een mooi uitgangspunt!  
Inderdaad, het embryo vormt een soort buisvorm door het vouwen.

Om het nog iets preciezer te krijgen:  
- In welke twee richtingen (assen) vindt deze plooing plaats?
- En wat gebeurt er met de dooierzak tijdens het proces?

Kun je die stap nog uitleggen?",2025-09-18T17:37:06.703258+00:00
user,dorsaal en ventral.De dooierzak vervalt,2025-09-18T17:37:24.98238+00:00
assistant,"Je noemt de termen dorsaal en ventraal, wat met rugzijde en buikzijde te maken heeft. Zou je het ook kunnen uitleggen met de termen lengte-as (craniaal-caudale as) en zijwaartse as (laterale as)?  
En kun je het toelichten door te benoemen wat er gebeurt als het embryo in die richtingen vouwt?

Denk ook nog even aan de dooierzak: vervalt deze helemaal, of blijft er een deel als structuur bestaan? Wat weet je daarvan?",2025-09-18T17:37:35.255006+00:00
user,de dooierzak wordt een soort oerdarm. Craniaal dichtbij het hoofd. caudaal dichtbij de voeten,2025-09-18T17:40:31.778425+00:00
assistant,"Heel goed, je legt nu al duidelijker uit wat er gebeurt!

Het klopt: de dooierzak wordt door het plooien deels opgenomen tot de oerdarm (primitieve darm), en het plooien vindt plaats in zowel de craniaal-caudale richting (kop-staart) als in laterale richting (zijwaarts). Hierdoor ontstaat een buisvorm, en zo worden buikzijde en rugzijde gevormd.

Laten we nu een ander belangrijk begrip bespreken:

**Kun je kort uitleggen wat “morfogenese” is?**",2025-09-18T17:40:57.374761+00:00
user,het onstaan van een bevruchte eicel,2025-09-18T17:41:44.987538+00:00
assistant,"Dat is een logische gedachte, maar morfogenese verwijst specifiek niet naar alleen het ontstaan van een bevruchte eicel!

Denk terug aan de term zelf: ""morfo-"" (vorm) en ""-genese"" (vorming).  
Kun je, met deze aanwijzing, nog eens proberen uit te leggen wat morfogenese betekent in de embryonale ontwikkeling? Wat gebeurt er precies tijdens morfogenese?",2025-09-18T17:41:53.303532+00:00
user,Tijdens de embryonale ontwikkeling gaat de morula zich nestelen in het endonetrium,2025-09-18T17:42:26.859804+00:00
assistant,"Je zit nu op het spoor van innesteling (implantatie), maar morfogenese betekent nog iets anders.

Denk aan de ontwikkeling van vorm en structuur bij het embryo.  
Wat zegt “morfogenese” over hoe cellen en weefsels zich organiseren tot specifieke vormen en organen? Kun je je uitleg daarop aanpassen? Wat ontstaat er precies tijdens morfogenese?",2025-09-18T17:42:37.313047+00:00
user,"organen ontstaan en mesoderm, ectoderm en endoderm",2025-09-18T17:43:03.932479+00:00
assistant,"Goed! Je komt nu in de richting. Tijdens morfogenese ontstaan structuren en organen doordat de kiemlagen zich verder differentiëren en organiseren tot weefsels en organen van het lichaam.

Nu een nieuwe vraag om een andere term te onderzoeken:
**Welke vier hoofdonderdelen worden er onderscheiden binnen het mesoderm, en kun je benoemen waaruit ze bestaan?**",2025-09-18T17:43:12.630098+00:00
user,"paraxiale, axiale, laterale plate en intermediatte",2025-09-18T17:43:49.457884+00:00
assistant,"Goed, je noemt ze bijna allemaal correct!

Wil je jezelf uitdagen om kort te omschrijven waar ze elk (axiale, paraxiale, intermediaire en laterale plaat mesoderm) in het embryo liggen, of wat ze later ongeveer gaan vormen?  
Bijvoorbeeld: waar ligt het paraxiale mesoderm ten opzichte van de rest, en wat vormt het vooral?  

Probeer dit kort per onderdeel toe te lichten.",2025-09-18T17:43:57.807383+00:00
user,"axiale ligt in het midden, paraxiale ligt bij de voeten. laterale plaat aan de zijkant en intermediate ligt aan de rugzijde",2025-09-18T17:45:05.594879+00:00
assistant,"Leuk dat je het probeert te lokaliseren! Je hebt de begrippen door elkaar gehaald wat betreft hun precieze ligging in het embryo. Een tip: denk aan het dwarsdoorsnijden van een embryo, van het midden naar de zijkant. Kun je je herinneren hoe het dan geordend is, vanaf het midden (niet van boven/beneden, maar in de breedte)?

Misschien helpt het om het als volgt in te vullen:

1. Axiale mesoderm (iets in het midden)
2. Paraxiale mesoderm (langs de ...?)
3. Intermediaire mesoderm (tussen ... en ...)
4. Laterale plaat mesoderm (aan de ...zijde)

Kun je dit rijtje aanvullen met wat je nu weet?",2025-09-18T17:45:18.847189+00:00
user,laterale plaat aan de buikzijde. intermediare tussen geen idee,2025-09-18T17:47:16.099381+00:00
assistant,"Prima dat je het probeert! Je zit al goed met “laterale plaat”: dat ligt aan de zijkanten van het embryo, richting de buikzijde.  
Zullen we het samen logisch opbouwen?

Stel je een doorsnede door het embryo voor, van midden naar buiten:
1. **Axiale mesoderm** – wat zou daar precies in het midden kunnen liggen? Denk aan iets belangrijks dat zich over de lengte-as van het embryo uitstrekt.
2. **Paraxiale mesoderm** – “para” betekent naast. Waar zou dat liggen?
3. **Intermediaire mesoderm** – “intermediair” betekent tussenin. Tussen welke twee structuren zou dat logisch zijn?
4. **Laterale plaat mesoderm** – dat heb je goed, dat ligt aan de zijkant.

Kun je nu voor elk van deze vier, het juiste plekje beschrijven aan de hand van bovenstaande hints?",2025-09-18T17:47:31.308865+00:00
user,axiale midden van de buik. paraxiale naast de darmen. Intermediair tussenin buik en hoofd,2025-09-18T17:48:40.365482+00:00
assistant,"Je doet goed je best om het te lokaliseren! Laten we nog eens samen kijken — de namen geven vaak weg waar de structuren zich precies bevinden. Denk aan een doorsnede door een vroeg embryo, beginnend in het midden bij de “primitieve” structuur.

- **Axiale mesoderm**: Midden, hieruit ontstaat bijvoorbeeld de chorda (notocord).  
- **Paraxiale mesoderm**: Direct naast de axiale mesoderm, aan beide zijden langs de chorda. Hieruit ontstaan later de somieten (die belangrijk zijn voor spieren en skelet).
- **Intermediaire mesoderm**: Ligt tussen het paraxiale mesoderm en het laterale plaat mesoderm in. Hieruit vormen zich delen van het urogenitaalstelsel. 
- **Laterale plaat mesoderm**: Helemaal aan de zijkant, vormt de somatische (pariëtale) en splanchnische (viscerale) lagen.

Zullen we de volgende term bekijken?

**Wat wordt bedoeld met ventraal en dorsaal bij embryonale ontwikkeling?**",2025-09-18T17:48:57.497052+00:00
user,ventral is buikzijde van de embryo en dorsaal is de rugzijde van de embryo,2025-09-18T17:49:34.052532+00:00
assistant,"Dat is helemaal juist!

Nu gaan we over naar de *processen*:  
**Kun je uitleggen wat er precies gebeurt tijdens het proces van gastrulatie? Wat zijn de belangrijkste stappen?**",2025-09-18T17:49:41.909668+00:00
user,"tijdens de gastrulatie worden de kiemlagen drielage. Mesoderm,ectoderm, endoderm gaan vouwen en vormen een cilinder",2025-09-18T17:50:23.225235+00:00
assistant,"Je noemt de kiemlagen en het vouwen al! Maar gastrulatie is een specifiek proces waar deze kiemlagen daadwerkelijk gevormd worden, en het vouwen hoort net iets later bij de embryonale plooing.

Kun je je herinneren hoe uit de oorspronkelijke tweelagige kiemschijf (epiblast en hypoblast) drie kiemlagen ontstaan? Wat gebeurt er met cellen tijdens gastrulatie?  
Tip: Denk aan migratie en invaginatie van cellen. Kun je de opeenvolgende stappen beschrijven?",2025-09-18T17:50:32.552924+00:00
user,cellen gaan zich delen en verplaatsen door het gehele lichaam,2025-09-18T17:51:02.366243+00:00
assistant,"Klopt, cellen gaan zich inderdaad verplaatsen! Dit gebeurt heel gericht.

Om het iets specifieker te maken:  
Tijdens gastrulatie migreert een groep epiblastcellen via een speciale groeve naar binnen, en zo worden drie lagen gevormd.  
Weet je nog hoe deze groeve heet of kun je de volgorde van de kiemlaagvorming (welke laag wordt als eerste aangelegd, welke als laatste) beschrijven?",2025-09-18T17:51:10.613507+00:00
user,"endoderm, dan mesoderm dan ectoderm. notochord",2025-09-18T17:52:48.278995+00:00
assistant,"Heel goed! Je noemt het proces in de juiste volgorde:  
- Eerst vormt zich het endoderm,  
- Daarna het mesoderm,  
- En wat overblijft vormt het ectoderm.

De notochord (chorda) is inderdaad een structuur die tijdens, en net na, gastrulatie ontstaat vanuit het axiale mesoderm.

Nu een vraag over **embryonale plooing**:  
Kun je uitleggen waarom deze vouwprocessen zo belangrijk zijn bij het ontstaan van de romp en buikholte van het embryo? Wat verandert er functioneel door deze plooien?",2025-09-18T17:52:58.358595+00:00
user,geen idee,2025-09-18T17:53:26.030583+00:00
assistant,"Geen probleem, we pakken het rustig op!

Stel je voor: in het begin is de embryo eigenlijk een platte schijf. Door het plooien buigt deze schijf naar binnen (zowel in de lengte- als in de breedterichting).  
- Wat gebeurt er met de ligging van organen (zoals darmen en hart) door dit plooien?
- Waarom ontstaat er door dit plooien een holte binnenin het embryo?

Wil je proberen op basis van deze hints te bedenken waarom dit plooiproces functioneel belangrijk is?",2025-09-18T17:53:35.469469+00:00
user,de organen gaan aar beneden.,2025-09-18T17:53:53.9321+00:00
assistant,"Mooi, dat klopt voor een deel! Door de plooien verschuiven organen inderdaad van hun oorspronkelijke positie. Denk nog even aan het feit dat sommige organen aan de “buitenzijde” zaten, maar na het plooiproces in de “binnenzijde” (buikholte) terechtkomen.

Waarom is het functioneel belangrijk dat deze organen in een afgesloten lichaamsholte komen te liggen, en niet aan de buitenkant van het embryo blijven? Wat heeft het embryo daaraan?",2025-09-18T17:54:04.8086+00:00
user,daardoor kan een embryo ontstaan en de organen hun functie uitoefenen,2025-09-18T17:55:54.113408+00:00
assistant,"Dat is goed gedacht! Wanneer de organen in een lichaamsholte liggen, kunnen ze beschermd worden en goed functioneren, en kan een duidelijke lichaamvorm ontstaan.

Laten we nog een stap verdergaan:

**Hoe dragen de drie kiemlagen (ectoderm, mesoderm, endoderm) bij aan de vorming van verschillende weefsels en organen in het embryo? Kun je bij elk kiemlaag kort een voorbeeld geven?**",2025-09-18T17:56:02.023407+00:00
