role,content,created_at
user,Ik ben klaar om te beginnen,2025-09-17T16:11:09.579149+00:00
assistant,"Laten we beginnen! Hier is de casus om alles in context te plaatsen:

**VIGNETTE:**  
Een gezonde 25-jarige vrouw had routine prenatale controles. Op 24 weken zwangerschap werd op een echo een kleine opening (~5 mm) aan de rechterkant van de buik van de baby gezien, nabij de navelstreng. Genetisch onderzoek toonde geen bijzonderheden. De opening werd later groter (tot 34 mm) en delen van de darmen zagen de artsen zweven in het vruchtwater. De baby was kleiner dan verwacht. Bij 37 weken werd via keizersnede een jongen geboren met delen van de darmen en maag buiten de buik. Het steeltje was kort en de darm was gezwollen. De diagnose was gastroschisis, een buikwanddefect.

Om te starten:  
Wat zijn de drie kiemlagen die tijdens de vroege embryonale ontwikkeling ontstaan?",2025-09-17T16:11:23.986339+00:00
user,"De lagen endoderm, mesoderm en ectoderm",2025-09-17T16:14:02.377002+00:00
assistant,"Helemaal goed! De drie kiemlagen zijn inderdaad het endoderm, mesoderm en ectoderm.

Volgende vraag:  
Wat wordt bedoeld met ""gastrulatie"" in de embryonale ontwikkeling?",2025-09-17T16:14:09.212523+00:00
user,De vroege fase van de embryonale ontwikkeling,2025-09-17T16:15:24.243432+00:00
assistant,"Dat klopt, het heeft inderdaad te maken met een vroege fase! Kun je iets specifieker zijn?  
Wat gebeurt er precies tijdens gastrulatie met betrekking tot de structuur van het embryo of de cellen?",2025-09-17T16:15:30.004049+00:00
user,Enkellage bastula word omgevormd tot een meerlagige structuur de gastrula,2025-09-17T16:17:04.651946+00:00
assistant,"Precies, goed uitgelegd! Tijdens de gastrulatie verandert de enkellagige blastula in een meerlagige gastrula waarin de drie kiemlagen ontstaan: ectoderm, mesoderm en endoderm.

Volgende vraag:  
Wat is embryonale plooivorming (embryonic folding)? Waar in het embryo speelt dit zich af?",2025-09-17T16:17:11.793897+00:00
user,dat is toch het maken tot cylindervorm?,2025-09-17T16:18:55.965417+00:00
assistant,"Ja, dat is een goede richting! Tijdens de embryonale plooivorming verandert de vorm inderdaad, maar kun je beschrijven *hoe* het embryo gevouwen wordt en langs welke richtingen (bijvoorbeeld hoofd-staart, zijwaarts)? Wat gebeurt er met de ligging van de kiemlagen hierbij?",2025-09-17T16:19:03.204857+00:00
user,Als het goed is zijwaarts,2025-09-17T16:19:20.133321+00:00
assistant,"Klopt, er is een zijwaartse (laterale) vouw, maar er is nog een andere vouw die een belangrijke rol speelt bij het vormen van de cilinder. Kun je bedenken welke dat is, en wat het effect is van deze twee vouwrichtingen op het embryo?",2025-09-17T16:19:27.043394+00:00
user,kan je mij wat verder helpen,2025-09-17T16:21:00.709422+00:00
assistant,"Natuurlijk! Dus, tijdens de embryonale plooivorming gebeuren er twee belangrijke vouwen in het embryo:

1. **Cranio-caudale (hoofd-staart) vouw:**  
Het embryo buigt zich ook van boven naar beneden, dus van het hoofd naar het staartgedeelte. 

2. **Laterale (zijwaartse) vouwen:**  
De zijkanten van het embryo vouwen naar binnen toe richting de middellijn.

Deze combinaties van vouwen *rollen* het embryo als het ware op, waardoor een cilindervorm ontstaat en de dooierzak aan de binnenkant komt te liggen.

Kun je nu uitleggen wat deze plooivorming betekent voor de positie van de organen en de kiemlagen? Wat verandert er aan de binnen- en buitenkant van het embryo?",2025-09-17T16:21:13.325683+00:00
user,"Hart ligt dan toch een beetje uit, op een andere plek dan waar het normaal gesproken terecht komt",2025-09-17T16:23:51.938918+00:00
assistant,"Interessante gedachte! Je haalt aan dat de positie van organen, zoals het hart, verandert door de plooivorming. Inderdaad, het hart en andere structuren verplaatsen zich tijdens deze vouwen naar hun uiteindelijke ligging.

Kun je dat idee verder uitwerken? 
Denk er bijvoorbeeld aan:  
- Waar komen de kiemlagen (endoderm, mesoderm, ectoderm) ten opzichte van elkaar te liggen na het vouwen?
- Wat ontstaat er aan de binnenkant van het embryo, en wat wordt de buitenkant?

Kun je dit stapje verder proberen uit te leggen?",2025-09-17T16:24:10.782915+00:00
assistant,"**OVERALL SUMMARY**  
Je hebt enthousiast deelgenomen en de basis goed opgepakt! Je herkent belangrijke concepten en denkt actief mee over vervolgvragen. Je doorloopt de beginstappen van embryologische kennis kundig en blijft proberen, ook als het even lastig wordt.

**WHAT YOU DID WELL**
- **Strong Grasp of:** De drie kiemlagen (endoderm, mesoderm, ectoderm) benoem je snel en juist. Ook het proces van gastrulatie kun je kort en daarna specifieker verklaren.
- **Good Application of:** Je koppelt plooivorming aan de verandering in vorm van het embryo. Je maakt daarnaast een goede poging om te bedenken wat de gevolgen zijn voor de ligging van organen.

**AREAS FOR GROWTH & FOCUS**
- **Connecting the Dots:** Het uitleggen van de details bij embryonale plooivorming kan sterker. Het is belangrijk niet alleen te benoemen *dat* het embryo opkrult, maar ook wat dat betekent voor de precieze ligging van de kiemlagen en waar 'binnen' en 'buiten' nu precies zijn. Dit helpt straks om afwijkingen zoals gastroschisis beter te begrijpen.

**ACTIONABLE STUDY RECOMMENDATIONS**
Omdat het verbinden van concepten en processen soms nog lastig is, raad ik aan:
- **Maak schematische tekeningen of conceptmaps van embryonale plooivorming.** Teken de kiemlagen vóór en ná het vouwen en geef (met pijlen of kleuren) aan wat er naar binnen en naar buiten draait. Dit maakt inzichtelijk wat plooivorming betekent voor de positie van organen en de kiemlagen.

Blijf zo doorgaan: je stelt goede vragen en bouwt stap voor stap aan inzicht!",2025-09-17T16:26:02.482+00:00
