role,content,created_at
user,laten we beginnen,2025-09-17T14:46:37.758074+00:00
assistant,"Hier komt de klinische casus die we gaan gebruiken:

Een gezonde 25-jarige vrouw had routine prenatale zorg. Bij een echo op 24 weken zwangerschap werd een kleine opening (~5 mm) aan de rechterzijde van de buik van de baby gezien, dichtbij de navelstreng. Genetisch onderzoek (via vruchtwaterpunctie) op 26 weken was normaal. In de loop der weken werd de opening groter (tot 34 mm), en delen van de darmen van de baby zweefden in het vruchtwater. De metingen van de baby waren kleiner dan verwacht. Op 37 weken werd een keizersnede uitgevoerd. De pasgeboren jongen had delen van de dunne en dikke darm, en de maag, buiten de buik. De ondersteunende weefsels waren kort, en de darm zag er opgezwollen uit. De diagnose was gastroschisis, een buikwanddefect.

Mijn eerste vraag:  
Wat is gastrulatie?",2025-09-17T14:46:51.962744+00:00
user,gastrulatie is de fase waarbij de epiblast en hypoblast veranderen naar de 3 kiemlagen,2025-09-17T14:47:55.689201+00:00
assistant,"Precies, je zit al goed! Gastrulatie is inderdaad de fase waarin uit de epiblast drie kiemlagen ontstaan.  

Kun je de namen geven van deze drie kiemlagen?",2025-09-17T14:48:13.671464+00:00
user,ectorderm endoderm en mesoderm,2025-09-17T14:48:22.424886+00:00
assistant,"Goed zo! Dat klopt helemaal: ectoderm, endoderm en mesoderm zijn de drie kiemlagen.

Nu een volgende basisvraag:  
Wat is embryonale vouw (embryonic folding)?",2025-09-17T14:48:28.09169+00:00
user,de kop en de staart vouwen naar elkaar toe,2025-09-17T14:48:42.981914+00:00
user,en de embryo vouwt in elkaar,2025-09-17T14:50:51.083241+00:00
assistant,"Dat is het goede idee, maar kun je iets specifieker zijn?  
De laterale kanten — bedoel je dat de zijkanten van het embryo naar beneden bewegen? Of gebeurt er nog iets anders met de positie van bijvoorbeeld de dooierzak of de kiemlagen?

Denk bijvoorbeeld aan: wat gebeurt er met de binnenkant versus de buitenkant van het embryo tijdens deze vouw?",2025-09-17T14:50:58.602326+00:00
user,de de zijkanten vouwen naar beneden en de hoofd kant en staart kant vouwen naar elkaar toe,2025-09-17T14:51:56.815138+00:00
assistant,"Heel goed! Dus tijdens de embryonale vouw buigen de zijkanten (laterale vouwen) naar beneden en naar het midden toe, en de kop- en staartkant vouwen ook naar elkaar toe. Hierdoor krijgt het embryo zijn typische ""buizenshape"" en gaan de kiemlagen de juiste plaatsen innemen.

Laten we nog één basisvraag doen:  
Kun je uitleggen wat morphogenese betekent?",2025-09-17T14:52:04.502735+00:00
user,dat is het proces waarbij de cellen zichzelf vormgeven om iets te vormen,2025-09-17T14:52:48.732471+00:00
assistant,"Dat klopt helemaal! Morphogenese is inderdaad het proces waarbij cellen georganiseerde structuren en vormen creëren in het embryo.

Mijn volgende vraag:  
Kun je de vier hoofd-onderdelen (subdivisies) van het mesoderm noemen?",2025-09-17T14:52:54.809701+00:00
user,axiaal lateraal paraxiaal intermediar,2025-09-17T14:54:51.562375+00:00
assistant,"Uitstekend, je hebt ze allemaal genoemd: axiaal, paraxiaal, intermediair en lateraal plaat mesoderm.

Welke vorm van het mesoderm vormt de lichaamswanden en de bekleding van de lichaamsholten?",2025-09-17T14:54:57.437863+00:00
user,intermediair,2025-09-17T14:55:16.224306+00:00
assistant,"Bijna goed! Denk nog eens na: het intermediair mesoderm speelt vooral een rol bij de vorming van organen zoals de nieren en het urogenitale systeem.  
Welke mesoderm-subdivisie splitst zich in een visceraal (splanchnisch) en een pariëtaal (somatisch) blad en vormt zo de wand van lichaams- en orgaanholten?",2025-09-17T14:55:32.202394+00:00
user,paraxiaal,2025-09-17T14:55:41.915137+00:00
assistant,"Niet helemaal: het paraxiaal mesoderm vormt vooral de somieten die onder andere uitgroeien tot spieren en het axiale skelet.

Denk eens aan het mesoderm dat aan de zijkant van het embryo ligt en zich opdeelt in twee bladen, die de wand van de lichaams- en orgaanholten vormen. Hoe heet deze subdivisie?",2025-09-17T14:55:50.220617+00:00
user,lateraaal,2025-09-17T14:55:58.450596+00:00
assistant,"Precies! Het laterale plaatmesoderm splitst zich in een visceraal (splanchnisch) en een pariëtaal (somatisch) blad. Deze vormen samen de bekleding van de lichaamswand en de organen.

Nu een laatste basisvraag voordat we naar de volgende stap gaan:  
Kun je uitleggen wat met de termen “ventraal” en “dorsaal” wordt bedoeld bij het embryo?",2025-09-17T14:56:08.644612+00:00
user,ventraal is de buikkant en dorsaal de rug kant,2025-09-17T14:56:31.983926+00:00
assistant,"Helemaal juist! Ventrale zijde is de buikzijde, dorsale zijde is de rugzijde van het embryo.

Goed, je beheerst de termen. We gaan nu dieper in op de processen.  
Kun je uitleggen wat er gebeurt tijdens gastrulatie? Wat zijn de belangrijkste stappen?",2025-09-17T14:56:38.007218+00:00
user,de epiblast gaat door de primitieve streep en vormt de endoderm en daarna de mesoderm en het beetje bovenop verandert in de ectoderm,2025-09-17T14:57:33.559368+00:00
assistant,"Mooi uitgelegd! Inderdaad, tijdens gastrulatie migreren epiblastcellen door de primitieve streep; eerst vormen ze het endoderm, daarna het mesoderm, en de cellen die achterblijven worden ectoderm. Daarmee ontstaan de drie kiemlagen.

Waarom is gastrulatie zo belangrijk voor de verdere ontwikkeling van het embryo?",2025-09-17T14:57:40.972398+00:00
user,omdat die kiemlagen zich specialiseren naar de verschillende delen in het lichaam,2025-09-17T14:58:16.045055+00:00
assistant,"Heel goed, inderdaad! Gastrulatie is essentieel omdat de drie kiemlagen zich verder differentiëren tot alle weefsels en organen van het lichaam. Zonder deze stap zouden de “bouwstenen” voor orgaanvorming ontbreken.

Nu een andere procesvraag:  
Kun je uitleggen wat het gevolg is van embryonale vouwing voor de positie van de dooierzak en de aanleg van de lichaamswand?",2025-09-17T14:58:24.63823+00:00
user,nee dat weet ik neit,2025-09-17T14:58:56.54252+00:00
assistant,"Geen probleem! Wat weet je nog van de ligging van de dooierzak vóór de vouwing? Was die aan de binnenkant, aan de zijkant, of juist buiten het embryo gelegen?

Probeer eens te bedenken: als het embryo om zichzelf heen vouwt, wat gebeurt er dan met het grootste deel van de dooierzak?",2025-09-17T14:59:03.503934+00:00
user,de dooierzak komt in de embryo te liggen?,2025-09-17T14:59:20.297182+00:00
assistant,"Je zit in de goede richting! Tijdens de embryonale vouwing wordt een deel van de dooierzak inderdaad ""ingesloten"" in het embryo. Dat vormt de oerdarm (de toekomstige spijsverteringsbuis).  

Maar wat gebeurt er met de rest van de dooierzak en wat gebeurt er met de lichaamswand tijdens deze vouwing? Wil je dit nog verder proberen uit te leggen?",2025-09-17T14:59:28.333277+00:00
user,ik weet het niet,2025-09-17T14:59:40.742526+00:00
assistant,"Dat is prima, het is een lastig onderwerp! Even samengevat:  
Tijdens de embryonale vouwing wordt een deel van de dooierzak ingesloten en vormt het oerdarmkanaal, terwijl de rest buiten het embryo blijft als de zogenaamde ""extra-embryonale"" dooierzak. Tegelijkertijd groeien de kiemlagen en sluiten ze aan de ventrale zijde, waardoor de lichaamswand en de toekomstige buikholte worden gevormd.

Wil je proberen uit te leggen waarom deze ventrale sluiting (sluiting aan de buikzijde) essentieel is voor het embryo? Wat zou er kunnen gebeuren als deze sluiting niet volledig plaatsvindt?",2025-09-17T14:59:53.005883+00:00
user,dan blijven de organen niet binnen het lichaam van de embryo,2025-09-17T15:00:19.628853+00:00
assistant,"Precies! Als de ventrale sluiting niet volledig plaatsvindt, dan kunnen organen zoals de darmen buiten het embryo blijven liggen, in plaats van netjes omsloten te worden door de buikwand.

Laatste procesvraag in deze stap:  
Kun je kort beschrijven hoe uit de drie kiemlagen de verschillende weefsels en organen ontstaan? (Dus: welke kiemlaag wordt wat?)",2025-09-17T15:00:29.668547+00:00
user,"endoderm vormt het alle binnenste van je lichaam zoals je zenuwstelsel, ectoderm word je huid en zo en mesoderm alles er tussen",2025-09-17T15:01:07.438859+00:00
assistant,"Je hebt het gedeeltelijk goed! Het ectoderm vormt inderdaad de huid, maar ook het zenuwstelsel (dus dat hoort bij ectoderm). Het endoderm vormt voornamelijk de binnenbekleding van het spijsverteringskanaal en enkele organen, terwijl het mesoderm de structuren ""ertussen"" vormt, zoals spieren, botten, bloedvaten en bindweefsel.

Wil je dit nog aanpassen, nu je deze tip hebt gekregen? Probeer nog één keer: welke kiemlaag vormt het zenuwstelsel, en welke kiemlaag vormt het spijsverteringskanaal?",2025-09-17T15:01:29.814893+00:00
user,endoderm vormt de bekleding van de darmen mesoderm alles ertussen en ectoderm de huid en zenuwstelsel,2025-09-17T15:02:02.30997+00:00
assistant,"Helemaal juist! Nu klopt het:  
- Endoderm: vormt de bekleding van de darmen en inwendige organen.
- Mesoderm: vormt de structuren daartussen, zoals spieren, botten en bloedvaten.
- Ectoderm: vormt de huid én het zenuwstelsel.

Nu gaan we deze kennis toepassen op de casus die we in het begin hadden:

De casus was:
Een gezonde 25-jarige vrouw had routine prenatale zorg. Bij een echo op 24 weken zwangerschap werd een opening gezien aan de buik van de baby. Die werd groter, en delen van de darmen en maag kwamen buiten het lichaam te liggen. De rest van de zwangerschap verliep zonder genetische afwijkingen.

Kun je uitleggen wat er in dit geval gebeurd is met de kennis die je zojuist hebt besproken?",2025-09-17T15:02:14.710391+00:00
user,de buikwad is niet goed gevormd waardoor de darmen niet binnen het lichaam zijn gesloten,2025-09-17T15:02:34.272599+00:00
assistant,"Dat is volledig juist: de buikwand is niet goed gesloten, waardoor de darmen buiten het embryonale lichaam terecht zijn gekomen.

Kun je nu uitleggen wélke stap in de embryonale ontwikkeling was verstoord, en waardoor dit zich vooral uit aan de ventrale (buik-)zijde? Probeer daarbij te benoemen welk proces en welk soort mesoderm hier een rol speelt.",2025-09-17T15:02:41.871787+00:00
user,het is fout gegaan bij de embryonale vouwing dit gaat vooral aan de buikzijde fout omdat het lichaam naar de ventralen kant vouwt en het mesoderm speelt hier een rol omdat het de buikwand vormt,2025-09-17T15:04:06.132093+00:00
assistant,"Mooi geantwoord! Je trekt goede verbanden. Tijdens de embryonale vouwing hoort de ventrale zijde te sluiten onder invloed van het laterale plaatmesoderm dat onder andere de buikwand vormt. Als die sluiting niet goed verloopt, ontstaat er een defect aan de buikkant.

Een laatste vraag hierbij:  
Waarom kan een kind met dit defect (gastroschisis) tijdens de zwangerschap kleiner blijven dan verwacht, terwijl het defect vooral aan de buikwand is? Probeer je redenering uit te leggen.",2025-09-17T15:04:18.222592+00:00
user,omdat het lichaampje zich niet fatsoenlijk vormt word de groei verstoord,2025-09-17T15:05:08.612243+00:00
assistant,"Je hebt gelijk dat een verstoorde lichaamsbouw invloed kan hebben op de groei, maar zou er misschien ook iets kunnen zijn met voeding of bescherming van de organen? Waarom zouden darmen buiten het lichaam liggen nadelige gevolgen kunnen hebben voor de ontwikkeling van het kind? Wil je dat verder proberen toe te lichten?",2025-09-17T15:05:15.853418+00:00
user,misschien neemt die dan niet genoeg voeding stoffen op,2025-09-17T15:05:37.277218+00:00
assistant,"Goed bedacht! Ja, als de darmen zich buiten het lichaam bevinden, kunnen ze minder goed functioneren. Ze zijn minder beschermd en kunnen last krijgen van het vruchtwater, waardoor ze ontstoken raken of minder goed voedingsstoffen uitwisselen. Dit kan de groei van het kind belemmeren.

Je hebt nu laten zien dat je het proces begrijpt!  
Hier komt de afsluitende vraag:

Hoe begrijp je nu de oorzaken achter de klinische bevindingen in dit geval? Noteer elk detail dat je kunt bedenken — je ideeën, je redenering, en verbanden met wat je zojuist hebt geleerd. Hoe vollediger jouw uitleg, hoe sterker je het onderwerp beheerst en voorbereid bent op een toekomstig tentamen of op het herkennen van gastroschisis!",2025-09-17T15:05:50.585732+00:00
assistant,"**OVERALL SUMMARY**  
Je hebt hard gewerkt en je kennis stukje bij beetje opgebouwd! Je laat zien dat je veel belangrijke termen herkent en het lukt je goed om concepten stap voor stap te koppelen aan een klinisch probleem. Mooi om te zien hoe je met hints en uitleg je antwoorden corrigeert en verdiept!

**WHAT YOU DID WELL**
- **Strong Grasp of:** Je herkent en benoemt de drie kiemlagen netjes, kent veel voorkomende termen als “ventraal”, “dorsaal” en weet waar het ectoderm, mesoderm en endoderm voor zorgen. Ook kun je op hoofdlijnen goed beschrijven wat gastrulatie, morphogenese en embryonale vouwing zijn.
- **Good Application of:** Je slaagt er in je kennis toe te passen bij het verklaren van gastroschisis, en je kunt uitleggen waar het ontwikkelingsprobleem rond de buikwand zijn oorsprong vindt. Je toont inzicht in het belang van embryonale processen en durft je antwoorden aan te passen na feedback.

**AREAS FOR GROWTH & FOCUS**
- **Reviewing Key Terms:** Soms haal je functietoewijzingen (bijvoorbeeld zenuwstelsel versus darmbekleding) nog wat door elkaar. Blijf scherp op de details!
- **Connecting the Dots:** Je vond het lastig om zonder hints precies uit te leggen wat er gebeurt met de dooierzak en de volledige gevolgen van embryonale vouwing voor de aanleg van de buikwand. Hier mag je nog wat meer vanzelf proberen te redeneren vanuit de embryologische processen.
- **Applying Theory to Practice:** In de casusdenkvraag over groei had je behoefte aan extra sturing om de link te leggen met voeding en orgaanfunctie. Het automatisch meenemen van secundaire gevolgen vergt nog wat meer oefening.

**ACTIONABLE STUDY RECOMMENDATIONS**
Je uitdaging zit vooral in het ‘samenbrengen’ van losse kennis tot een logisch proces en het uitdenken van gevolgen in een klinische context. 

**Mijn tip:**  
Teken een overzichtelijke concept map of tijdlijn van de belangrijkste stappen in de embryonale ontwikkeling van de buikwand. Schrijf per stap erbij welk weefsel betrokken is, welke kiemlaag en welke mogelijke stoornis hieruit volgt. Dit helpt om het hele proces ‘voor je te zien’ en de keten van oorzaak-gevolg logisch te blijven volgen! Zo wordt je klinisch redeneren steeds sterker.

Goed gewerkt, blijf oefenen — je bent al een eind op weg!",2025-09-17T15:07:45.291+00:00
