role,content,created_at
user,ik ben klaar om te beginnen,2025-09-17T13:16:21.659205+00:00
assistant,"Perfect! Hier is de klinische casus waarmee we aan de slag gaan:

Een gezonde 25-jarige vrouw had routine prenatale zorg. Tijdens een echo op 24 weken werd een kleine opening (~5 mm) aan de rechterkant van de buik van de baby, dicht bij de navelstreng, gezien. Later werd deze opening groter (tot 34 mm) en delen van de darmen kwamen in het vruchtwater te liggen. Na de geboorte bleken delen van de dunne en dikke darm en de maag buiten de buik te liggen. De diagnose was gastroschisis, een buikwanddefect.

Om te beginnen:  
Wat is embryonale vouwing (embryonic folding)?",2025-09-17T13:16:32.093095+00:00
user,dat is als een embryo van een 2D laag in een 3D laag gaat,2025-09-17T13:17:07.359048+00:00
assistant,"Heel goed! Embryonale vouwing is inderdaad het proces waarbij het embryo van een platte schijf (2D) wordt omgevormd tot een driedimensionale (3D) structuur. Hierdoor ontstaan de lichaamsvormen.

Kun je benoemen welke drie kiemlagen (germ layers) er ontstaan vroeg in de embryonale ontwikkeling?",2025-09-17T13:17:16.072981+00:00
user,"endoderm, ectoderm, mesoderm",2025-09-17T13:17:27.12456+00:00
assistant,"Precies goed! De drie kiemlagen zijn endoderm, ectoderm en mesoderm.

Kun je aangeven wat gastrulatie is?",2025-09-17T13:17:32.7542+00:00
user,gastrulatie is de differentiatie van de kiemlagen,2025-09-17T13:23:38.929145+00:00
assistant,"Dat is bijna juist! Gastrulatie is inderdaad het moment waarop de kiemlagen ontstaan, maar kun je specifieker beschrijven *hoe* gastrulatie plaatsvindt of wat het proces inhoudt? Wat gebeurt er tijdens gastrulatie met de cellen van het embryo?",2025-09-17T13:23:46.610668+00:00
user,de cellen van het embryo  migreren,2025-09-17T13:24:22.604033+00:00
assistant,"Dat klopt! Tijdens gastrulatie migreren de cellen van het embryo waardoor de drie kiemlagen ontstaan.

Kun je nu ook de vier subdivisions van het mesoderm noemen die ontstaan na gastrulatie?",2025-09-17T13:24:33.501966+00:00
user,"paaraxial mesoderm wat sich in sommigen ontwikkelt in verschillende Hogte niveaus. Deze ontwikkelt zich in thorax skelet, spieren en huid",2025-09-17T13:25:46.223083+00:00
assistant,"Goed, je noemt het paraxiale mesoderm en beschrijft correct dat het zich ontwikkelt tot structuren zoals wervels, skeletspieren en dermis.  

Er zijn echter in totaal vier subdivisions van het mesoderm. Kun je de andere drie subdivisions ook noemen? Misschien dat je er al één weet?",2025-09-17T13:26:15.091741+00:00
user,para-axial mesoderm is er een toch?,2025-09-17T13:28:08.105588+00:00
assistant,"Klopt! Het paraxiale mesoderm is er één.

Naast het paraxiale mesoderm zijn er nog drie andere subdivisions. Kun je je herinneren hoe ze heten? Als je vastloopt, denk dan aan de ligging (middenlijn, meer naar buiten...).

Wat weet je van de andere gebieden van het mesoderm?",2025-09-17T13:28:15.327393+00:00
user,lateraal mesoderm?,2025-09-17T13:28:28.870801+00:00
assistant,"Ja, het laterale plaatmesoderm (lateral plate mesoderm) is er ook één!

Tot nu toe heb je genoemd:  
- Paraxiaal mesoderm  
- Laterale plaatmesoderm

Er zijn nog twee te gaan — eentje dicht bij de centrale as van het embryo en eentje tussen het paraxiale en het laterale plaatmesoderm. Kun je deze nog noemen?",2025-09-17T13:28:37.281443+00:00
user,ne helaas niet,2025-09-17T13:28:48.927017+00:00
assistant,"Geen probleem! Je hebt al een goed begin. De andere twee subdivisions zijn:

- Axiaal mesoderm (ook wel chorda of notochord genoemd): ligt precies in het midden en vormt onder andere de chorda dorsalis.
- Intermediair mesoderm: ligt tussen het paraxiale en het laterale plaatmesoderm en ontwikkelt zich tot onderdelen van het urogenitaalstelsel.

Wil je verder gaan met een volgende basisvraag?

Wat betekent de termen ventraal en dorsaal in relatie tot een embryo?",2025-09-17T13:28:59.057323+00:00
user,voorkant is ventraal en dorsaal is de achterkant. Ventral is ook soms rostraal omdat de craniale deel naar voren omklapt.,2025-09-17T13:30:11.710871+00:00
assistant,"Goed uitgelegd! Ventraal is inderdaad de voorkant (buikzijde), dorsaal is de achterkant (rugzijde) van het embryo. Je opmerking over rostraal klopt in veel dieren, maar bij mensen is het belangrijk onderscheid te maken:  
- Rostraal betekent richting het hoofd (craniaal),  
- Caudaal betekent richting de staart (voeten).  
Door de embryonale kromming kan dit inderdaad een beetje verwarrend worden.

Kun je nu het verschil toelichten tussen visceraal (splanchnisch) en parietaal (somatisch) mesoderm in het laterale plaatmesoderm?",2025-09-17T13:30:21.918166+00:00
user,visceraal (slpanchnisch) is voor de maag-darm-lever en pancreas organase en somatisch mesoderm is voor de spieren,2025-09-17T13:31:38.094625+00:00
assistant,"Je hebt een goed begin! Het visceraal (splanchnisch) mesoderm vormt inderdaad organen zoals de darmen en andere ingewanden. Het pariëtaal (somatisch) mesoderm heeft echter een andere functie dan alleen spieren.

Heb je al een idee welke lichaamsstructuren het pariëtaal mesoderm precies vormt? Denk aan de bekleding en ondersteuning van de lichaamswand. Wat weet je hiervan?",2025-09-17T13:31:45.55097+00:00
user,dan misschien de viscerale en parietela membraan?,2025-09-17T13:32:40.157391+00:00
assistant,"Ja! Je zit in de goede richting. Het viscerale (splanchnische) mesoderm vormt het viscerale vlies rond organen, terwijl het pariëtale (somatische) mesoderm het pariëtale vlies langs de lichaamswand vormt.

Dus:
- **Visceraal (splanchnisch) mesoderm** → bekleding van de organen (bijv. het viscerale peritoneum)
- **Pariëtaal (somatisch) mesoderm** → bekleding van de lichaamswand (bijv. het pariëtale peritoneum) en vormt ook samen met ectoderm de buikwand.

Wil je nu verder met uitleggen *waarom* deze processen belangrijk zijn?  
Kun je uitleggen waarom gastrulatie een essentiële stap is in de embryonale ontwikkeling?",2025-09-17T13:32:52.628919+00:00
user,wat is gastrelatie nu precies? en vormen visceraal en parketaal mesoderm alleen ht peritoneum of nog andere dingen=,2025-09-17T13:33:54.215528+00:00
assistant,"Goede, diepgaande vragen!  
Laten we ze één voor één aanpakken.

1. **Wat is gastrulatie nu precies?**  
Gastrulatie is het proces waarbij de eenvoudige blastula (een holle bol van cellen) verandert in een gastrula met drie verschillende kiemlagen (ectoderm, mesoderm, endoderm). Dit gebeurt door celmigratie en -invaginatie. Tijdens gastrulatie ontstaat dus de basis voor alle weefsels in het lichaam, omdat elke kiemlaag later andere structuren vormt. 

2. **Vormen visceraal en pariëtaal mesoderm alleen het peritoneum of nog andere dingen?**  
Goede vraag. Beide vormen inderdaad het peritoneum, maar ze doen méér:
- **Visceraal (splanchnisch) mesoderm** vormt naast het viscerale peritoneum ook het bindweefsel en glad spierweefsel van het maagdarmkanaal, de bloedvaten van de ingewanden, het hart en delen van de longen.
- **Pariëtaal (somatisch) mesoderm** vormt samen met het ectoderm de lichaamswand, het pariëtale peritoneum, skeletcomponenten van de buikwand en bindweefsel, zoals dat in de ledematen.

Wil je één van deze definities of functies verder toelichten met je eigen woorden, of zullen we samen verdergaan met het belang van gastrulatie bespreken?",2025-09-17T13:34:13.802906+00:00
user,verder gaan,2025-09-17T13:34:50.562169+00:00
assistant,"Prima! 

Waarom is gastrulatie een essentiële stap in de embryonale ontwikkeling? Wat gebeurt er als deze stap niet goed verloopt?",2025-09-17T13:34:55.587537+00:00
user,miskraam,2025-09-17T13:35:39.693623+00:00
assistant,"Dat klopt: verstoringen in de gastrulatie kunnen inderdaad tot een miskraam leiden.

Kun je uitleggen *waarom* het zo ernstig is als gastrulatie niet goed verloopt? Wat missen embryo's waarbij de gastrulatie faalt?",2025-09-17T13:35:46.119529+00:00
user,"ze missen eigenlijk alle organen, kunnen bijvoorbeeld überhaupt geen hart maken",2025-09-17T13:36:14.655866+00:00
assistant,"Precies! Zonder gastrulatie ontstaan de drie kiemlagen niet, en dus kunnen de organen zich niet ontwikkelen. Het embryo zou inderdaad geen hart, geen hersenen, geen darmen en geen andere organen kunnen vormen.

Laten we nu verder gaan naar een ander belangrijk proces:

Waarom is embryonale vouwing (embryonic folding) zo belangrijk voor de ontwikkeling van het embryo? Wat ontstaat er door deze vouwing?",2025-09-17T13:36:25.97916+00:00
user,"omdat door vouwing de organen ontstaan, we dragen in cirkels toch?",2025-09-17T13:37:23.079901+00:00
assistant,"Dat is een goed uitgangspunt! Door embryonale vouwing krijgen de inwendige organen inderdaad hun plek, en wordt het embryo van een platte schijf een buis (met lichaamsholte). 

Wil je proberen toe te lichten *wat* er precies omvouwt tijdens embryonale vouwing, of in welke richtingen er wordt gevouwen? Heb je daar al ideeën over?",2025-09-17T13:37:31.295231+00:00
user,"de neurale buis bijvoorbeeld in week 3-4, het neuro ectoderm vouwt zich en sluit zich dan dorsaal, zodat er een buis ontstaan",2025-09-17T13:38:34.27061+00:00
assistant,"Erg goed! De neurale buis is inderdaad een belangrijk voorbeeld van vouwen: het ectoderm boven de chorda dorsalis vouwt en sluit zich, zodat de neurale buis ontstaat (voorloper van het centrale zenuwstelsel).

Naast de neurale buisvoming zijn er ook andere vouwing-bewegingen die belangrijk zijn voor de *lichaamsvorm* en inwendige holtes. Wat weet je van de laterale en cranio-caudale vouwing van het embryo? Welke rol spelen deze in het ontstaan van de buikholte en buikwand?",2025-09-17T13:38:44.96838+00:00
user,cranio cauda wordt het hart gevormd,2025-09-17T13:39:31.639246+00:00
assistant,"Klopt! De cranio-caudale vouwing zorgt ervoor dat het hart—dat aanvankelijk meer craniaal (richting het hoofd) ligt—naar de juiste plek in de borstkas terechtkomt.

Hoe zit het met *laterale* vouwing: wat gebeurt er tijdens dit proces, en waarom is het belangrijk voor het sluiten van de buikwand?",2025-09-17T13:39:41.622757+00:00
user,anders krijg je gastrochisis,2025-09-17T13:39:57.00905+00:00
assistant,"Precies! Als de laterale vouwing niet goed verloopt, kan er een defect ontstaan in de buikwand—zoals bij gastroschisis.

Kun je uitleggen hoe de laterale vouwing normaal verloopt, en wat er structureel moet gebeuren om de buikwand netjes te sluiten?",2025-09-17T13:40:04.608289+00:00
user,"ne, doe mar",2025-09-17T13:40:18.819975+00:00
assistant,"Geen probleem. Denk eraan dat het leerzaam is om eerst even zelf te proberen: kun je herinneren wat er gebeurt als de linker- en rechterzijden van het embryo naar elkaar toe bewegen?

Zo niet: stel je voor dat je een platte schijf hebt die langzaam rond wordt, en de zijranden naar beneden en naar het midden toe buigen—wat gebeurt er met het 'binnenste' (darmen) en het 'buitenste' (buikwand)?

Wil je het hiermee proberen?",2025-09-17T13:40:27.595164+00:00
assistant,"**OVERALL SUMMARY**  
Goed gedaan! Je toont inzet, nieuwsgierigheid en een actieve leerhouding in deze embryologie-oefening. Je durft door te vragen als iets niet helemaal duidelijk is en je laat zien dat je veel kernbegrippen paraat hebt.

**WHAT YOU DID WELL**
- **Strong Grasp of:**  
  Je kent de kerntermen zoals embryonale vouwing, de drie kiemlagen (ectoderm, endoderm, mesoderm) en gastrulatie. Je herkende ook het onderscheid tussen viscerale en pariëtale membranen en wist de basis van hun functies te benoemen.
- **Good Application of:**  
  Je bracht je kennis in verband met klinische casussen, zoals het ontstaan van gastroschisis bij een fout in de laterale vouwing. Ook begreep je de consequentie van verstoorde gastrulatie (miskraam/geen organen).

**AREAS FOR GROWTH & FOCUS**
- **Connecting the Dots:**  
  Soms bleef je bij je uitleg wat hangen op hoofdlijnen (“embryo van 2D naar 3D”, “door vouwing ontstaan organen”) zonder de details van de tussenliggende stappen en mechanieken te benoemen (zoals de precieze bewegingen bij laterale vouwing). 
- **Reviewing Key Terms:**  
  Het onderscheid tussen de vier subdivisions van het mesoderm was lastig; met name bij het benoemen van intermediair en axiaal mesoderm. Ook raakte het onderscheid tussen structuren gevormd uit visceraal en pariëtaal (somatisch) mesoderm soms verward.
- **Applying Theory to Practice:**  
  Je gaf vaak het juiste klinische gevolg (“anders krijg je gastroschisis”) maar bleef wat oppervlakkig in de uitleg van het onderliggende proces, of wilde liever dat de uitleg werd overgenomen.

**ACTIONABLE STUDY RECOMMENDATIONS**  
Omdat het verdiepen en visueel maken van processen zoals vouwing en kiemlaag-ontwikkeling jou kan helpen bij het begrijpen én uitleggen:

- **Maak een conceptmap of tekening** van de vroege embryo-ontwikkeling, waarbij je de verschillende kiemlagen, hun afgeleiden en de vouwing (met pijltjes!) in beeld brengt. Benoem hierbij per laag welke structuren eruit ontstaan en geef aan hoe een verstoring (zoals bij gastroschisis) door een fout in het proces kan ontstaan.  
Deze visuele oefening helpt je om de stappen te concretiseren en verbanden duidelijker te zien. Succes!",2025-09-17T13:41:52.59+00:00
user,i want to do this in English please,2025-09-17T15:15:07.709794+00:00
assistant,"Of course, we’ll use English throughout. Here’s the clinical vignette to give context as you start learning about the key processes of embryonic development:

A healthy 25-year-old woman had routine prenatal care. At 24 weeks of pregnancy, an ultrasound revealed a small opening (~5 mm) on the right side of the baby’s belly, near the umbilical cord. Genetic tests (amniotic fluid analysis) at 26 weeks were normal. Over time, the opening enlarged (up to 34 mm), and parts of the baby’s intestines were seen floating in the amniotic fluid. The baby also measured smaller than expected. At 37 weeks, a caesarean section was performed. The newborn boy had parts of his small and large intestines, and stomach, located outside the abdomen. The supporting tissue was short, and the bowel appeared swollen. The diagnosis was gastroschisis, a defect in the abdominal wall.

Let’s begin with a basic question to ground your understanding:

What is gastrulation in embryonic development?",2025-09-17T15:15:21.938648+00:00
user,lets start,2025-09-17T15:15:34.824195+00:00
assistant,"Perfect! Here’s our first foundational question, connected to your learning objective:

What is gastrulation in embryonic development?",2025-09-17T15:15:39.463277+00:00
user,"hey, I want to start",2025-09-17T15:16:07.32911+00:00
assistant,"Great! Let's get started.

Here’s a short clinical case to set the scene for our learning:

A healthy 25-year-old woman had routine prenatal care. At 24 weeks of pregnancy, an ultrasound revealed a small opening (~5 mm) on the right side of the baby’s belly, near the umbilical cord. Genetic tests (amniotic fluid analysis) at 26 weeks were normal. Over time, the opening enlarged (up to 34 mm), and parts of the baby’s intestines were seen floating in the amniotic fluid. The baby also measured smaller than expected. At 37 weeks, a caesarean section was performed. The newborn boy had parts of his small and large intestines, and stomach, located outside the abdomen. The supporting tissue was short, and the bowel appeared swollen. The diagnosis was gastroschisis, a defect in the abdominal wall.

Let’s start with something fundamental:  
What is gastrulation?",2025-09-17T15:16:20.905404+00:00
user,can you explain it to me please,2025-09-17T15:16:50.273583+00:00
assistant,I'd like *you* to try first! What do you already know about gastrulation? Even just a few words or a rough idea is a great place to start.,2025-09-17T15:16:55.33503+00:00
user,I think its where the egg and the sperm have fused and start building new embryologic cells,2025-09-17T15:17:21.615132+00:00
assistant,"You're on the right track—gastrulation happens early in embryonic development, after the fertilized egg has formed a structure with more cells. Let's clarify a bit:

The fusion of the egg and sperm is called fertilization. After fertilization, the embryo goes through several stages before gastrulation begins.

What about the following:  
What occurs just before gastrulation, and what is the main result of the gastrulation process? (Hint: Think about the layers that form in the embryo.)",2025-09-17T15:17:30.612878+00:00
user,"no idea, u tell me",2025-09-17T15:18:07.315349+00:00
assistant,"Let’s break it down step by step! Before I explain, can you recall if you’ve heard the terms “germ layers” or “three layers of the embryo”? Sometimes these are covered early in development topics. Do those terms ring a bell, or are they unfamiliar?",2025-09-17T15:18:14.716793+00:00
user,"endoderm, ectoderm and mesoderm",2025-09-17T15:18:43.559322+00:00
assistant,"Excellent! Yes, those are the three germ layers. 

Gastrulation is the process by which these three germ layers—endoderm, mesoderm, and ectoderm—form from a single-layered structure in the early embryo.

Let’s stay with the basics for a bit:  
Can you name what each of these germ layers generally gives rise to in the body? For example, what kinds of structures or organs come from the endoderm, mesoderm, and ectoderm?",2025-09-17T15:18:51.793263+00:00
user,"endoderm makes organs, mesoderm makes muscles, ectoderm makes epidermis",2025-09-17T15:19:21.665996+00:00
assistant,"Great start—you’ve captured some of the main ideas! Let’s see if we can specify a little more for each layer:

- The **ectoderm** does form the epidermis (skin surface), but also other structures.  
- The **mesoderm** includes muscles, and also some other important tissue types.  
- The **endoderm** forms some organs—can you think of which organ systems it especially contributes to? For example, does it help make the gut lining, lungs, or something else?

Try to fill in one or two examples for each germ layer. What do you think?",2025-09-17T15:19:32.088373+00:00
